
                          __
          ___ ___   _ __ /\_\
        /' __` __`\/\`'__\/\ \
        /\ \/\ \/\ \ \ \/ \ \ \
        \ \_\ \_\ \_\ \_\ _\ \ \
         \/_/\/_/\/_/\/_//\ \_\ \
                         \ \____/
                          \/___/


[INFO] The time right now is 2025-08-12 22:40:39.137947568 UTC
[INFO] I'm only looking for PRs where the base branch is "main"
[INFO] I'm sorting PRs based on "creation date" in the "ascending" direction


=============
  dhth/mrj-runner
=============

-> checking PR #7
        ci: bump actions/checkout from 4 to 5
        https://github.com/dhth/mrj-runner/pull/7
        Created: Tue, 12 Aug 2025 04:28:42 +0000
        Updated: Tue, 12 Aug 2025 04:28:43 +0000
        [ author ]   "dependabot[bot]" is in the list of trusted authors
        [ check  ]   "lint-sh" concluded with desired status: "success"
        [ check  ]   "lint-workflows" concluded with desired status: "success"
        [ check  ]   "validate" concluded with desired status: "success"
        [ check  ]   "lint-yaml" concluded with desired status: "success"
        [ check  ]   "changes" concluded with desired status: "success"
        [ state  ]   "unknown" is undesirable ❌


=============
  dhth/squish
=============

-> checking PR #39
        ci: bump taiki-e/install-action from 2.57.6 to 2.58.9
        https://github.com/dhth/squish/pull/39
        Created: Mon, 11 Aug 2025 22:10:27 +0000
        Updated: Mon, 11 Aug 2025 22:10:28 +0000
        [ author ]   "dependabot[bot]" is in the list of trusted authors
        [ check  ]   "audit" concluded with desired status: "success"
        [ check  ]   "lint-yaml" concluded with desired status: "success"
        [ check  ]   "lint-workflows" concluded with desired status: "success"
        [ check  ]   "test (macos-latest)" concluded with desired status: "success"
        [ check  ]   "test (ubuntu-latest)" concluded with desired status: "success"
        [ check  ]   "build (macos-latest)" concluded with desired status: "success"
        [ check  ]   "build (ubuntu-latest)" concluded with desired status: "success"
        [ check  ]   "lint" concluded with desired status: "success"
        [ check  ]   "changes" concluded with desired status: "success"
        [ state  ]   "blocked" is undesirable ❌


=============
  dhth/ecscope
=============

-> checking PR #56
        ci: bump actions/download-artifact from 4 to 5
        https://github.com/dhth/ecscope/pull/56
        Created: Mon, 11 Aug 2025 02:37:57 +0000
        Updated: Mon, 11 Aug 2025 02:37:58 +0000
        [ author ]   "dependabot[bot]" is in the list of trusted authors
        [ check  ]   "custom-publish-crates" concluded with desired status: "success"
        [ check  ]   "publish-homebrew-formula" concluded with desired status: "success"
        [ check  ]   "announce" concluded with desired status: "success"
        [ check  ]   "build-local-artifacts (${{ join(matrix.targets, ', ') }})" concluded with desired status: "success"
        [ check  ]   "host" concluded with desired status: "success"
        [ check  ]   "build-global-artifacts" concluded with desired status: "success"
        [ check  ]   "back-compat" concluded with desired status: "success"
        [ check  ]   "dstlled-diff" concluded with desired status: "success"
        [ check  ]   "build-gleam" concluded with desired status: "success"
        [ check  ]   "build-rust" concluded with desired status: "success"
        [ check  ]   "publish-check" concluded with desired status: "success"
        [ check  ]   "test-gleam" concluded with desired status: "success"
        [ check  ]   "test-rust" concluded with desired status: "success"
        [ check  ]   "audit" concluded with desired status: "success"
        [ check  ]   "lint-yaml" concluded with desired status: "success"
        [ check  ]   "lint-workflows" concluded with desired status: "success"
        [ check  ]   "lint-rust" concluded with desired status: "success"
        [ check  ]   "lint-gleam" concluded with desired status: "success"
        [ check  ]   "changes" concluded with desired status: "success"
        [ check  ]   "plan" concluded with undesired status: "failure" ❌


=============
  dhth/dfft
=============

-> checking PR #46
        ci: bump actions/download-artifact from 4 to 5
        https://github.com/dhth/dfft/pull/46
        Created: Mon, 11 Aug 2025 03:56:21 +0000
        [ author ]   "dependabot[bot]" is in the list of trusted authors
        [ check  ]   "custom-publish-crates" concluded with desired status: "success"
        [ check  ]   "announce" concluded with desired status: "success"
        [ check  ]   "build-global-artifacts" concluded with desired status: "success"
        [ check  ]   "host" concluded with desired status: "success"
        [ check  ]   "publish-homebrew-formula" concluded with desired status: "success"
        [ check  ]   "build-local-artifacts (${{ join(matrix.targets, ', ') }})" concluded with desired status: "success"
        [ check  ]   "test-${{ matrix.os }}-${{ matrix.features.name }}" concluded with desired status: "success"
        [ check  ]   "dstlled-diff" concluded with desired status: "success"
        [ check  ]   "audit" concluded with desired status: "success"
        [ check  ]   "lint-${{ matrix.features.name }}" concluded with desired status: "success"
        [ check  ]   "build-${{ matrix.os }}-${{ matrix.features.name }}" concluded with desired status: "success"
        [ check  ]   "publish-check" concluded with desired status: "success"
        [ check  ]   "lint-workflows" concluded with desired status: "success"
        [ check  ]   "lint-yaml" concluded with desired status: "success"
        [ check  ]   "changes" concluded with desired status: "success"
        [ check  ]   "plan" concluded with undesired status: "failure" ❌


=============
  dhth/ting
=============

-> checking PR #16
        ci: bump actions/download-artifact from 4 to 5
        https://github.com/dhth/ting/pull/16
        Created: Mon, 11 Aug 2025 01:13:48 +0000
        [ author ]   "dependabot[bot]" is in the list of trusted authors
        [ check  ]   "custom-publish-crates" concluded with desired status: "success"
        [ check  ]   "publish-homebrew-formula" concluded with desired status: "success"
        [ check  ]   "announce" concluded with desired status: "success"
        [ check  ]   "host" concluded with desired status: "success"
        [ check  ]   "build-global-artifacts" concluded with desired status: "success"
        [ check  ]   "build-local-artifacts (${{ join(matrix.targets, ', ') }})" concluded with desired status: "success"
        [ check  ]   "build" concluded with desired status: "success"
        [ check  ]   "dstlled-diff" concluded with desired status: "success"
        [ check  ]   "publish-check" concluded with desired status: "success"
        [ check  ]   "test" concluded with desired status: "success"
        [ check  ]   "audit" concluded with desired status: "success"
        [ check  ]   "lint" concluded with desired status: "success"
        [ check  ]   "lint-workflows" concluded with desired status: "success"
        [ check  ]   "lint-yaml" concluded with desired status: "success"
        [ check  ]   "plan" concluded with undesired status: "failure" ❌


=============
  dhth/tbll
=============

-> checking PR #48
        ci: bump actions/download-artifact from 4 to 5
        https://github.com/dhth/tbll/pull/48
        Created: Mon, 11 Aug 2025 14:50:49 +0000
        [ author ]   "dependabot[bot]" is in the list of trusted authors
        [ check  ]   "custom-release-packages" concluded with desired status: "success"
        [ check  ]   "announce" concluded with desired status: "success"
        [ check  ]   "host" concluded with desired status: "success"
        [ check  ]   "publish-homebrew-formula" concluded with desired status: "success"
        [ check  ]   "build-global-artifacts" concluded with desired status: "success"
        [ check  ]   "build-local-artifacts (${{ join(matrix.targets, ', ') }})" concluded with desired status: "success"
        [ check  ]   "lint" concluded with desired status: "success"
        [ check  ]   "audit" concluded with desired status: "success"
        [ check  ]   "build" concluded with desired status: "success"
        [ check  ]   "test" concluded with desired status: "success"
        [ check  ]   "lint-workflows" concluded with desired status: "success"
        [ check  ]   "lint-yaml" concluded with desired status: "success"
        [ check  ]   "changes" concluded with desired status: "success"
        [ check  ]   "plan" concluded with undesired status: "failure" ❌


=============
  dhth/prs
=============

-> checking PR #42
        ci: bump actions/checkout from 4 to 5
        https://github.com/dhth/prs/pull/42
        Created: Tue, 12 Aug 2025 03:16:11 +0000
        Updated: Tue, 12 Aug 2025 03:16:12 +0000
        [ author ]   "dependabot[bot]" is in the list of trusted authors
        [ check  ]   "lint-workflows" concluded with desired status: "success"
        [ check  ]   "lint-yaml" concluded with desired status: "success"
        [ check  ]   "release-check" concluded with desired status: "success"
        [ check  ]   "vulncheck" concluded with undesired status: "failure" ❌

-> checking PR #43
        build: bump github.com/cli/go-gh/v2 from 2.12.1 to 2.12.2
        https://github.com/dhth/prs/pull/43
        Created: Tue, 12 Aug 2025 03:46:53 +0000
        Updated: Tue, 12 Aug 2025 03:46:54 +0000
        [ author ]   "dependabot[bot]" is in the list of trusted authors
        [ check  ]   "lint-workflows" concluded with desired status: "success"
        [ check  ]   "release-check" concluded with desired status: "success"
        [ check  ]   "lint-yaml" concluded with desired status: "success"
        [ check  ]   "test" concluded with desired status: "success"
        [ check  ]   "vulncheck" concluded with undesired status: "failure" ❌


=============
  dhth/tash
=============

-> checking PR #28
        build: bump clap from 4.5.42 to 4.5.43
        https://github.com/dhth/tash/pull/28
        Created: Tue, 12 Aug 2025 02:05:29 +0000
        Updated: Tue, 12 Aug 2025 02:05:30 +0000
        [ author ]   "dependabot[bot]" is in the list of trusted authors
        [ check  ]   "build (ubuntu-latest)" concluded with desired status: "success"
        [ check  ]   "lint-yaml" concluded with desired status: "success"
        [ check  ]   "test (ubuntu-latest)" concluded with desired status: "success"
        [ check  ]   "test (macos-latest)" concluded with desired status: "success"
        [ check  ]   "audit" concluded with desired status: "success"
        [ check  ]   "build (macos-latest)" concluded with desired status: "success"
        [ check  ]   "lint" concluded with desired status: "success"
        [ check  ]   "lint-workflows" concluded with desired status: "success"
        [ check  ]   "changes" concluded with desired status: "success"
        [ state  ]   "unknown" is undesirable ❌

-> checking PR #29
        ci: bump taiki-e/install-action from 2.57.6 to 2.58.9
        https://github.com/dhth/tash/pull/29
        Created: Tue, 12 Aug 2025 02:33:46 +0000
        [ author ]   "dependabot[bot]" is in the list of trusted authors
        [ check  ]   "test (macos-latest)" concluded with desired status: "success"
        [ check  ]   "test (ubuntu-latest)" concluded with desired status: "success"
        [ check  ]   "lint-workflows" concluded with desired status: "success"
        [ check  ]   "lint-yaml" concluded with desired status: "success"
        [ check  ]   "build (macos-latest)" concluded with desired status: "success"
        [ check  ]   "audit" concluded with desired status: "success"
        [ check  ]   "build (ubuntu-latest)" concluded with desired status: "success"
        [ check  ]   "lint" concluded with desired status: "success"
        [ check  ]   "changes" concluded with desired status: "success"
        [ state  ]   "clean" is desirable
        error 😵: couldn't merge PR


=============
  dhth/cueitup
=============

-> checking PR #68
        build: bump github.com/aws/aws-sdk-go-v2/config from 1.30.3 to 1.31.0
        https://github.com/dhth/cueitup/pull/68
        Created: Tue, 12 Aug 2025 07:22:41 +0000
        [ author ]   "dependabot[bot]" is in the list of trusted authors
        [ check  ]   "lint-workflows" concluded with desired status: "success"
        [ check  ]   "build-gleam" concluded with desired status: "success"
        [ check  ]   "release-check" concluded with desired status: "success"
        [ check  ]   "lint-gleam" concluded with desired status: "success"
        [ check  ]   "lint-yaml" concluded with desired status: "success"
        [ check  ]   "vulncheck" concluded with desired status: "success"
        [ check  ]   "test-go (ubuntu-latest)" concluded with desired status: "success"
        [ check  ]   "test-go (macos-latest)" concluded with desired status: "success"
        [ check  ]   "build-go (macos-latest)" concluded with desired status: "success"
        [ check  ]   "build-go (ubuntu-latest)" concluded with desired status: "success"
        [ check  ]   "lint-go" concluded with desired status: "success"
        [ check  ]   "changes" concluded with desired status: "success"
        [ state  ]   "unknown" is undesirable ❌

-> checking PR #69
        build: bump github.com/aws/aws-sdk-go-v2 from 1.37.2 to 1.38.0
        https://github.com/dhth/cueitup/pull/69
        Created: Tue, 12 Aug 2025 07:41:55 +0000
        Updated: Tue, 12 Aug 2025 07:41:56 +0000
        [ author ]   "dependabot[bot]" is in the list of trusted authors
        [ check  ]   "lint-yaml" concluded with desired status: "success"
        [ check  ]   "release-check" concluded with desired status: "success"
        [ check  ]   "lint-gleam" concluded with desired status: "success"
        [ check  ]   "lint-workflows" concluded with desired status: "success"
        [ check  ]   "build-gleam" concluded with desired status: "success"
        [ check  ]   "test-go (macos-latest)" concluded with desired status: "success"
        [ check  ]   "test-go (ubuntu-latest)" concluded with desired status: "success"
        [ check  ]   "vulncheck" concluded with desired status: "success"
        [ check  ]   "build-go (ubuntu-latest)" concluded with desired status: "success"
        [ check  ]   "build-go (macos-latest)" concluded with desired status: "success"
        [ check  ]   "lint-go" concluded with desired status: "success"
        [ check  ]   "changes" concluded with desired status: "success"
        [ state  ]   "unknown" is undesirable ❌

-> checking PR #70
        build: bump github.com/aws/aws-sdk-go-v2/service/sqs from 1.40.0 to 1.41.0
        https://github.com/dhth/cueitup/pull/70
        Created: Tue, 12 Aug 2025 11:25:43 +0000
        Updated: Tue, 12 Aug 2025 11:25:44 +0000
        [ author ]   "dependabot[bot]" is in the list of trusted authors
        [ check  ]   "lint-yaml" concluded with desired status: "success"
        [ check  ]   "lint-workflows" concluded with desired status: "success"
        [ check  ]   "build-gleam" concluded with desired status: "success"
        [ check  ]   "lint-gleam" concluded with desired status: "success"
        [ check  ]   "release-check" concluded with desired status: "success"
        [ check  ]   "build-go (ubuntu-latest)" concluded with desired status: "success"
        [ check  ]   "test-go (macos-latest)" concluded with desired status: "success"
        [ check  ]   "test-go (ubuntu-latest)" concluded with desired status: "success"
        [ check  ]   "vulncheck" concluded with desired status: "success"
        [ check  ]   "build-go (macos-latest)" concluded with desired status: "success"
        [ check  ]   "lint-go" concluded with desired status: "success"
        [ check  ]   "changes" concluded with desired status: "success"
        [ state  ]   "unknown" is undesirable ❌


=============
  dhth/tomo
=============

-> checking PR #50
        ci: bump actions/checkout from 4 to 5
        https://github.com/dhth/tomo/pull/50
        Created: Tue, 12 Aug 2025 01:17:35 +0000
        Updated: Tue, 12 Aug 2025 01:17:36 +0000
        [ author ]   "dependabot[bot]" is in the list of trusted authors
        [ check  ]   "announce" concluded with desired status: "success"
        [ check  ]   "custom-release-packages" concluded with desired status: "success"
        [ check  ]   "publish-homebrew-formula" concluded with desired status: "success"
        [ check  ]   "host" concluded with desired status: "success"
        [ check  ]   "build-global-artifacts" concluded with desired status: "success"
        [ check  ]   "build-local-artifacts (${{ join(matrix.targets, ', ') }})" concluded with desired status: "success"
        [ check  ]   "dstlled-diff" concluded with desired status: "success"
        [ check  ]   "audit" concluded with desired status: "success"
        [ check  ]   "release-check" concluded with desired status: "success"
        [ check  ]   "build (macos-latest)" concluded with desired status: "success"
        [ check  ]   "lint-workflows" concluded with desired status: "success"
        [ check  ]   "lint-yaml" concluded with desired status: "success"
        [ check  ]   "test (ubuntu-latest)" concluded with desired status: "success"
        [ check  ]   "test (macos-latest)" concluded with desired status: "success"
        [ check  ]   "build (ubuntu-latest)" concluded with desired status: "success"
        [ check  ]   "lint" concluded with desired status: "success"
        [ check  ]   "plan" concluded with undesired status: "failure" ❌

-> checking PR #51
        ci: bump taiki-e/install-action from 2.56.19 to 2.58.9
        https://github.com/dhth/tomo/pull/51
        Created: Tue, 12 Aug 2025 03:03:44 +0000
        Updated: Tue, 12 Aug 2025 03:03:45 +0000
        [ author ]   "dependabot[bot]" is in the list of trusted authors
        [ check  ]   "dstlled-diff" concluded with desired status: "success"
        [ check  ]   "test (ubuntu-latest)" concluded with desired status: "success"
        [ check  ]   "lint-workflows" concluded with desired status: "success"
        [ check  ]   "audit" concluded with desired status: "success"
        [ check  ]   "test (macos-latest)" concluded with desired status: "success"
        [ check  ]   "build (ubuntu-latest)" concluded with desired status: "success"
        [ check  ]   "build (macos-latest)" concluded with desired status: "success"
        [ check  ]   "lint-yaml" concluded with desired status: "success"
        [ check  ]   "release-check" concluded with desired status: "success"
        [ check  ]   "lint" concluded with desired status: "success"
        [ check  ]   "custom-release-packages" concluded with desired status: "success"
        [ check  ]   "announce" concluded with desired status: "success"
        [ check  ]   "publish-homebrew-formula" concluded with desired status: "success"
        [ check  ]   "host" concluded with desired status: "success"
        [ check  ]   "build-local-artifacts (${{ join(matrix.targets, ', ') }})" concluded with desired status: "success"
        [ check  ]   "build-global-artifacts" concluded with desired status: "success"
        [ check  ]   "plan" concluded with desired status: "success"
        [ check  ]   "changes" concluded with desired status: "success"
        [ state  ]   "unknown" is undesirable ❌

-> checking PR #52
        ci: bump actions/download-artifact from 4 to 5
        https://github.com/dhth/tomo/pull/52
        Created: Tue, 12 Aug 2025 03:16:41 +0000
        Updated: Tue, 12 Aug 2025 03:16:42 +0000
        [ author ]   "dependabot[bot]" is in the list of trusted authors
        [ check  ]   "custom-release-packages" concluded with desired status: "success"
        [ check  ]   "announce" concluded with desired status: "success"
        [ check  ]   "host" concluded with desired status: "success"
        [ check  ]   "publish-homebrew-formula" concluded with desired status: "success"
        [ check  ]   "build-global-artifacts" concluded with desired status: "success"
        [ check  ]   "build-local-artifacts (${{ join(matrix.targets, ', ') }})" concluded with desired status: "success"
        [ check  ]   "dstlled-diff" concluded with desired status: "success"
        [ check  ]   "lint" concluded with desired status: "success"
        [ check  ]   "build" concluded with desired status: "success"
        [ check  ]   "test" concluded with desired status: "success"
        [ check  ]   "audit" concluded with desired status: "success"
        [ check  ]   "lint-yaml" concluded with desired status: "success"
        [ check  ]   "lint-workflows" concluded with desired status: "success"
        [ check  ]   "release-check" concluded with desired status: "success"
        [ check  ]   "plan" concluded with undesired status: "failure" ❌


=============
  dhth/mult
=============

-> checking PR #28
        ci: bump actions/checkout from 4 to 5
        https://github.com/dhth/mult/pull/28
        Created: Tue, 12 Aug 2025 02:35:53 +0000
        Updated: Tue, 12 Aug 2025 02:35:54 +0000
        [ author ]   "dependabot[bot]" is in the list of trusted authors
        [ check  ]   "build (ubuntu-latest)" concluded with desired status: "success"
        [ check  ]   "build (macos-latest)" concluded with desired status: "success"
        [ check  ]   "lint" concluded with desired status: "success"
        [ check  ]   "release-check" concluded with desired status: "success"
        [ check  ]   "vulncheck" concluded with desired status: "success"
        [ check  ]   "lint-yaml" concluded with desired status: "success"
        [ check  ]   "lint-workflows" concluded with desired status: "success"
        [ check  ]   "changes" concluded with desired status: "success"
        [ state  ]   "clean" is desirable
        PR merged! 🎉 ✅

[INFO] This run ended at 2025-08-12 22:40:41.555606764 UTC; took 2 seconds

===========
  SUMMARY
===========

- PRs merged:                    1
- PRs disqualified:              15
- Repos checked:                 34
- Repos with no relevant PRs:    23
- Errors encountered:            1

PRs merged
---

- [dhth/mult] ci: bump actions/checkout from 4 to 5

Disqualifications
---

- https://github.com/dhth/mrj-runner/pull/7        state: unknown
- https://github.com/dhth/squish/pull/39           state: blocked
- https://github.com/dhth/ecscope/pull/56          check plan: failure
- https://github.com/dhth/dfft/pull/46             check plan: failure
- https://github.com/dhth/ting/pull/16             check plan: failure
- https://github.com/dhth/tbll/pull/48             check plan: failure
- https://github.com/dhth/prs/pull/42              check vulncheck: failure
- https://github.com/dhth/prs/pull/43              check vulncheck: failure
- https://github.com/dhth/tash/pull/28             state: unknown
- https://github.com/dhth/cueitup/pull/68          state: unknown
- https://github.com/dhth/cueitup/pull/69          state: unknown
- https://github.com/dhth/cueitup/pull/70          state: unknown
- https://github.com/dhth/tomo/pull/50             check plan: failure
- https://github.com/dhth/tomo/pull/51             state: unknown
- https://github.com/dhth/tomo/pull/52             check plan: failure