
                          __
          ___ ___   _ __ /\_\
        /' __` __`\/\`'__\/\ \
        /\ \/\ \/\ \ \ \/ \ \ \
        \ \_\ \_\ \_\ \_\ _\ \ \
         \/_/\/_/\/_/\/_//\ \_\ \
                         \ \____/
                          \/___/


[INFO] The time right now is 2025-07-21 23:12:18.878278804 UTC
[INFO] I'm only looking for PRs where the base branch is "main"
[INFO] I'm sorting PRs based on "creation date" in the "ascending" direction


=============
  dhth/ecsv
=============

-> checking PR #103
        build: bump github.com/aws/aws-sdk-go-v2/config from 1.29.17 to 1.29.18
        https://github.com/dhth/ecsv/pull/103
        Created: Mon, 21 Jul 2025 14:11:43 +0000
        Updated: Mon, 21 Jul 2025 22:13:18 +0000
        [ author ]   "dependabot[bot]" is in the list of trusted authors
        [ check  ]   "lint-workflows" concluded with desired status: "success"
        [ check  ]   "release-check" concluded with desired status: "success"
        [ check  ]   "lint-yaml" concluded with desired status: "success"
        [ check  ]   "vulncheck" concluded with desired status: "success"
        [ check  ]   "test (macos-latest)" concluded with desired status: "success"
        [ check  ]   "test (ubuntu-latest)" concluded with desired status: "success"
        [ check  ]   "build (macos-latest)" concluded with desired status: "success"
        [ check  ]   "build (ubuntu-latest)" concluded with desired status: "success"
        [ check  ]   "lint" concluded with desired status: "success"
        [ check  ]   "changes" concluded with desired status: "success"
        [ state  ]   "unknown" is undesirable ❌


=============
  dhth/dfft
=============

-> checking PR #32
        build: bump rodio from 0.18.1 to 0.21.1
        https://github.com/dhth/dfft/pull/32
        Created: Mon, 21 Jul 2025 03:50:45 +0000
        Updated: Mon, 21 Jul 2025 03:51:01 +0000
        [ author ]   "dependabot[bot]" is in the list of trusted authors
        [ check  ]   "announce" concluded with desired status: "success"
        [ check  ]   "host" concluded with desired status: "success"
        [ check  ]   "custom-publish-crates" concluded with desired status: "success"
        [ check  ]   "publish-homebrew-formula" concluded with desired status: "success"
        [ check  ]   "build-local-artifacts (${{ join(matrix.targets, ', ') }})" concluded with desired status: "success"
        [ check  ]   "build-global-artifacts" concluded with desired status: "success"
        [ check  ]   "lint-yaml" concluded with desired status: "success"
        [ check  ]   "lint-workflows" concluded with desired status: "success"
        [ check  ]   "test-macos-latest-default" concluded with undesired status: "failure" ❌


=============
  dhth/outtasync
=============

-> checking PR #90
        build: bump github.com/aws/aws-sdk-go-v2/config from 1.29.17 to 1.29.18
        https://github.com/dhth/outtasync/pull/90
        Created: Mon, 21 Jul 2025 02:52:04 +0000
        Updated: Mon, 21 Jul 2025 22:13:20 +0000
        [ author ]   "dependabot[bot]" is in the list of trusted authors
        [ check  ]   "release-check" concluded with desired status: "success"
        [ check  ]   "lint-workflows" concluded with desired status: "success"
        [ check  ]   "lint-yaml" concluded with desired status: "success"
        [ check  ]   "vulncheck" concluded with desired status: "success"
        [ check  ]   "build (ubuntu-latest)" concluded with desired status: "success"
        [ check  ]   "test" concluded with desired status: "success"
        [ check  ]   "build (macos-latest)" concluded with desired status: "success"
        [ check  ]   "lint" concluded with desired status: "success"
        [ check  ]   "changes" concluded with desired status: "success"
        [ state  ]   "unknown" is undesirable ❌

-> checking PR #91
        build: bump github.com/aws/aws-sdk-go-v2/service/cloudformation from 1.61.0 to 1.61.1
        https://github.com/dhth/outtasync/pull/91
        Created: Mon, 21 Jul 2025 02:56:21 +0000
        Updated: Mon, 21 Jul 2025 22:21:39 +0000
        [ author ]   "dependabot[bot]" is in the list of trusted authors
        [ check  ]   "lint-yaml" concluded with desired status: "success"
        [ check  ]   "lint-workflows" concluded with desired status: "success"
        [ check  ]   "release-check" concluded with desired status: "success"
        [ check  ]   "build (ubuntu-latest)" concluded with desired status: "success"
        [ check  ]   "vulncheck" concluded with desired status: "success"
        [ check  ]   "test" concluded with desired status: "success"
        [ check  ]   "build (macos-latest)" concluded with desired status: "success"
        [ check  ]   "lint" concluded with desired status: "success"
        [ check  ]   "changes" concluded with desired status: "success"
        [ state  ]   "unknown" is undesirable ❌


=============
  dhth/prs
=============

-> checking PR #40
        build: bump github.com/spf13/pflag from 1.0.6 to 1.0.7
        https://github.com/dhth/prs/pull/40
        Created: Mon, 21 Jul 2025 22:55:20 +0000
        Updated: Mon, 21 Jul 2025 22:55:21 +0000
        [ author ]   "dependabot[bot]" is in the list of trusted authors
        [ check  ]   "lint-workflows" concluded with desired status: "success"
        [ check  ]   "release-check" concluded with desired status: "success"
        [ check  ]   "lint" concluded with desired status: "success"
        [ check  ]   "test" concluded with desired status: "success"
        [ check  ]   "lint-yaml" concluded with desired status: "success"
        [ check  ]   "build (ubuntu-latest)" concluded with desired status: "success"
        [ check  ]   "build (macos-latest)" concluded with desired status: "success"
        [ check  ]   "vulncheck" concluded with desired status: "success"
        [ check  ]   "changes" concluded with desired status: "success"
        [ state  ]   "clean" is desirable
        PR merged! 🎉 ✅


=============
  dhth/ecscope
=============

-> checking PR #43
        build: bump serde_json from 1.0.140 to 1.0.141
        https://github.com/dhth/ecscope/pull/43
        Created: Mon, 21 Jul 2025 02:11:13 +0000
        Updated: Mon, 21 Jul 2025 02:11:34 +0000
        [ author ]   "dependabot[bot]" is in the list of trusted authors
        [ check  ]   "announce" concluded with desired status: "success"
        [ check  ]   "custom-publish-crates" concluded with desired status: "success"
        [ check  ]   "publish-homebrew-formula" concluded with desired status: "success"
        [ check  ]   "host" concluded with desired status: "success"
        [ check  ]   "build-global-artifacts" concluded with desired status: "success"
        [ check  ]   "build-local-artifacts (${{ join(matrix.targets, ', ') }})" concluded with desired status: "success"
        [ check  ]   "lint-yaml" concluded with desired status: "success"
        [ check  ]   "lint-workflows" concluded with desired status: "success"
        [ check  ]   "test-gleam" concluded with desired status: "success"
        [ check  ]   "back-compat" concluded with desired status: "success"
        [ check  ]   "test-rust (macos-latest)" concluded with desired status: "success"
        [ check  ]   "test-rust (ubuntu-latest)" concluded with desired status: "success"
        [ check  ]   "audit" concluded with desired status: "success"
        [ check  ]   "lint-gleam" concluded with desired status: "success"
        [ check  ]   "publish-check" concluded with desired status: "success"
        [ check  ]   "build-gleam" concluded with desired status: "success"
        [ check  ]   "dstlled-diff" concluded with desired status: "success"
        [ check  ]   "lint-rust" concluded with desired status: "success"
        [ check  ]   "build-rust (ubuntu-latest)" concluded with desired status: "success"
        [ check  ]   "build-rust (macos-latest)" concluded with desired status: "success"
        [ check  ]   "plan" concluded with desired status: "success"
        [ check  ]   "changes" concluded with desired status: "success"
        [ state  ]   "clean" is desirable
        PR merged! 🎉 ✅


=============
  dhth/bmm
=============

-> checking PR #56
        ci: bump taiki-e/install-action from 2.56.13 to 2.56.19
        https://github.com/dhth/bmm/pull/56
        Created: Mon, 21 Jul 2025 17:34:38 +0000
        [ author ]   "dependabot[bot]" is in the list of trusted authors
        [ check  ]   "custom-publish-crates" concluded with desired status: "success"
        [ check  ]   "announce" concluded with desired status: "success"
        [ check  ]   "publish-homebrew-formula" concluded with desired status: "success"
        [ check  ]   "host" concluded with desired status: "success"
        [ check  ]   "build-global-artifacts" concluded with desired status: "success"
        [ check  ]   "build-local-artifacts (${{ join(matrix.targets, ', ') }})" concluded with desired status: "success"
        [ check  ]   "dstlled-diff" concluded with desired status: "success"
        [ check  ]   "lint-yaml" concluded with desired status: "success"
        [ check  ]   "audit" concluded with desired status: "success"
        [ check  ]   "lint-sh" concluded with desired status: "success"
        [ check  ]   "test (macos-latest)" concluded with desired status: "success"
        [ check  ]   "test (ubuntu-latest)" concluded with desired status: "success"
        [ check  ]   "lint-workflows" concluded with desired status: "success"
        [ check  ]   "back-compat" concluded with desired status: "success"
        [ check  ]   "build (ubuntu-latest)" concluded with desired status: "success"
        [ check  ]   "build (macos-latest)" concluded with desired status: "success"
        [ check  ]   "lint" concluded with desired status: "success"
        [ check  ]   "changes" concluded with desired status: "success"
        [ check  ]   "plan" concluded with desired status: "success"
        [ state  ]   "clean" is desirable
        PR merged! 🎉 ✅

[INFO] This run ended at 2025-07-21 23:12:21.462030437 UTC; took 2 seconds

===========
  SUMMARY
===========

- PRs merged:                    3
- PRs disqualified:              4
- Repos checked:                 29
- Repos with no relevant PRs:    23
- Errors encountered:            0

PRs merged
---

- [dhth/prs] build: bump github.com/spf13/pflag from 1.0.6 to 1.0.7
- [dhth/ecscope] build: bump serde_json from 1.0.140 to 1.0.141
- [dhth/bmm] ci: bump taiki-e/install-action from 2.56.13 to 2.56.19

Disqualifications
---

- https://github.com/dhth/ecsv/pull/103            state: unknown
- https://github.com/dhth/dfft/pull/32             check test-macos-latest-default: failure
- https://github.com/dhth/outtasync/pull/90        state: unknown
- https://github.com/dhth/outtasync/pull/91        state: unknown