
                          __
          ___ ___   _ __ /\_\
        /' __` __`\/\`'__\/\ \
        /\ \/\ \/\ \ \ \/ \ \ \
        \ \_\ \_\ \_\ \_\ _\ \ \
         \/_/\/_/\/_/\/_//\ \_\ \
                         \ \____/
                          \/___/


[INFO] The time right now is 2025-08-04 22:44:48.452031871 UTC
[INFO] I'm only looking for PRs where the base branch is "main"
[INFO] I'm sorting PRs based on "creation date" in the "ascending" direction


=============
  dhth/squidge
=============

-> checking PR #37
        build: bump clap from 4.5.41 to 4.5.42
        https://github.com/dhth/squidge/pull/37
        Created: Mon, 4 Aug 2025 21:52:51 +0000
        Updated: Mon, 4 Aug 2025 21:53:16 +0000
        [ author ]   "dependabot[bot]" is in the list of trusted authors
        [ check  ]   "custom-release-packages" concluded with desired status: "success"
        [ check  ]   "build-global-artifacts" concluded with desired status: "success"
        [ check  ]   "announce" concluded with desired status: "success"
        [ check  ]   "publish-homebrew-formula" concluded with desired status: "success"
        [ check  ]   "host" concluded with desired status: "success"
        [ check  ]   "build-local-artifacts (${{ join(matrix.targets, ', ') }})" concluded with desired status: "success"
        [ check  ]   "audit" concluded with desired status: "success"
        [ check  ]   "release-check" concluded with desired status: "success"
        [ check  ]   "lint-workflows" concluded with desired status: "success"
        [ check  ]   "lint-yaml" concluded with desired status: "success"
        [ check  ]   "test (macos-latest)" concluded with desired status: "success"
        [ check  ]   "test (ubuntu-latest)" concluded with desired status: "success"
        [ check  ]   "dstlled-diff" concluded with desired status: "success"
        [ check  ]   "lint" concluded with desired status: "success"
        [ check  ]   "build (macos-latest)" concluded with desired status: "success"
        [ check  ]   "build (ubuntu-latest)" concluded with desired status: "success"
        [ check  ]   "plan" concluded with desired status: "success"
        [ check  ]   "changes" concluded with desired status: "success"
        [ state  ]   "unknown" is undesirable ❌


=============
  dhth/tbll
=============

-> checking PR #45
        build: bump clap from 4.5.41 to 4.5.42
        https://github.com/dhth/tbll/pull/45
        Created: Mon, 4 Aug 2025 13:18:04 +0000
        Updated: Mon, 4 Aug 2025 13:18:05 +0000
        [ author ]   "dependabot[bot]" is in the list of trusted authors
        [ check  ]   "custom-release-packages" concluded with desired status: "success"
        [ check  ]   "announce" concluded with desired status: "success"
        [ check  ]   "publish-homebrew-formula" concluded with desired status: "success"
        [ check  ]   "host" concluded with desired status: "success"
        [ check  ]   "build-global-artifacts" concluded with desired status: "success"
        [ check  ]   "build-local-artifacts (${{ join(matrix.targets, ', ') }})" concluded with desired status: "success"
        [ check  ]   "lint-workflows" concluded with desired status: "success"
        [ check  ]   "lint-yaml" concluded with desired status: "success"
        [ check  ]   "audit" concluded with desired status: "success"
        [ check  ]   "test (ubuntu-latest)" concluded with desired status: "success"
        [ check  ]   "test (macos-latest)" concluded with desired status: "success"
        [ check  ]   "lint" concluded with desired status: "success"
        [ check  ]   "build (ubuntu-latest)" concluded with desired status: "success"
        [ check  ]   "build (macos-latest)" concluded with desired status: "success"
        [ check  ]   "plan" concluded with desired status: "success"
        [ check  ]   "changes" concluded with desired status: "success"
        [ state  ]   "unknown" is undesirable ❌


=============
  dhth/bmm
=============

-> checking PR #58
        build: bump tokio from 1.46.1 to 1.47.1
        https://github.com/dhth/bmm/pull/58
        Created: Mon, 4 Aug 2025 18:57:22 +0000
        Updated: Mon, 4 Aug 2025 22:18:28 +0000
        [ author ]   "dependabot[bot]" is in the list of trusted authors
        [ check  ]   "announce" concluded with desired status: "success"
        [ check  ]   "custom-publish-crates" concluded with desired status: "success"
        [ check  ]   "publish-homebrew-formula" concluded with desired status: "success"
        [ check  ]   "host" concluded with desired status: "success"
        [ check  ]   "build-global-artifacts" concluded with desired status: "success"
        [ check  ]   "build-local-artifacts (${{ join(matrix.targets, ', ') }})" concluded with desired status: "success"
        [ check  ]   "lint-workflows" concluded with desired status: "success"
        [ check  ]   "lint-sh" concluded with desired status: "success"
        [ check  ]   "back-compat" concluded with desired status: "success"
        [ check  ]   "test (ubuntu-latest)" concluded with desired status: "success"
        [ check  ]   "test (macos-latest)" concluded with desired status: "success"
        [ check  ]   "build (macos-latest)" concluded with desired status: "success"
        [ check  ]   "audit" concluded with desired status: "success"
        [ check  ]   "build (ubuntu-latest)" concluded with desired status: "success"
        [ check  ]   "lint-yaml" concluded with desired status: "success"
        [ check  ]   "dstlled-diff" concluded with desired status: "success"
        [ check  ]   "lint" concluded with desired status: "success"
        [ check  ]   "plan" concluded with desired status: "success"
        [ check  ]   "changes" concluded with desired status: "success"
        [ state  ]   "clean" is desirable
        PR merged! 🎉 ✅


=============
  dhth/urll
=============

-> checking PR #19
        build: bump tokio from 1.46.1 to 1.47.1
        https://github.com/dhth/urll/pull/19
        Created: Mon, 4 Aug 2025 19:45:18 +0000
        Updated: Mon, 4 Aug 2025 19:45:42 +0000
        [ author ]   "dependabot[bot]" is in the list of trusted authors
        [ check  ]   "lint-workflows" concluded with desired status: "success"
        [ check  ]   "lint-yaml" concluded with desired status: "success"
        [ check  ]   "dstlled-diff" concluded with desired status: "success"
        [ check  ]   "audit" concluded with desired status: "success"
        [ check  ]   "test (ubuntu-latest)" concluded with desired status: "success"
        [ check  ]   "test (macos-latest)" concluded with desired status: "success"
        [ check  ]   "lint" concluded with desired status: "success"
        [ check  ]   "build (macos-latest)" concluded with desired status: "success"
        [ check  ]   "build (ubuntu-latest)" concluded with desired status: "success"
        [ check  ]   "changes" concluded with desired status: "success"
        [ state  ]   "clean" is desirable
        PR merged! 🎉 ✅


=============
  dhth/squish
=============

-> checking PR #35
        ci: bump taiki-e/install-action from 2.56.19 to 2.57.6
        https://github.com/dhth/squish/pull/35
        Created: Mon, 4 Aug 2025 22:11:41 +0000
        [ author ]   "dependabot[bot]" is in the list of trusted authors
        [ check  ]   "lint-workflows" concluded with desired status: "success"
        [ check  ]   "test (macos-latest)" concluded with desired status: "success"
        [ check  ]   "audit" concluded with desired status: "success"
        [ check  ]   "test (ubuntu-latest)" concluded with desired status: "success"
        [ check  ]   "build (macos-latest)" concluded with desired status: "success"
        [ check  ]   "build (ubuntu-latest)" concluded with desired status: "success"
        [ check  ]   "lint-yaml" concluded with desired status: "success"
        [ check  ]   "lint" concluded with desired status: "success"
        [ check  ]   "changes" concluded with desired status: "success"
        [ state  ]   "clean" is desirable
        PR merged! 🎉 ✅


=============
  dhth/outtasync
=============

-> checking PR #93
        build: bump github.com/aws/aws-sdk-go-v2/service/cloudformation from 1.61.1 to 1.62.1
        https://github.com/dhth/outtasync/pull/93
        Created: Mon, 4 Aug 2025 02:44:57 +0000
        Updated: Mon, 4 Aug 2025 22:13:20 +0000
        [ author ]   "dependabot[bot]" is in the list of trusted authors
        [ check  ]   "lint-yaml" concluded with desired status: "success"
        [ check  ]   "lint-workflows" concluded with desired status: "success"
        [ check  ]   "release-check" concluded with desired status: "success"
        [ check  ]   "vulncheck" concluded with desired status: "success"
        [ check  ]   "test" concluded with desired status: "success"
        [ check  ]   "build (ubuntu-latest)" concluded with desired status: "success"
        [ check  ]   "build (macos-latest)" concluded with desired status: "success"
        [ check  ]   "lint" concluded with desired status: "success"
        [ check  ]   "changes" concluded with desired status: "success"
        [ state  ]   "dirty" is undesirable ❌

-> checking PR #94
        build: bump github.com/aws/aws-sdk-go-v2 from 1.36.6 to 1.37.1
        https://github.com/dhth/outtasync/pull/94
        Created: Mon, 4 Aug 2025 02:46:35 +0000
        Updated: Mon, 4 Aug 2025 22:13:21 +0000
        [ author ]   "dependabot[bot]" is in the list of trusted authors
        [ check  ]   "release-check" concluded with desired status: "success"
        [ check  ]   "lint-workflows" concluded with desired status: "success"
        [ check  ]   "lint-yaml" concluded with desired status: "success"
        [ check  ]   "vulncheck" concluded with desired status: "success"
        [ check  ]   "lint" concluded with desired status: "success"
        [ check  ]   "build (macos-latest)" concluded with desired status: "success"
        [ check  ]   "test" concluded with desired status: "success"
        [ check  ]   "build (ubuntu-latest)" concluded with desired status: "success"
        [ check  ]   "changes" concluded with desired status: "success"
        [ state  ]   "dirty" is undesirable ❌

-> checking PR #95
        build: bump github.com/aws/aws-sdk-go-v2/config from 1.29.18 to 1.30.2
        https://github.com/dhth/outtasync/pull/95
        Created: Mon, 4 Aug 2025 02:46:47 +0000
        Updated: Mon, 4 Aug 2025 22:13:22 +0000
        [ author ]   "dependabot[bot]" is in the list of trusted authors
        [ check  ]   "lint-workflows" concluded with desired status: "success"
        [ check  ]   "release-check" concluded with desired status: "success"
        [ check  ]   "vulncheck" concluded with desired status: "success"
        [ check  ]   "build (ubuntu-latest)" concluded with desired status: "success"
        [ check  ]   "build (macos-latest)" concluded with desired status: "success"
        [ check  ]   "lint-yaml" concluded with desired status: "success"
        [ check  ]   "test" concluded with desired status: "success"
        [ check  ]   "lint" concluded with desired status: "success"
        [ check  ]   "changes" concluded with desired status: "success"
        [ state  ]   "dirty" is undesirable ❌

-> checking PR #96
        build: bump github.com/aws/aws-sdk-go-v2/credentials from 1.17.71 to 1.18.2
        https://github.com/dhth/outtasync/pull/96
        Created: Mon, 4 Aug 2025 02:49:11 +0000
        Updated: Mon, 4 Aug 2025 22:13:23 +0000
        [ author ]   "dependabot[bot]" is in the list of trusted authors
        [ check  ]   "lint-yaml" concluded with desired status: "success"
        [ check  ]   "lint-workflows" concluded with desired status: "success"
        [ check  ]   "release-check" concluded with desired status: "success"
        [ check  ]   "vulncheck" concluded with desired status: "success"
        [ check  ]   "test" concluded with desired status: "success"
        [ check  ]   "build (ubuntu-latest)" concluded with desired status: "success"
        [ check  ]   "build (macos-latest)" concluded with desired status: "success"
        [ check  ]   "lint" concluded with desired status: "success"
        [ check  ]   "changes" concluded with desired status: "success"
        [ state  ]   "dirty" is undesirable ❌


=============
  dhth/ting
=============

-> checking PR #10
        build: bump toml from 0.9.2 to 0.9.4
        https://github.com/dhth/ting/pull/10
        Created: Mon, 4 Aug 2025 00:23:26 +0000
        Updated: Mon, 4 Aug 2025 00:23:48 +0000
        [ author ]   "dependabot[bot]" is in the list of trusted authors
        [ check  ]   "custom-publish-crates" concluded with desired status: "success"
        [ check  ]   "announce" concluded with desired status: "success"
        [ check  ]   "host" concluded with desired status: "success"
        [ check  ]   "publish-homebrew-formula" concluded with desired status: "success"
        [ check  ]   "build-global-artifacts" concluded with desired status: "success"
        [ check  ]   "build-local-artifacts (${{ join(matrix.targets, ', ') }})" concluded with desired status: "success"
        [ check  ]   "lint-workflows" concluded with desired status: "success"
        [ check  ]   "lint-yaml" concluded with desired status: "success"
        [ check  ]   "dstlled-diff" concluded with desired status: "success"
        [ check  ]   "audit" concluded with desired status: "success"
        [ check  ]   "publish-check" concluded with desired status: "success"
        [ check  ]   "test (ubuntu-latest)" concluded with desired status: "success"
        [ check  ]   "test (macos-latest)" concluded with desired status: "success"
        [ check  ]   "build (ubuntu-latest)" concluded with desired status: "success"
        [ check  ]   "lint" concluded with desired status: "success"
        [ check  ]   "build (macos-latest)" concluded with desired status: "success"
        [ check  ]   "plan" concluded with desired status: "success"
        [ check  ]   "changes" concluded with desired status: "success"
        [ state  ]   "clean" is desirable
        PR merged! 🎉 ✅


=============
  dhth/graphc
=============

-> checking PR #16
        build: bump inline-snapshot from 0.25.3 to 0.26.0
        https://github.com/dhth/graphc/pull/16
        Created: Mon, 4 Aug 2025 04:53:56 +0000
        Updated: Mon, 4 Aug 2025 04:54:20 +0000
        [ author ]   "dependabot[bot]" is in the list of trusted authors
        [ check  ]   "lint-yaml" concluded with desired status: "success"
        [ check  ]   "dstlled-diff" concluded with desired status: "success"
        [ check  ]   "lint-workflows" concluded with desired status: "success"
        [ check  ]   "test (ubuntu-latest)" concluded with desired status: "success"
        [ check  ]   "test (macos-latest)" concluded with desired status: "success"
        [ check  ]   "build (macos-latest)" concluded with desired status: "success"
        [ check  ]   "build (ubuntu-latest)" concluded with desired status: "success"
        [ check  ]   "lint" concluded with desired status: "success"
        [ check  ]   "changes" concluded with desired status: "success"
        [ state  ]   "clean" is desirable
        PR merged! 🎉 ✅


=============
  dhth/ecscope
=============

-> checking PR #48
        build: bump clap from 4.5.41 to 4.5.42
        https://github.com/dhth/ecscope/pull/48
        Created: Mon, 4 Aug 2025 02:15:39 +0000
        Updated: Mon, 4 Aug 2025 02:15:59 +0000
        [ author ]   "dependabot[bot]" is in the list of trusted authors
        [ check  ]   "announce" concluded with desired status: "success"
        [ check  ]   "custom-publish-crates" concluded with desired status: "success"
        [ check  ]   "publish-homebrew-formula" concluded with desired status: "success"
        [ check  ]   "host" concluded with desired status: "success"
        [ check  ]   "build-global-artifacts" concluded with desired status: "success"
        [ check  ]   "build-local-artifacts (${{ join(matrix.targets, ', ') }})" concluded with desired status: "success"
        [ check  ]   "lint-workflows" concluded with desired status: "success"
        [ check  ]   "test-rust (macos-latest)" concluded with desired status: "success"
        [ check  ]   "publish-check" concluded with desired status: "success"
        [ check  ]   "build-rust (macos-latest)" concluded with desired status: "success"
        [ check  ]   "build-rust (ubuntu-latest)" concluded with desired status: "success"
        [ check  ]   "test-rust (ubuntu-latest)" concluded with desired status: "success"
        [ check  ]   "lint-yaml" concluded with desired status: "success"
        [ check  ]   "build-gleam" concluded with desired status: "success"
        [ check  ]   "audit" concluded with desired status: "success"
        [ check  ]   "test-gleam" concluded with desired status: "success"
        [ check  ]   "back-compat" concluded with desired status: "success"
        [ check  ]   "dstlled-diff" concluded with desired status: "success"
        [ check  ]   "lint-gleam" concluded with desired status: "success"
        [ check  ]   "lint-rust" concluded with desired status: "success"
        [ check  ]   "plan" concluded with desired status: "success"
        [ check  ]   "changes" concluded with desired status: "success"
        [ state  ]   "clean" is desirable
        PR merged! 🎉 ✅


=============
  dhth/hours
=============

-> checking PR #81
        build: bump github.com/olekukonko/tablewriter from 1.0.8 to 1.0.9
        https://github.com/dhth/hours/pull/81
        Created: Mon, 4 Aug 2025 07:34:14 +0000
        Updated: Mon, 4 Aug 2025 22:16:56 +0000
        [ author ]   "dependabot[bot]" is in the list of trusted authors
        [ check  ]   "live-tests (macos-latest)" concluded with desired status: "success"
        [ check  ]   "live-tests (ubuntu-latest)" concluded with desired status: "success"
        [ check  ]   "lint-yaml" concluded with desired status: "success"
        [ check  ]   "lint-workflows" concluded with desired status: "success"
        [ check  ]   "release-check" concluded with desired status: "success"
        [ check  ]   "vulncheck" concluded with desired status: "success"
        [ check  ]   "back-compat (macos-latest)" concluded with desired status: "success"
        [ check  ]   "back-compat (ubuntu-latest)" concluded with desired status: "success"
        [ check  ]   "test" concluded with desired status: "success"
        [ check  ]   "lint" concluded with desired status: "success"
        [ check  ]   "build (ubuntu-latest)" concluded with desired status: "success"
        [ check  ]   "build (macos-latest)" concluded with desired status: "success"
        [ check  ]   "changes" concluded with desired status: "success"
        [ state  ]   "clean" is desirable
        PR merged! 🎉 ✅


=============
  dhth/dfft
=============

-> checking PR #39
        build: bump clap from 4.5.41 to 4.5.42
        https://github.com/dhth/dfft/pull/39
        Created: Mon, 4 Aug 2025 03:55:52 +0000
        Updated: Mon, 4 Aug 2025 03:56:15 +0000
        [ author ]   "dependabot[bot]" is in the list of trusted authors
        [ check  ]   "custom-publish-crates" concluded with desired status: "success"
        [ check  ]   "announce" concluded with desired status: "success"
        [ check  ]   "publish-homebrew-formula" concluded with desired status: "success"
        [ check  ]   "host" concluded with desired status: "success"
        [ check  ]   "build-global-artifacts" concluded with desired status: "success"
        [ check  ]   "build-local-artifacts (${{ join(matrix.targets, ', ') }})" concluded with desired status: "success"
        [ check  ]   "lint-workflows" concluded with desired status: "success"
        [ check  ]   "lint-yaml" concluded with desired status: "success"
        [ check  ]   "test-macos-latest-default" concluded with desired status: "success"
        [ check  ]   "test-ubuntu-latest-no-sound" concluded with desired status: "success"
        [ check  ]   "test-ubuntu-latest-default" concluded with desired status: "success"
        [ check  ]   "dstlled-diff" concluded with desired status: "success"
        [ check  ]   "test-macos-latest-no-sound" concluded with desired status: "success"
        [ check  ]   "publish-check" concluded with desired status: "success"
        [ check  ]   "audit" concluded with desired status: "success"
        [ check  ]   "build-macos-latest-no-sound" concluded with desired status: "success"
        [ check  ]   "build-macos-latest-default" concluded with desired status: "success"
        [ check  ]   "build-ubuntu-latest-no-sound" concluded with desired status: "success"
        [ check  ]   "build-ubuntu-latest-default" concluded with desired status: "success"
        [ check  ]   "lint-no-sound" concluded with desired status: "success"
        [ check  ]   "lint-default" concluded with desired status: "success"
        [ check  ]   "plan" concluded with desired status: "success"
        [ check  ]   "changes" concluded with desired status: "success"
        [ state  ]   "unknown" is undesirable ❌

-> checking PR #40
        build: bump tokio-util from 0.7.15 to 0.7.16
        https://github.com/dhth/dfft/pull/40
        Created: Mon, 4 Aug 2025 03:56:17 +0000
        Updated: Mon, 4 Aug 2025 03:56:40 +0000
        [ author ]   "dependabot[bot]" is in the list of trusted authors
        [ check  ]   "custom-publish-crates" concluded with desired status: "success"
        [ check  ]   "announce" concluded with desired status: "success"
        [ check  ]   "publish-homebrew-formula" concluded with desired status: "success"
        [ check  ]   "build-global-artifacts" concluded with desired status: "success"
        [ check  ]   "host" concluded with desired status: "success"
        [ check  ]   "build-local-artifacts (${{ join(matrix.targets, ', ') }})" concluded with desired status: "success"
        [ check  ]   "lint-yaml" concluded with desired status: "success"
        [ check  ]   "test-macos-latest-no-sound" concluded with desired status: "success"
        [ check  ]   "lint-workflows" concluded with desired status: "success"
        [ check  ]   "audit" concluded with desired status: "success"
        [ check  ]   "publish-check" concluded with desired status: "success"
        [ check  ]   "test-ubuntu-latest-no-sound" concluded with desired status: "success"
        [ check  ]   "test-macos-latest-default" concluded with desired status: "success"
        [ check  ]   "dstlled-diff" concluded with desired status: "success"
        [ check  ]   "test-ubuntu-latest-default" concluded with desired status: "success"
        [ check  ]   "build-macos-latest-default" concluded with desired status: "success"
        [ check  ]   "build-macos-latest-no-sound" concluded with desired status: "success"
        [ check  ]   "build-ubuntu-latest-default" concluded with desired status: "success"
        [ check  ]   "build-ubuntu-latest-no-sound" concluded with desired status: "success"
        [ check  ]   "lint-no-sound" concluded with desired status: "success"
        [ check  ]   "lint-default" concluded with desired status: "success"
        [ check  ]   "plan" concluded with desired status: "success"
        [ check  ]   "changes" concluded with desired status: "success"
        [ state  ]   "unknown" is undesirable ❌

-> checking PR #41
        build: bump notify from 8.1.0 to 8.2.0
        https://github.com/dhth/dfft/pull/41
        Created: Mon, 4 Aug 2025 03:59:11 +0000
        Updated: Mon, 4 Aug 2025 03:59:31 +0000
        [ author ]   "dependabot[bot]" is in the list of trusted authors
        [ check  ]   "announce" concluded with desired status: "success"
        [ check  ]   "publish-homebrew-formula" concluded with desired status: "success"
        [ check  ]   "custom-publish-crates" concluded with desired status: "success"
        [ check  ]   "host" concluded with desired status: "success"
        [ check  ]   "build-global-artifacts" concluded with desired status: "success"
        [ check  ]   "build-local-artifacts (${{ join(matrix.targets, ', ') }})" concluded with desired status: "success"
        [ check  ]   "lint-workflows" concluded with desired status: "success"
        [ check  ]   "lint-yaml" concluded with desired status: "success"
        [ check  ]   "audit" concluded with desired status: "success"
        [ check  ]   "test-ubuntu-latest-default" concluded with desired status: "success"
        [ check  ]   "dstlled-diff" concluded with desired status: "success"
        [ check  ]   "build-macos-latest-no-sound" concluded with desired status: "success"
        [ check  ]   "publish-check" concluded with desired status: "success"
        [ check  ]   "test-macos-latest-default" concluded with desired status: "success"
        [ check  ]   "build-macos-latest-default" concluded with desired status: "success"
        [ check  ]   "test-macos-latest-no-sound" concluded with desired status: "success"
        [ check  ]   "build-ubuntu-latest-no-sound" concluded with desired status: "success"
        [ check  ]   "build-ubuntu-latest-default" concluded with desired status: "success"
        [ check  ]   "test-ubuntu-latest-no-sound" concluded with desired status: "success"
        [ check  ]   "lint-no-sound" concluded with desired status: "success"
        [ check  ]   "lint-default" concluded with desired status: "success"
        [ check  ]   "changes" concluded with desired status: "success"
        [ check  ]   "plan" concluded with desired status: "success"
        [ state  ]   "unknown" is undesirable ❌

-> checking PR #42
        build: bump tokio from 1.47.0 to 1.47.1
        https://github.com/dhth/dfft/pull/42
        Created: Mon, 4 Aug 2025 04:04:14 +0000
        Updated: Mon, 4 Aug 2025 04:04:36 +0000
        [ author ]   "dependabot[bot]" is in the list of trusted authors
        [ check  ]   "announce" concluded with desired status: "success"
        [ check  ]   "custom-publish-crates" concluded with desired status: "success"
        [ check  ]   "publish-homebrew-formula" concluded with desired status: "success"
        [ check  ]   "host" concluded with desired status: "success"
        [ check  ]   "build-global-artifacts" concluded with desired status: "success"
        [ check  ]   "build-local-artifacts (${{ join(matrix.targets, ', ') }})" concluded with desired status: "success"
        [ check  ]   "test-ubuntu-latest-default" concluded with desired status: "success"
        [ check  ]   "test-macos-latest-no-sound" concluded with desired status: "success"
        [ check  ]   "test-ubuntu-latest-no-sound" concluded with desired status: "success"
        [ check  ]   "publish-check" concluded with desired status: "success"
        [ check  ]   "test-macos-latest-default" concluded with desired status: "success"
        [ check  ]   "lint-workflows" concluded with desired status: "success"
        [ check  ]   "audit" concluded with desired status: "success"
        [ check  ]   "build-macos-latest-default" concluded with desired status: "success"
        [ check  ]   "dstlled-diff" concluded with desired status: "success"
        [ check  ]   "build-ubuntu-latest-default" concluded with desired status: "success"
        [ check  ]   "build-macos-latest-no-sound" concluded with desired status: "success"
        [ check  ]   "build-ubuntu-latest-no-sound" concluded with desired status: "success"
        [ check  ]   "lint-yaml" concluded with desired status: "success"
        [ check  ]   "lint-no-sound" concluded with desired status: "success"
        [ check  ]   "lint-default" concluded with desired status: "success"
        [ check  ]   "plan" concluded with desired status: "success"
        [ check  ]   "changes" concluded with desired status: "success"
        [ state  ]   "unknown" is undesirable ❌


=============
  dhth/ecsv
=============

-> checking PR #107
        build: bump github.com/aws/aws-sdk-go-v2/service/sts from 1.34.1 to 1.35.1
        https://github.com/dhth/ecsv/pull/107
        Created: Mon, 4 Aug 2025 16:23:59 +0000
        Updated: Mon, 4 Aug 2025 22:13:21 +0000
        [ author ]   "dependabot[bot]" is in the list of trusted authors
        [ check  ]   "build (macos-latest)" concluded with desired status: "success"
        [ check  ]   "lint-yaml" concluded with desired status: "success"
        [ check  ]   "release-check" concluded with desired status: "success"
        [ check  ]   "lint-workflows" concluded with desired status: "success"
        [ check  ]   "test (ubuntu-latest)" concluded with desired status: "success"
        [ check  ]   "vulncheck" concluded with desired status: "success"
        [ check  ]   "test (macos-latest)" concluded with desired status: "success"
        [ check  ]   "lint" concluded with desired status: "success"
        [ check  ]   "build (ubuntu-latest)" concluded with desired status: "success"
        [ check  ]   "changes" concluded with desired status: "success"
        [ state  ]   "dirty" is undesirable ❌

-> checking PR #108
        build: bump github.com/aws/aws-sdk-go-v2/config from 1.29.18 to 1.30.2
        https://github.com/dhth/ecsv/pull/108
        Created: Mon, 4 Aug 2025 16:29:00 +0000
        Updated: Mon, 4 Aug 2025 22:13:21 +0000
        [ author ]   "dependabot[bot]" is in the list of trusted authors
        [ check  ]   "lint-yaml" concluded with desired status: "success"
        [ check  ]   "lint-workflows" concluded with desired status: "success"
        [ check  ]   "release-check" concluded with desired status: "success"
        [ check  ]   "test (ubuntu-latest)" concluded with desired status: "success"
        [ check  ]   "build (ubuntu-latest)" concluded with desired status: "success"
        [ check  ]   "test (macos-latest)" concluded with desired status: "success"
        [ check  ]   "vulncheck" concluded with desired status: "success"
        [ check  ]   "build (macos-latest)" concluded with desired status: "success"
        [ check  ]   "lint" concluded with desired status: "success"
        [ check  ]   "changes" concluded with desired status: "success"
        [ state  ]   "dirty" is undesirable ❌

-> checking PR #109
        build: bump github.com/aws/aws-sdk-go-v2/credentials from 1.17.71 to 1.18.2
        https://github.com/dhth/ecsv/pull/109
        Created: Mon, 4 Aug 2025 16:41:36 +0000
        Updated: Mon, 4 Aug 2025 22:13:21 +0000
        [ author ]   "dependabot[bot]" is in the list of trusted authors
        [ check  ]   "lint-workflows" concluded with desired status: "success"
        [ check  ]   "release-check" concluded with desired status: "success"
        [ check  ]   "lint-yaml" concluded with desired status: "success"
        [ check  ]   "test (ubuntu-latest)" concluded with desired status: "success"
        [ check  ]   "vulncheck" concluded with desired status: "success"
        [ check  ]   "build (ubuntu-latest)" concluded with desired status: "success"
        [ check  ]   "build (macos-latest)" concluded with desired status: "success"
        [ check  ]   "test (macos-latest)" concluded with desired status: "success"
        [ check  ]   "lint" concluded with desired status: "success"
        [ check  ]   "changes" concluded with desired status: "success"
        [ state  ]   "dirty" is undesirable ❌

-> checking PR #110
        build: bump github.com/aws/aws-sdk-go-v2/service/ecs from 1.60.1 to 1.61.1
        https://github.com/dhth/ecsv/pull/110
        Created: Mon, 4 Aug 2025 16:54:35 +0000
        Updated: Mon, 4 Aug 2025 22:13:24 +0000
        [ author ]   "dependabot[bot]" is in the list of trusted authors
        [ check  ]   "lint-yaml" concluded with desired status: "success"
        [ check  ]   "release-check" concluded with desired status: "success"
        [ check  ]   "lint-workflows" concluded with desired status: "success"
        [ check  ]   "test (macos-latest)" concluded with desired status: "success"
        [ check  ]   "test (ubuntu-latest)" concluded with desired status: "success"
        [ check  ]   "vulncheck" concluded with desired status: "success"
        [ check  ]   "build (ubuntu-latest)" concluded with desired status: "success"
        [ check  ]   "build (macos-latest)" concluded with desired status: "success"
        [ check  ]   "lint" concluded with desired status: "success"
        [ check  ]   "changes" concluded with desired status: "success"
        [ state  ]   "clean" is desirable
        PR merged! 🎉 ✅

[INFO] This run ended at 2025-08-04 22:44:52.257293860 UTC; took 3 seconds

===========
  SUMMARY
===========

- PRs merged:                    8
- PRs disqualified:              13
- Repos checked:                 31
- Repos with no relevant PRs:    19
- Errors encountered:            0

PRs merged
---

- [dhth/bmm] build: bump tokio from 1.46.1 to 1.47.1
- [dhth/urll] build: bump tokio from 1.46.1 to 1.47.1
- [dhth/squish] ci: bump taiki-e/install-action from 2.56.19 to 2.57.6
- [dhth/ting] build: bump toml from 0.9.2 to 0.9.4
- [dhth/graphc] build: bump inline-snapshot from 0.25.3 to 0.26.0
- [dhth/ecscope] build: bump clap from 4.5.41 to 4.5.42
- [dhth/hours] build: bump github.com/olekukonko/tablewriter from 1.0.8 to 1.0.9
- [dhth/ecsv] build: bump github.com/aws/aws-sdk-go-v2/service/ecs from 1.60.1 to 1.61.1

Disqualifications
---

- https://github.com/dhth/squidge/pull/37          state: unknown
- https://github.com/dhth/tbll/pull/45             state: unknown
- https://github.com/dhth/outtasync/pull/93        state: dirty
- https://github.com/dhth/outtasync/pull/94        state: dirty
- https://github.com/dhth/outtasync/pull/95        state: dirty
- https://github.com/dhth/outtasync/pull/96        state: dirty
- https://github.com/dhth/dfft/pull/39             state: unknown
- https://github.com/dhth/dfft/pull/40             state: unknown
- https://github.com/dhth/dfft/pull/41             state: unknown
- https://github.com/dhth/dfft/pull/42             state: unknown
- https://github.com/dhth/ecsv/pull/107            state: dirty
- https://github.com/dhth/ecsv/pull/108            state: dirty
- https://github.com/dhth/ecsv/pull/109            state: dirty