
                          __
          ___ ___   _ __ /\_\
        /' __` __`\/\`'__\/\ \
        /\ \/\ \/\ \ \ \/ \ \ \
        \ \_\ \_\ \_\ \_\ _\ \ \
         \/_/\/_/\/_/\/_//\ \_\ \
                         \ \____/
                          \/___/


[INFO] The time right now is 2025-12-01 22:07:19.602570904 UTC
[INFO] I'm only looking for PRs where the base branch is "main"
[INFO] I'm sorting PRs based on "creation date" in the "ascending" direction


=============
  dhth/chronotes
=============

-> checking PR #43
        chore(deps): bump actions/checkout from 5 to 6
        https://github.com/dhth/chronotes/pull/43
        Created: Mon, 1 Dec 2025 03:42:29 +0000
        Updated: Mon, 1 Dec 2025 03:42:30 +0000
        [ author ]   "dependabot[bot]" is in the list of trusted authors
        [ check  ]   Github returned with an empty conclusion for the check preview; skipping as I can't make any assumptions here ❌


=============
  dhth/dstll
=============

-> checking PR #45
        ci: bump actions/checkout from 5 to 6
        https://github.com/dhth/dstll/pull/45
        Created: Mon, 1 Dec 2025 05:43:20 +0000
        Updated: Mon, 1 Dec 2025 05:43:42 +0000
        [ author ]   "dependabot[bot]" is in the list of trusted authors
        [ check  ]   "lint-yaml" concluded with desired status: "success"
        [ check  ]   "lint-workflows" concluded with desired status: "success"
        [ check  ]   "run (ubuntu-latest)" concluded with desired status: "success"
        [ check  ]   "test" concluded with desired status: "success"
        [ check  ]   "run (macos-latest)" concluded with desired status: "success"
        [ check  ]   "dstlled-diff" concluded with desired status: "success"
        [ check  ]   "release-check" concluded with desired status: "success"
        [ check  ]   "vulncheck" concluded with undesired status: "failure" ❌

-> checking PR #46
        ci: bump golangci/golangci-lint-action from 8 to 9
        https://github.com/dhth/dstll/pull/46
        Created: Mon, 1 Dec 2025 05:43:23 +0000
        Updated: Mon, 1 Dec 2025 05:43:52 +0000
        [ author ]   "dependabot[bot]" is in the list of trusted authors
        [ check  ]   "dstlled-diff" concluded with desired status: "success"
        [ check  ]   "lint-workflows" concluded with desired status: "success"
        [ check  ]   "release-check" concluded with desired status: "success"
        [ check  ]   "run (macos-latest)" concluded with desired status: "success"
        [ check  ]   "lint-yaml" concluded with desired status: "success"
        [ check  ]   "run (ubuntu-latest)" concluded with desired status: "success"
        [ check  ]   "test" concluded with desired status: "success"
        [ check  ]   "vulncheck" concluded with undesired status: "failure" ❌


=============
  dhth/zero2prod
=============

-> checking PR #41
        build: bump the patch-updates group with 3 updates
        https://github.com/dhth/zero2prod/pull/41
        Created: Mon, 1 Dec 2025 21:17:33 +0000
        Updated: Mon, 1 Dec 2025 21:17:34 +0000
        [ author ]   "dependabot[bot]" is in the list of trusted authors
        [ check  ]   "fmt-and-clippy" concluded with desired status: "success"
        [ check  ]   "build" concluded with desired status: "success"
        [ check  ]   "test" concluded with desired status: "success"
        [ state  ]   "clean" is desirable
        PR merged! 🎉 ✅


=============
  dhth/act3
=============

-> checking PR #62
        build: bump the patch-updates group with 2 updates
        https://github.com/dhth/act3/pull/62
        Created: Mon, 1 Dec 2025 16:43:53 +0000
        [ author ]   "dependabot[bot]" is in the list of trusted authors
        [ check  ]   "release-check" concluded with desired status: "success"
        [ check  ]   "lint-workflows" concluded with desired status: "success"
        [ check  ]   "lint-yaml" concluded with desired status: "success"
        [ check  ]   "run" concluded with desired status: "success"
        [ check  ]   "test (macos-latest)" concluded with desired status: "success"
        [ check  ]   "build (ubuntu-latest)" concluded with desired status: "success"
        [ check  ]   "test (ubuntu-latest)" concluded with desired status: "success"
        [ check  ]   "lint" concluded with desired status: "success"
        [ check  ]   "build (macos-latest)" concluded with desired status: "success"
        [ check  ]   "changes" concluded with desired status: "success"
        [ state  ]   "clean" is desirable
        PR merged! 🎉 ✅


=============
  dhth/squish
=============

-> checking PR #61
        build: bump the patch-updates group with 2 updates
        https://github.com/dhth/squish/pull/61
        Created: Mon, 1 Dec 2025 17:21:25 +0000
        Updated: Mon, 1 Dec 2025 17:21:26 +0000
        [ author ]   "dependabot[bot]" is in the list of trusted authors
        [ check  ]   "lint-workflows" concluded with desired status: "success"
        [ check  ]   "lint-yaml" concluded with desired status: "success"
        [ check  ]   "audit" concluded with desired status: "success"
        [ check  ]   "test (ubuntu-latest)" concluded with desired status: "success"
        [ check  ]   "test (macos-latest)" concluded with desired status: "success"
        [ check  ]   "lint" concluded with desired status: "success"
        [ check  ]   "build (macos-latest)" concluded with desired status: "success"
        [ check  ]   "build (ubuntu-latest)" concluded with desired status: "success"
        [ check  ]   "changes" concluded with desired status: "success"
        [ state  ]   "clean" is desirable
        PR merged! 🎉 ✅


=============
  dhth/ddiff
=============

-> checking PR #38
        ci: bump actions/checkout from 5 to 6
        https://github.com/dhth/ddiff/pull/38
        Created: Mon, 1 Dec 2025 00:34:47 +0000
        Updated: Mon, 1 Dec 2025 00:35:00 +0000
        [ author ]   "dependabot[bot]" is in the list of trusted authors
        [ check  ]   "Vercel Preview Comments" concluded with desired status: "success"
        [ check  ]   "lint" concluded with desired status: "success"
        [ state  ]   "clean" is desirable
        PR merged! 🎉 ✅


=============
  dhth/agent0
=============

-> checking PR #20
        ci: bump golangci/golangci-lint-action from 8 to 9
        https://github.com/dhth/agent0/pull/20
        Created: Mon, 1 Dec 2025 01:35:19 +0000
        Updated: Mon, 1 Dec 2025 01:35:20 +0000
        [ author ]   "dependabot[bot]" is in the list of trusted authors
        [ check  ]   "test" concluded with desired status: "success"
        [ check  ]   "lint" concluded with desired status: "success"
        [ check  ]   "vulncheck" concluded with desired status: "success"
        [ check  ]   "lint-workflows" concluded with desired status: "success"
        [ check  ]   "build (ubuntu-latest)" concluded with desired status: "success"
        [ check  ]   "build (macos-latest)" concluded with desired status: "success"
        [ check  ]   "lint-yaml" concluded with desired status: "success"
        [ check  ]   "changes" concluded with desired status: "success"
        [ state  ]   "clean" is desirable
        PR merged! 🎉 ✅


=============
  dhth/tash
=============

-> checking PR #63
        ci: bump actions/checkout from 5 to 6
        https://github.com/dhth/tash/pull/63
        Created: Mon, 1 Dec 2025 19:15:53 +0000
        Updated: Mon, 1 Dec 2025 19:15:54 +0000
        [ author ]   "dependabot[bot]" is in the list of trusted authors
        [ check  ]   "custom-publish-crates" concluded with desired status: "success"
        [ check  ]   "announce" concluded with desired status: "success"
        [ check  ]   "publish-homebrew-formula" concluded with desired status: "success"
        [ check  ]   "build-global-artifacts" concluded with desired status: "success"
        [ check  ]   "host" concluded with desired status: "success"
        [ check  ]   "build-local-artifacts (${{ join(matrix.targets, ', ') }})" concluded with desired status: "success"
        [ check  ]   "lint-workflows" concluded with desired status: "success"
        [ check  ]   "audit" concluded with desired status: "success"
        [ check  ]   "publish-check" concluded with desired status: "success"
        [ check  ]   "lint-yaml" concluded with desired status: "success"
        [ check  ]   "build (ubuntu-latest)" concluded with desired status: "success"
        [ check  ]   "build (macos-latest)" concluded with desired status: "success"
        [ check  ]   "test (macos-latest)" concluded with desired status: "success"
        [ check  ]   "test (ubuntu-latest)" concluded with desired status: "success"
        [ check  ]   "lint" concluded with desired status: "success"
        [ check  ]   "plan" concluded with desired status: "success"
        [ check  ]   "changes" concluded with desired status: "success"
        [ state  ]   "clean" is desirable
        PR merged! 🎉 ✅


=============
  dhth/commits
=============

-> checking PR #32
        build: bump github.com/go-git/go-git/v5 from 5.16.3 to 5.16.4 in the patch-updates group
        https://github.com/dhth/commits/pull/32
        Created: Mon, 1 Dec 2025 07:39:39 +0000
        Updated: Mon, 1 Dec 2025 07:39:40 +0000
        [ author ]   "dependabot[bot]" is in the list of trusted authors
        [ check  ]   "lint-yaml" concluded with desired status: "success"
        [ check  ]   "lint-workflows" concluded with desired status: "success"
        [ check  ]   "vulncheck" concluded with desired status: "success"
        [ check  ]   "release-check" concluded with desired status: "success"
        [ check  ]   "test" concluded with desired status: "success"
        [ check  ]   "lint" concluded with desired status: "success"
        [ check  ]   "build (macos-latest)" concluded with desired status: "success"
        [ check  ]   "build (ubuntu-latest)" concluded with desired status: "success"
        [ check  ]   "changes" concluded with desired status: "success"
        [ state  ]   "clean" is desirable
        PR merged! 🎉 ✅


=============
  dhth/ecsv
=============

-> checking PR #147
        build: bump github.com/olekukonko/tablewriter from 1.1.0 to 1.1.2 in the patch-updates group
        https://github.com/dhth/ecsv/pull/147
        Created: Mon, 1 Dec 2025 13:47:11 +0000
        Updated: Mon, 1 Dec 2025 16:33:30 +0000
        [ author ]   "dependabot[bot]" is in the list of trusted authors
        [ check  ]   "release-check" concluded with desired status: "success"
        [ check  ]   "lint-workflows" concluded with desired status: "success"
        [ check  ]   "vulncheck" concluded with desired status: "success"
        [ check  ]   "test (ubuntu-latest)" concluded with desired status: "success"
        [ check  ]   "lint-yaml" concluded with desired status: "success"
        [ check  ]   "test (macos-latest)" concluded with desired status: "success"
        [ check  ]   "build (ubuntu-latest)" concluded with desired status: "success"
        [ check  ]   "build (macos-latest)" concluded with desired status: "success"
        [ check  ]   "lint" concluded with desired status: "success"
        [ check  ]   "changes" concluded with desired status: "success"
        [ state  ]   "clean" is desirable
        PR merged! 🎉 ✅


=============
  dhth/outtasync
=============

-> checking PR #138
        build: bump the minor-updates group with 5 updates
        https://github.com/dhth/outtasync/pull/138
        Created: Mon, 1 Dec 2025 02:21:20 +0000
        [ author ]   "dependabot[bot]" is in the list of trusted authors
        [ check  ]   "release-check" concluded with desired status: "success"
        [ check  ]   "lint-workflows" concluded with desired status: "success"
        [ check  ]   "test" concluded with desired status: "success"
        [ check  ]   "vulncheck" concluded with desired status: "success"
        [ check  ]   "lint-yaml" concluded with desired status: "success"
        [ check  ]   "build (ubuntu-latest)" concluded with desired status: "success"
        [ check  ]   "build (macos-latest)" concluded with desired status: "success"
        [ check  ]   "lint" concluded with desired status: "success"
        [ check  ]   "changes" concluded with desired status: "success"
        [ state  ]   "clean" is desirable
        PR merged! 🎉 ✅


=============
  dhth/mrj
=============

-> checking PR #70
        build: bump the patch-updates group with 2 updates
        https://github.com/dhth/mrj/pull/70
        Created: Mon, 1 Dec 2025 19:32:03 +0000
        [ author ]   "dependabot[bot]" is in the list of trusted authors
        [ check  ]   "custom-publish-crates" concluded with desired status: "success"
        [ check  ]   "announce" concluded with desired status: "success"
        [ check  ]   "publish-homebrew-formula" concluded with desired status: "success"
        [ check  ]   "host" concluded with desired status: "success"
        [ check  ]   "build-global-artifacts" concluded with desired status: "success"
        [ check  ]   "build-local-artifacts (${{ join(matrix.targets, ', ') }})" concluded with desired status: "success"
        [ check  ]   "dry-run" concluded with desired status: "success"
        [ check  ]   "lint-workflows" concluded with desired status: "success"
        [ check  ]   "lint" concluded with desired status: "success"
        [ check  ]   "lint-yaml" concluded with desired status: "success"
        [ check  ]   "audit" concluded with desired status: "success"
        [ check  ]   "build (ubuntu-latest)" concluded with desired status: "success"
        [ check  ]   "build (macos-latest)" concluded with desired status: "success"
        [ check  ]   "test (ubuntu-latest)" concluded with desired status: "success"
        [ check  ]   "test (macos-latest)" concluded with desired status: "success"
        [ check  ]   "changes" concluded with desired status: "success"
        [ check  ]   "plan" concluded with desired status: "success"
        [ state  ]   "clean" is desirable
        PR merged! 🎉 ✅


=============
  dhth/urll
=============

-> checking PR #39
        ci: bump actions/checkout from 5 to 6
        https://github.com/dhth/urll/pull/39
        Created: Mon, 1 Dec 2025 16:42:00 +0000
        Updated: Mon, 1 Dec 2025 16:42:25 +0000
        [ author ]   "dependabot[bot]" is in the list of trusted authors
        [ check  ]   "dstlled-diff" concluded with desired status: "success"
        [ check  ]   "audit" concluded with desired status: "success"
        [ check  ]   "lint-workflows" concluded with desired status: "success"
        [ check  ]   "lint-yaml" concluded with desired status: "success"
        [ check  ]   "test (ubuntu-latest)" concluded with desired status: "success"
        [ check  ]   "test (macos-latest)" concluded with desired status: "success"
        [ check  ]   "build (macos-latest)" concluded with desired status: "success"
        [ check  ]   "build (ubuntu-latest)" concluded with desired status: "success"
        [ check  ]   "lint" concluded with desired status: "success"
        [ check  ]   "changes" concluded with desired status: "success"
        [ state  ]   "clean" is desirable
        PR merged! 🎉 ✅


=============
  dhth/atls
=============

-> checking PR #17
        ci: bump taiki-e/install-action from 2.62.46 to 2.62.60
        https://github.com/dhth/atls/pull/17
        Created: Mon, 1 Dec 2025 01:32:02 +0000
        Updated: Mon, 1 Dec 2025 01:32:03 +0000
        [ author ]   "dependabot[bot]" is in the list of trusted authors
        [ check  ]   "test (macos-latest)" concluded with desired status: "success"
        [ check  ]   "test (ubuntu-latest)" concluded with desired status: "success"
        [ check  ]   "lint-workflows" concluded with desired status: "success"
        [ check  ]   "lint-yaml" concluded with desired status: "success"
        [ check  ]   "build (macos-latest)" concluded with desired status: "success"
        [ check  ]   "lint" concluded with desired status: "success"
        [ check  ]   "build (ubuntu-latest)" concluded with desired status: "success"
        [ check  ]   "changes" concluded with desired status: "success"
        [ state  ]   "clean" is desirable
        PR merged! 🎉 ✅


=============
  dhth/omm
=============

-> checking PR #106
        ci: bump golangci/golangci-lint-action from 8 to 9
        https://github.com/dhth/omm/pull/106
        Created: Mon, 1 Dec 2025 07:21:45 +0000
        Updated: Mon, 1 Dec 2025 07:21:46 +0000
        [ author ]   "dependabot[bot]" is in the list of trusted authors
        [ check  ]   "back-compat (macos-latest)" concluded with desired status: "success"
        [ check  ]   "back-compat (ubuntu-latest)" concluded with desired status: "success"
        [ check  ]   "vulncheck" concluded with desired status: "success"
        [ check  ]   "lint-workflows" concluded with desired status: "success"
        [ check  ]   "release-check" concluded with desired status: "success"
        [ check  ]   "test" concluded with desired status: "success"
        [ check  ]   "lint-yaml" concluded with desired status: "success"
        [ check  ]   "build (macos-latest)" concluded with desired status: "success"
        [ check  ]   "build (ubuntu-latest)" concluded with desired status: "success"
        [ check  ]   "lint" concluded with desired status: "success"
        [ check  ]   "changes" concluded with desired status: "success"
        [ state  ]   "clean" is desirable
        PR merged! 🎉 ✅


=============
  dhth/kplay
=============

-> checking PR #133
        build: bump the patch-updates group with 2 updates
        https://github.com/dhth/kplay/pull/133
        Created: Mon, 1 Dec 2025 16:22:50 +0000
        Updated: Mon, 1 Dec 2025 16:22:51 +0000
        [ author ]   "dependabot[bot]" is in the list of trusted authors
        [ check  ]   "lint-workflows" concluded with desired status: "success"
        [ check  ]   "release-check" concluded with desired status: "success"
        [ check  ]   "lint-yaml" concluded with desired status: "success"
        [ check  ]   "lint-gleam" concluded with desired status: "success"
        [ check  ]   "build-gleam" concluded with desired status: "success"
        [ check  ]   "vulncheck" concluded with desired status: "success"
        [ check  ]   "test-go (macos-latest)" concluded with desired status: "success"
        [ check  ]   "test-go (ubuntu-latest)" concluded with desired status: "success"
        [ check  ]   "build-go (ubuntu-latest)" concluded with desired status: "success"
        [ check  ]   "lint-go" concluded with desired status: "success"
        [ check  ]   "build-go (macos-latest)" concluded with desired status: "success"
        [ check  ]   "changes" concluded with desired status: "success"
        [ state  ]   "clean" is desirable
        PR merged! 🎉 ✅


=============
  dhth/dfft
=============

-> checking PR #79
        ci: bump taiki-e/install-action from 2.62.46 to 2.62.60
        https://github.com/dhth/dfft/pull/79
        Created: Mon, 1 Dec 2025 02:43:24 +0000
        Updated: Mon, 1 Dec 2025 02:43:48 +0000
        [ author ]   "dependabot[bot]" is in the list of trusted authors
        [ check  ]   "announce" concluded with desired status: "success"
        [ check  ]   "custom-publish-crates" concluded with desired status: "success"
        [ check  ]   "publish-homebrew-formula" concluded with desired status: "success"
        [ check  ]   "host" concluded with desired status: "success"
        [ check  ]   "build-global-artifacts" concluded with desired status: "success"
        [ check  ]   "build-local-artifacts (${{ join(matrix.targets, ', ') }})" concluded with desired status: "success"
        [ check  ]   "audit" concluded with desired status: "success"
        [ check  ]   "publish-check" concluded with desired status: "success"
        [ check  ]   "dstlled-diff" concluded with desired status: "success"
        [ check  ]   "build-macos-latest-default" concluded with desired status: "success"
        [ check  ]   "build-ubuntu-latest-default" concluded with desired status: "success"
        [ check  ]   "build-ubuntu-latest-no-sound" concluded with desired status: "success"
        [ check  ]   "lint-yaml" concluded with desired status: "success"
        [ check  ]   "test-ubuntu-latest-default" concluded with desired status: "success"
        [ check  ]   "build-macos-latest-no-sound" concluded with desired status: "success"
        [ check  ]   "lint-workflows" concluded with desired status: "success"
        [ check  ]   "test-macos-latest-default" concluded with desired status: "success"
        [ check  ]   "test-macos-latest-no-sound" concluded with desired status: "success"
        [ check  ]   "test-ubuntu-latest-no-sound" concluded with desired status: "success"
        [ check  ]   "lint-no-sound" concluded with desired status: "success"
        [ check  ]   "lint-default" concluded with desired status: "success"
        [ check  ]   "changes" concluded with desired status: "success"
        [ check  ]   "plan" concluded with desired status: "success"
        [ state  ]   "clean" is desirable
        PR merged! 🎉 ✅


=============
  dhth/ecscope
=============

-> checking PR #105
        ci: bump taiki-e/install-action from 2.62.46 to 2.62.60
        https://github.com/dhth/ecscope/pull/105
        Created: Mon, 1 Dec 2025 01:37:03 +0000
        Updated: Mon, 1 Dec 2025 01:37:29 +0000
        [ author ]   "dependabot[bot]" is in the list of trusted authors
        [ check  ]   "custom-publish-crates" concluded with desired status: "success"
        [ check  ]   "publish-homebrew-formula" concluded with desired status: "success"
        [ check  ]   "announce" concluded with desired status: "success"
        [ check  ]   "host" concluded with desired status: "success"
        [ check  ]   "build-local-artifacts (${{ join(matrix.targets, ', ') }})" concluded with desired status: "success"
        [ check  ]   "build-global-artifacts" concluded with desired status: "success"
        [ check  ]   "back-compat" concluded with desired status: "success"
        [ check  ]   "build-rust (macos-latest)" concluded with desired status: "success"
        [ check  ]   "build-rust (ubuntu-latest)" concluded with desired status: "success"
        [ check  ]   "dstlled-diff" concluded with desired status: "success"
        [ check  ]   "lint-yaml" concluded with desired status: "success"
        [ check  ]   "audit" concluded with desired status: "success"
        [ check  ]   "publish-check" concluded with desired status: "success"
        [ check  ]   "lint-workflows" concluded with desired status: "success"
        [ check  ]   "test-gleam" concluded with desired status: "success"
        [ check  ]   "test-rust (macos-latest)" concluded with desired status: "success"
        [ check  ]   "build-gleam" concluded with desired status: "success"
        [ check  ]   "test-rust (ubuntu-latest)" concluded with desired status: "success"
        [ check  ]   "lint-rust" concluded with desired status: "success"
        [ check  ]   "lint-gleam" concluded with desired status: "success"
        [ check  ]   "changes" concluded with desired status: "success"
        [ check  ]   "plan" concluded with desired status: "success"
        [ state  ]   "clean" is desirable
        PR merged! 🎉 ✅


=============
  dhth/punchout
=============

-> checking PR #89
        ci: bump golangci/golangci-lint-action from 8 to 9
        https://github.com/dhth/punchout/pull/89
        Created: Mon, 1 Dec 2025 16:44:44 +0000
        Updated: Mon, 1 Dec 2025 16:44:45 +0000
        [ author ]   "dependabot[bot]" is in the list of trusted authors
        [ check  ]   "release-check" concluded with desired status: "success"
        [ check  ]   "test (macos-latest)" concluded with desired status: "success"
        [ check  ]   "test (ubuntu-latest)" concluded with desired status: "success"
        [ check  ]   "lint-workflows" concluded with desired status: "success"
        [ check  ]   "vulncheck" concluded with desired status: "success"
        [ check  ]   "lint-yaml" concluded with desired status: "success"
        [ check  ]   "lint" concluded with desired status: "success"
        [ check  ]   "build (ubuntu-latest)" concluded with desired status: "success"
        [ check  ]   "build (macos-latest)" concluded with desired status: "success"
        [ check  ]   "changes" concluded with desired status: "success"
        [ state  ]   "clean" is desirable
        PR merged! 🎉 ✅


=============
  dhth/tbll
=============

-> checking PR #72
        ci: bump actions/checkout from 5 to 6
        https://github.com/dhth/tbll/pull/72
        Created: Mon, 1 Dec 2025 11:09:54 +0000
        [ author ]   "dependabot[bot]" is in the list of trusted authors
        [ check  ]   "custom-release-packages" concluded with desired status: "success"
        [ check  ]   "announce" concluded with desired status: "success"
        [ check  ]   "publish-homebrew-formula" concluded with desired status: "success"
        [ check  ]   "host" concluded with desired status: "success"
        [ check  ]   "build-global-artifacts" concluded with desired status: "success"
        [ check  ]   "build-local-artifacts (${{ join(matrix.targets, ', ') }})" concluded with desired status: "success"
        [ check  ]   "audit" concluded with desired status: "success"
        [ check  ]   "lint-yaml" concluded with desired status: "success"
        [ check  ]   "build (ubuntu-latest)" concluded with desired status: "success"
        [ check  ]   "build (macos-latest)" concluded with desired status: "success"
        [ check  ]   "test (macos-latest)" concluded with desired status: "success"
        [ check  ]   "test (ubuntu-latest)" concluded with desired status: "success"
        [ check  ]   "lint" concluded with desired status: "success"
        [ check  ]   "lint-workflows" concluded with desired status: "success"
        [ check  ]   "plan" concluded with desired status: "success"
        [ check  ]   "changes" concluded with desired status: "success"
        [ state  ]   "clean" is desirable
        PR merged! 🎉 ✅


=============
  dhth/shfl
=============

-> checking PR #38
        ci: bump actions/checkout from 5 to 6
        https://github.com/dhth/shfl/pull/38
        Created: Mon, 1 Dec 2025 10:33:45 +0000
        Updated: Mon, 1 Dec 2025 10:33:46 +0000
        [ author ]   "dependabot[bot]" is in the list of trusted authors
        [ check  ]   "lint-yaml" concluded with desired status: "success"
        [ check  ]   "release-check" concluded with desired status: "success"
        [ check  ]   "lint-workflows" concluded with desired status: "success"
        [ check  ]   "test (ubuntu-latest)" concluded with desired status: "success"
        [ check  ]   "build (ubuntu-latest)" concluded with desired status: "success"
        [ check  ]   "test (macos-latest)" concluded with desired status: "success"
        [ check  ]   "audit" concluded with desired status: "success"
        [ check  ]   "build (macos-latest)" concluded with desired status: "success"
        [ check  ]   "lint" concluded with desired status: "success"
        [ check  ]   "changes" concluded with desired status: "success"
        [ state  ]   "clean" is desirable
        PR merged! 🎉 ✅


=============
  dhth/mult
=============

-> checking PR #39
        ci: bump actions/checkout from 5 to 6
        https://github.com/dhth/mult/pull/39
        Created: Mon, 1 Dec 2025 19:08:57 +0000
        Updated: Mon, 1 Dec 2025 19:08:58 +0000
        [ author ]   "dependabot[bot]" is in the list of trusted authors
        [ check  ]   "release-check" concluded with desired status: "success"
        [ check  ]   "lint-yaml" concluded with desired status: "success"
        [ check  ]   "lint-workflows" concluded with desired status: "success"
        [ check  ]   "vulncheck" concluded with desired status: "success"
        [ check  ]   "build (macos-latest)" concluded with desired status: "success"
        [ check  ]   "lint" concluded with desired status: "success"
        [ check  ]   "build (ubuntu-latest)" concluded with desired status: "success"
        [ check  ]   "changes" concluded with desired status: "success"
        [ state  ]   "clean" is desirable
        PR merged! 🎉 ✅


=============
  dhth/graphc
=============

-> checking PR #56
        ci: bump actions/checkout from 5 to 6
        https://github.com/dhth/graphc/pull/56
        Created: Mon, 1 Dec 2025 03:47:13 +0000
        Updated: Mon, 1 Dec 2025 03:47:39 +0000
        [ author ]   "dependabot[bot]" is in the list of trusted authors
        [ check  ]   "build (macos-latest)" concluded with desired status: "success"
        [ check  ]   "test (macos-latest)" concluded with desired status: "success"
        [ check  ]   "test (ubuntu-latest)" concluded with desired status: "success"
        [ check  ]   "dstlled-diff" concluded with desired status: "success"
        [ check  ]   "lint-yaml" concluded with desired status: "success"
        [ check  ]   "lint-workflows" concluded with desired status: "success"
        [ check  ]   "build (ubuntu-latest)" concluded with desired status: "success"
        [ check  ]   "lint" concluded with desired status: "success"
        [ check  ]   "changes" concluded with desired status: "success"
        [ state  ]   "clean" is desirable
        PR merged! 🎉 ✅


=============
  dhth/unreleased
=============

-> checking PR #8
        ci: bump actions/checkout from 5 to 6
        https://github.com/dhth/unreleased/pull/8
        Created: Mon, 1 Dec 2025 01:38:58 +0000
        Updated: Mon, 1 Dec 2025 01:39:04 +0000
        [ author ]   "dependabot[bot]" is in the list of trusted authors
        [ check  ]   "custom-publish-crates" concluded with desired status: "success"
        [ check  ]   "announce" concluded with desired status: "success"
        [ check  ]   "host" concluded with desired status: "success"
        [ check  ]   "publish-homebrew-formula" concluded with desired status: "success"
        [ check  ]   "build-local-artifacts (${{ join(matrix.targets, ', ') }})" concluded with desired status: "success"
        [ check  ]   "build-global-artifacts" concluded with desired status: "success"
        [ check  ]   "build" concluded with desired status: "success"
        [ check  ]   "test" concluded with desired status: "success"
        [ check  ]   "audit" concluded with desired status: "success"
        [ check  ]   "lint" concluded with desired status: "success"
        [ check  ]   "lint-workflows" concluded with desired status: "success"
        [ check  ]   "lint-yaml" concluded with desired status: "success"
        [ check  ]   "plan" concluded with desired status: "success"
        [ check  ]   "changes" concluded with desired status: "success"
        [ state  ]   "clean" is desirable
        PR merged! 🎉 ✅


=============
  dhth/tomo
=============

-> checking PR #81
        ci: bump taiki-e/install-action from 2.62.46 to 2.62.60
        https://github.com/dhth/tomo/pull/81
        Created: Mon, 1 Dec 2025 20:33:04 +0000
        Updated: Mon, 1 Dec 2025 20:33:05 +0000
        [ author ]   "dependabot[bot]" is in the list of trusted authors
        [ check  ]   "custom-release-packages" concluded with desired status: "success"
        [ check  ]   "announce" concluded with desired status: "success"
        [ check  ]   "publish-homebrew-formula" concluded with desired status: "success"
        [ check  ]   "host" concluded with desired status: "success"
        [ check  ]   "build-global-artifacts" concluded with desired status: "success"
        [ check  ]   "build-local-artifacts (${{ join(matrix.targets, ', ') }})" concluded with desired status: "success"
        [ check  ]   "dstlled-diff" concluded with desired status: "success"
        [ check  ]   "audit" concluded with desired status: "success"
        [ check  ]   "test (macos-latest)" concluded with desired status: "success"
        [ check  ]   "test (ubuntu-latest)" concluded with desired status: "success"
        [ check  ]   "build (macos-latest)" concluded with desired status: "success"
        [ check  ]   "build (ubuntu-latest)" concluded with desired status: "success"
        [ check  ]   "lint" concluded with desired status: "success"
        [ check  ]   "lint-workflows" concluded with desired status: "success"
        [ check  ]   "lint-yaml" concluded with desired status: "success"
        [ check  ]   "release-check" concluded with desired status: "success"
        [ check  ]   "plan" concluded with desired status: "success"
        [ check  ]   "changes" concluded with desired status: "success"
        [ state  ]   "clean" is desirable
        PR merged! 🎉 ✅


=============
  dhth/hours
=============

-> checking PR #128
        build: bump the patch-updates group with 3 updates
        https://github.com/dhth/hours/pull/128
        Created: Mon, 1 Dec 2025 05:30:58 +0000
        Updated: Mon, 1 Dec 2025 05:31:06 +0000
        [ author ]   "dependabot[bot]" is in the list of trusted authors
        [ check  ]   "live-tests (macos-latest)" concluded with desired status: "success"
        [ check  ]   "live-tests (ubuntu-latest)" concluded with desired status: "success"
        [ check  ]   "lint-workflows" concluded with desired status: "success"
        [ check  ]   "test (macos-latest)" concluded with desired status: "success"
        [ check  ]   "test (ubuntu-latest)" concluded with desired status: "success"
        [ check  ]   "lint-yaml" concluded with desired status: "success"
        [ check  ]   "back-compat (macos-latest)" concluded with desired status: "success"
        [ check  ]   "vulncheck" concluded with desired status: "success"
        [ check  ]   "back-compat (ubuntu-latest)" concluded with desired status: "success"
        [ check  ]   "release-check" concluded with desired status: "success"
        [ check  ]   "build (ubuntu-latest)" concluded with desired status: "success"
        [ check  ]   "build (macos-latest)" concluded with desired status: "success"
        [ check  ]   "lint" concluded with desired status: "success"
        [ check  ]   "changes" concluded with desired status: "success"
        [ state  ]   "clean" is desirable
        PR merged! 🎉 ✅


=============
  dhth/ting
=============

-> checking PR #46
        ci: bump actions/checkout from 5 to 6
        https://github.com/dhth/ting/pull/46
        Created: Mon, 1 Dec 2025 00:37:27 +0000
        Updated: Mon, 1 Dec 2025 00:37:53 +0000
        [ author ]   "dependabot[bot]" is in the list of trusted authors
        [ check  ]   "custom-publish-crates" concluded with desired status: "success"
        [ check  ]   "publish-homebrew-formula" concluded with desired status: "success"
        [ check  ]   "announce" concluded with desired status: "success"
        [ check  ]   "host" concluded with desired status: "success"
        [ check  ]   "build-local-artifacts (${{ join(matrix.targets, ', ') }})" concluded with desired status: "success"
        [ check  ]   "build-global-artifacts" concluded with desired status: "success"
        [ check  ]   "build (macos-latest)" concluded with desired status: "success"
        [ check  ]   "publish-check" concluded with desired status: "success"
        [ check  ]   "audit" concluded with desired status: "success"
        [ check  ]   "dstlled-diff" concluded with desired status: "success"
        [ check  ]   "lint-yaml" concluded with desired status: "success"
        [ check  ]   "lint-workflows" concluded with desired status: "success"
        [ check  ]   "lint" concluded with desired status: "success"
        [ check  ]   "test (macos-latest)" concluded with desired status: "success"
        [ check  ]   "build (ubuntu-latest)" concluded with desired status: "success"
        [ check  ]   "test (ubuntu-latest)" concluded with desired status: "success"
        [ check  ]   "plan" concluded with desired status: "success"
        [ check  ]   "changes" concluded with desired status: "success"
        [ state  ]   "clean" is desirable
        PR merged! 🎉 ✅


=============
  dhth/ghx
=============

-> checking PR #48
        ci: bump actions/checkout from 5 to 6
        https://github.com/dhth/ghx/pull/48
        Created: Mon, 1 Dec 2025 17:28:19 +0000
        [ author ]   "dependabot[bot]" is in the list of trusted authors
        [ check  ]   Github returned with an empty conclusion for the check preview; skipping as I can't make any assumptions here ❌

-> checking PR #49
        build: bump hyper from 1.7.0 to 1.8.1
        https://github.com/dhth/ghx/pull/49
        Created: Mon, 1 Dec 2025 17:43:52 +0000
        Updated: Mon, 1 Dec 2025 17:43:53 +0000
        [ author ]   "dependabot[bot]" is in the list of trusted authors
        [ check  ]   "preview" concluded with desired status: "success"
        [ check  ]   "build-gleam" concluded with desired status: "success"
        [ check  ]   "lint-gleam" concluded with desired status: "success"
        [ check  ]   "lint-rust" concluded with desired status: "success"
        [ check  ]   "build-rust (macos-latest)" concluded with desired status: "success"
        [ check  ]   "build-rust (ubuntu-latest)" concluded with desired status: "success"
        [ check  ]   "changes" concluded with desired status: "success"
        [ state  ]   "clean" is desirable
        PR merged! 🎉 ✅

[INFO] This run ended at 2025-12-01 22:07:23.300951064 UTC; took 3 seconds

===========
  SUMMARY
===========

- PRs merged:                    26
- PRs disqualified:              4
- Repos checked:                 40
- Repos with no relevant PRs:    12
- Errors encountered:            0

PRs merged
---

- [dhth/zero2prod] build: bump the patch-updates group with 3 updates
- [dhth/act3] build: bump the patch-updates group with 2 updates
- [dhth/squish] build: bump the patch-updates group with 2 updates
- [dhth/ddiff] ci: bump actions/checkout from 5 to 6
- [dhth/agent0] ci: bump golangci/golangci-lint-action from 8 to 9
- [dhth/tash] ci: bump actions/checkout from 5 to 6
- [dhth/commits] build: bump github.com/go-git/go-git/v5 from 5.16.3 to 5.16.4 in the patch-updates group
- [dhth/ecsv] build: bump github.com/olekukonko/tablewriter from 1.1.0 to 1.1.2 in the patch-updates group
- [dhth/outtasync] build: bump the minor-updates group with 5 updates
- [dhth/mrj] build: bump the patch-updates group with 2 updates
- [dhth/urll] ci: bump actions/checkout from 5 to 6
- [dhth/atls] ci: bump taiki-e/install-action from 2.62.46 to 2.62.60
- [dhth/omm] ci: bump golangci/golangci-lint-action from 8 to 9
- [dhth/kplay] build: bump the patch-updates group with 2 updates
- [dhth/dfft] ci: bump taiki-e/install-action from 2.62.46 to 2.62.60
- [dhth/ecscope] ci: bump taiki-e/install-action from 2.62.46 to 2.62.60
- [dhth/punchout] ci: bump golangci/golangci-lint-action from 8 to 9
- [dhth/tbll] ci: bump actions/checkout from 5 to 6
- [dhth/shfl] ci: bump actions/checkout from 5 to 6
- [dhth/mult] ci: bump actions/checkout from 5 to 6
- [dhth/graphc] ci: bump actions/checkout from 5 to 6
- [dhth/unreleased] ci: bump actions/checkout from 5 to 6
- [dhth/tomo] ci: bump taiki-e/install-action from 2.62.46 to 2.62.60
- [dhth/hours] build: bump the patch-updates group with 3 updates
- [dhth/ting] ci: bump actions/checkout from 5 to 6
- [dhth/ghx] build: bump hyper from 1.7.0 to 1.8.1

Disqualifications
---

- https://github.com/dhth/chronotes/pull/43        check preview: unknown conclusion
- https://github.com/dhth/dstll/pull/45            check vulncheck: failure
- https://github.com/dhth/dstll/pull/46            check vulncheck: failure
- https://github.com/dhth/ghx/pull/48              check preview: unknown conclusion