
                          __
          ___ ___   _ __ /\_\
        /' __` __`\/\`'__\/\ \
        /\ \/\ \/\ \ \ \/ \ \ \
        \ \_\ \_\ \_\ \_\ _\ \ \
         \/_/\/_/\/_/\/_//\ \_\ \
                         \ \____/
                          \/___/


[INFO] The time right now is 2025-12-02 23:07:56.058633141 UTC
[INFO] I'm only looking for PRs where the base branch is "main"
[INFO] I'm sorting PRs based on "creation date" in the "ascending" direction


=============
  dhth/ghx
=============

-> checking PR #48
        ci: bump actions/checkout from 5 to 6
        https://github.com/dhth/ghx/pull/48
        Created: Mon, 1 Dec 2025 17:28:19 +0000
        [ author ]   "dependabot[bot]" is in the list of trusted authors
        [ check  ]   Github returned with an empty conclusion for the check preview; skipping as I can't make any assumptions here ❌


=============
  dhth/hours
=============

-> checking PR #130
        ci: bump golangci/golangci-lint-action from 8 to 9
        https://github.com/dhth/hours/pull/130
        Created: Mon, 1 Dec 2025 05:44:20 +0000
        Updated: Mon, 1 Dec 2025 05:44:30 +0000
        [ author ]   "dependabot[bot]" is in the list of trusted authors
        [ check  ]   "live-tests (ubuntu-latest)" concluded with desired status: "success"
        [ check  ]   "live-tests (macos-latest)" concluded with desired status: "success"
        [ check  ]   "lint-workflows" concluded with desired status: "success"
        [ check  ]   "lint-yaml" concluded with desired status: "success"
        [ check  ]   "back-compat (ubuntu-latest)" concluded with desired status: "success"
        [ check  ]   "vulncheck" concluded with desired status: "success"
        [ check  ]   "release-check" concluded with desired status: "success"
        [ check  ]   "back-compat (macos-latest)" concluded with desired status: "success"
        [ check  ]   "test (ubuntu-latest)" concluded with desired status: "success"
        [ check  ]   "test (macos-latest)" concluded with desired status: "success"
        [ check  ]   "lint" concluded with desired status: "success"
        [ check  ]   "build (ubuntu-latest)" concluded with desired status: "success"
        [ check  ]   "build (macos-latest)" concluded with desired status: "success"
        [ check  ]   "changes" concluded with desired status: "success"
        [ state  ]   "unknown" is undesirable ❌


=============
  dhth/commits
=============

-> checking PR #34
        ci: bump actions/checkout from 5 to 6
        https://github.com/dhth/commits/pull/34
        Created: Mon, 1 Dec 2025 07:49:48 +0000
        Updated: Mon, 1 Dec 2025 07:49:49 +0000
        [ author ]   "dependabot[bot]" is in the list of trusted authors
        [ check  ]   "vulncheck" concluded with desired status: "success"
        [ check  ]   "release-check" concluded with desired status: "success"
        [ check  ]   "test" concluded with desired status: "success"
        [ check  ]   "lint-workflows" concluded with desired status: "success"
        [ check  ]   "build (ubuntu-latest)" concluded with desired status: "success"
        [ check  ]   "lint-yaml" concluded with desired status: "success"
        [ check  ]   "build (macos-latest)" concluded with desired status: "success"
        [ check  ]   "lint" concluded with desired status: "success"
        [ check  ]   "changes" concluded with desired status: "success"
        [ state  ]   "blocked" is undesirable ❌


=============
  dhth/squish
=============

-> checking PR #64
        ci: bump actions/checkout from 5 to 6
        https://github.com/dhth/squish/pull/64
        Created: Mon, 1 Dec 2025 17:22:16 +0000
        Updated: Mon, 1 Dec 2025 17:22:17 +0000
        [ author ]   "dependabot[bot]" is in the list of trusted authors
        [ check  ]   "lint-workflows" concluded with desired status: "success"
        [ check  ]   "audit" concluded with desired status: "success"
        [ check  ]   "test (ubuntu-latest)" concluded with desired status: "success"
        [ check  ]   "lint-yaml" concluded with desired status: "success"
        [ check  ]   "test (macos-latest)" concluded with desired status: "success"
        [ check  ]   "build (macos-latest)" concluded with desired status: "success"
        [ check  ]   "lint" concluded with desired status: "success"
        [ check  ]   "build (ubuntu-latest)" concluded with desired status: "success"
        [ check  ]   "changes" concluded with desired status: "success"
        [ state  ]   "blocked" is undesirable ❌


=============
  dhth/mult
=============

-> checking PR #40
        ci: bump golangci/golangci-lint-action from 8 to 9
        https://github.com/dhth/mult/pull/40
        Created: Mon, 1 Dec 2025 19:09:01 +0000
        [ author ]   "dependabot[bot]" is in the list of trusted authors
        [ check  ]   "lint-workflows" concluded with desired status: "success"
        [ check  ]   "build (ubuntu-latest)" concluded with desired status: "success"
        [ check  ]   "build (macos-latest)" concluded with desired status: "success"
        [ check  ]   "lint" concluded with desired status: "success"
        [ check  ]   "vulncheck" concluded with desired status: "success"
        [ check  ]   "release-check" concluded with desired status: "success"
        [ check  ]   "lint-yaml" concluded with desired status: "success"
        [ check  ]   "changes" concluded with desired status: "success"
        [ state  ]   "blocked" is undesirable ❌


=============
  dhth/schemas
=============

-> checking PR #42
        ci: bump golangci/golangci-lint-action from 8 to 9
        https://github.com/dhth/schemas/pull/42
        Created: Mon, 1 Dec 2025 23:17:17 +0000
        Updated: Mon, 1 Dec 2025 23:17:18 +0000
        [ author ]   "dependabot[bot]" is in the list of trusted authors
        [ check  ]   "vulncheck" concluded with desired status: "success"
        [ check  ]   "test" concluded with desired status: "success"
        [ check  ]   "lint-workflows" concluded with desired status: "success"
        [ check  ]   "release-check" concluded with desired status: "success"
        [ check  ]   "lint-yaml" concluded with desired status: "success"
        [ check  ]   "build (macos-latest)" concluded with desired status: "success"
        [ check  ]   "build (ubuntu-latest)" concluded with desired status: "success"
        [ check  ]   "lint" concluded with desired status: "success"
        [ check  ]   "changes" concluded with desired status: "success"
        [ state  ]   "blocked" is undesirable ❌


=============
  dhth/atls
=============

-> checking PR #18
        ci: bump actions/checkout from 5 to 6
        https://github.com/dhth/atls/pull/18
        Created: Mon, 1 Dec 2025 01:32:06 +0000
        [ author ]   "dependabot[bot]" is in the list of trusted authors
        [ check  ]   "lint-yaml" concluded with desired status: "success"
        [ check  ]   "lint-workflows" concluded with desired status: "success"
        [ check  ]   "test (ubuntu-latest)" concluded with desired status: "success"
        [ check  ]   "build (ubuntu-latest)" concluded with desired status: "success"
        [ check  ]   "build (macos-latest)" concluded with desired status: "success"
        [ check  ]   "test (macos-latest)" concluded with desired status: "success"
        [ check  ]   "lint" concluded with desired status: "success"
        [ check  ]   "changes" concluded with desired status: "success"
        [ state  ]   "blocked" is undesirable ❌


=============
  dhth/kplay
=============

-> checking PR #136
        ci: bump golangci/golangci-lint-action from 8 to 9
        https://github.com/dhth/kplay/pull/136
        Created: Mon, 1 Dec 2025 16:43:33 +0000
        Updated: Mon, 1 Dec 2025 16:43:34 +0000
        [ author ]   "dependabot[bot]" is in the list of trusted authors
        [ check  ]   "release-check" concluded with desired status: "success"
        [ check  ]   "vulncheck" concluded with desired status: "success"
        [ check  ]   "test-go (ubuntu-latest)" concluded with desired status: "success"
        [ check  ]   "test-go (macos-latest)" concluded with desired status: "success"
        [ check  ]   "lint-workflows" concluded with desired status: "success"
        [ check  ]   "build-gleam" concluded with desired status: "success"
        [ check  ]   "lint-yaml" concluded with desired status: "success"
        [ check  ]   "build-go (ubuntu-latest)" concluded with desired status: "success"
        [ check  ]   "build-go (macos-latest)" concluded with desired status: "success"
        [ check  ]   "lint-gleam" concluded with desired status: "success"
        [ check  ]   "lint-go" concluded with desired status: "success"
        [ check  ]   "changes" concluded with desired status: "success"
        [ state  ]   "blocked" is undesirable ❌


=============
  dhth/prs
=============

-> checking PR #62
        ci: bump golangci/golangci-lint-action from 8 to 9
        https://github.com/dhth/prs/pull/62
        Created: Mon, 1 Dec 2025 23:32:33 +0000
        [ author ]   "dependabot[bot]" is in the list of trusted authors
        [ check  ]   "vulncheck" concluded with desired status: "success"
        [ check  ]   "release-check" concluded with desired status: "success"
        [ check  ]   "lint-workflows" concluded with desired status: "success"
        [ check  ]   "test" concluded with desired status: "success"
        [ check  ]   "lint-yaml" concluded with desired status: "success"
        [ check  ]   "build (ubuntu-latest)" concluded with desired status: "success"
        [ check  ]   "lint" concluded with desired status: "success"
        [ check  ]   "build (macos-latest)" concluded with desired status: "success"
        [ check  ]   "changes" concluded with desired status: "success"
        [ state  ]   "blocked" is undesirable ❌


=============
  dhth/chronotes
=============

-> checking PR #43
        chore(deps): bump actions/checkout from 5 to 6
        https://github.com/dhth/chronotes/pull/43
        Created: Mon, 1 Dec 2025 03:42:29 +0000
        Updated: Mon, 1 Dec 2025 03:42:30 +0000
        [ author ]   "dependabot[bot]" is in the list of trusted authors
        [ check  ]   Github returned with an empty conclusion for the check preview; skipping as I can't make any assumptions here ❌


=============
  dhth/punchout
=============

-> checking PR #90
        ci: bump actions/checkout from 5 to 6
        https://github.com/dhth/punchout/pull/90
        Created: Mon, 1 Dec 2025 16:44:50 +0000
        [ author ]   "dependabot[bot]" is in the list of trusted authors
        [ check  ]   "vulncheck" concluded with desired status: "success"
        [ check  ]   "release-check" concluded with desired status: "success"
        [ check  ]   "test (ubuntu-latest)" concluded with desired status: "success"
        [ check  ]   "lint-workflows" concluded with desired status: "success"
        [ check  ]   "lint-yaml" concluded with desired status: "success"
        [ check  ]   "test (macos-latest)" concluded with desired status: "success"
        [ check  ]   "lint" concluded with desired status: "success"
        [ check  ]   "build (macos-latest)" concluded with desired status: "success"
        [ check  ]   "build (ubuntu-latest)" concluded with desired status: "success"
        [ check  ]   "changes" concluded with desired status: "success"
        [ state  ]   "blocked" is undesirable ❌


=============
  dhth/outtasync
=============

-> checking PR #140
        ci: bump golangci/golangci-lint-action from 8 to 9
        https://github.com/dhth/outtasync/pull/140
        Created: Mon, 1 Dec 2025 02:24:56 +0000
        [ author ]   "dependabot[bot]" is in the list of trusted authors
        [ check  ]   "lint-workflows" concluded with desired status: "success"
        [ check  ]   "release-check" concluded with desired status: "success"
        [ check  ]   "lint-yaml" concluded with desired status: "success"
        [ check  ]   "vulncheck" concluded with desired status: "success"
        [ check  ]   "test" concluded with desired status: "success"
        [ check  ]   "build (ubuntu-latest)" concluded with desired status: "success"
        [ check  ]   "build (macos-latest)" concluded with desired status: "success"
        [ check  ]   "lint" concluded with desired status: "success"
        [ check  ]   "changes" concluded with desired status: "success"
        [ state  ]   "blocked" is undesirable ❌


=============
  dhth/ting
=============

-> checking PR #47
        ci: bump taiki-e/install-action from 2.62.46 to 2.62.60
        https://github.com/dhth/ting/pull/47
        Created: Mon, 1 Dec 2025 00:37:44 +0000
        Updated: Mon, 1 Dec 2025 00:38:08 +0000
        [ author ]   "dependabot[bot]" is in the list of trusted authors
        [ check  ]   "announce" concluded with desired status: "success"
        [ check  ]   "custom-publish-crates" concluded with desired status: "success"
        [ check  ]   "publish-homebrew-formula" concluded with desired status: "success"
        [ check  ]   "build-local-artifacts (${{ join(matrix.targets, ', ') }})" concluded with desired status: "success"
        [ check  ]   "host" concluded with desired status: "success"
        [ check  ]   "build-global-artifacts" concluded with desired status: "success"
        [ check  ]   "lint-workflows" concluded with desired status: "success"
        [ check  ]   "dstlled-diff" concluded with desired status: "success"
        [ check  ]   "publish-check" concluded with desired status: "success"
        [ check  ]   "lint-yaml" concluded with desired status: "success"
        [ check  ]   "audit" concluded with desired status: "success"
        [ check  ]   "lint" concluded with desired status: "success"
        [ check  ]   "test (macos-latest)" concluded with desired status: "success"
        [ check  ]   "build (ubuntu-latest)" concluded with desired status: "success"
        [ check  ]   "build (macos-latest)" concluded with desired status: "success"
        [ check  ]   "test (ubuntu-latest)" concluded with desired status: "success"
        [ check  ]   "plan" concluded with desired status: "success"
        [ check  ]   "changes" concluded with desired status: "success"
        [ state  ]   "blocked" is undesirable ❌


=============
  dhth/omm
=============

-> checking PR #107
        ci: bump actions/checkout from 5 to 6
        https://github.com/dhth/omm/pull/107
        Created: Mon, 1 Dec 2025 07:21:51 +0000
        [ author ]   "dependabot[bot]" is in the list of trusted authors
        [ check  ]   "release-check" concluded with desired status: "success"
        [ check  ]   "back-compat (ubuntu-latest)" concluded with desired status: "success"
        [ check  ]   "lint-workflows" concluded with desired status: "success"
        [ check  ]   "lint" concluded with desired status: "success"
        [ check  ]   "back-compat (macos-latest)" concluded with desired status: "success"
        [ check  ]   "lint-yaml" concluded with desired status: "success"
        [ check  ]   "vulncheck" concluded with desired status: "success"
        [ check  ]   "build (ubuntu-latest)" concluded with desired status: "success"
        [ check  ]   "build (macos-latest)" concluded with desired status: "success"
        [ check  ]   "test" concluded with desired status: "success"
        [ check  ]   "changes" concluded with desired status: "success"
        [ state  ]   "blocked" is undesirable ❌


=============
  dhth/tomo
=============

-> checking PR #82
        ci: bump actions/checkout from 5 to 6
        https://github.com/dhth/tomo/pull/82
        Created: Mon, 1 Dec 2025 20:33:09 +0000
        [ author ]   "dependabot[bot]" is in the list of trusted authors
        [ check  ]   "custom-release-packages" concluded with desired status: "success"
        [ check  ]   "publish-homebrew-formula" concluded with desired status: "success"
        [ check  ]   "announce" concluded with desired status: "success"
        [ check  ]   "host" concluded with desired status: "success"
        [ check  ]   "build-global-artifacts" concluded with desired status: "success"
        [ check  ]   "build-local-artifacts (${{ join(matrix.targets, ', ') }})" concluded with desired status: "success"
        [ check  ]   "dstlled-diff" concluded with desired status: "success"
        [ check  ]   "audit" concluded with desired status: "success"
        [ check  ]   "lint-yaml" concluded with desired status: "success"
        [ check  ]   "release-check" concluded with desired status: "success"
        [ check  ]   "lint" concluded with desired status: "success"
        [ check  ]   "lint-workflows" concluded with desired status: "success"
        [ check  ]   "test (ubuntu-latest)" concluded with desired status: "success"
        [ check  ]   "test (macos-latest)" concluded with desired status: "success"
        [ check  ]   "build (macos-latest)" concluded with desired status: "success"
        [ check  ]   "build (ubuntu-latest)" concluded with desired status: "success"
        [ check  ]   "plan" concluded with desired status: "success"
        [ check  ]   "changes" concluded with desired status: "success"
        [ state  ]   "blocked" is undesirable ❌


=============
  dhth/ecscope
=============

-> checking PR #106
        ci: bump actions/checkout from 5 to 6
        https://github.com/dhth/ecscope/pull/106
        Created: Mon, 1 Dec 2025 01:37:08 +0000
        Updated: Mon, 1 Dec 2025 01:37:46 +0000
        [ author ]   "dependabot[bot]" is in the list of trusted authors
        [ check  ]   "custom-publish-crates" concluded with desired status: "success"
        [ check  ]   "announce" concluded with desired status: "success"
        [ check  ]   "publish-homebrew-formula" concluded with desired status: "success"
        [ check  ]   "host" concluded with desired status: "success"
        [ check  ]   "build-global-artifacts" concluded with desired status: "success"
        [ check  ]   "build-local-artifacts (${{ join(matrix.targets, ', ') }})" concluded with desired status: "success"
        [ check  ]   "audit" concluded with desired status: "success"
        [ check  ]   "publish-check" concluded with desired status: "success"
        [ check  ]   "build-rust (macos-latest)" concluded with desired status: "success"
        [ check  ]   "build-rust (ubuntu-latest)" concluded with desired status: "success"
        [ check  ]   "back-compat" concluded with desired status: "success"
        [ check  ]   "dstlled-diff" concluded with desired status: "success"
        [ check  ]   "lint-workflows" concluded with desired status: "success"
        [ check  ]   "test-rust (macos-latest)" concluded with desired status: "success"
        [ check  ]   "lint-yaml" concluded with desired status: "success"
        [ check  ]   "test-rust (ubuntu-latest)" concluded with desired status: "success"
        [ check  ]   "test-gleam" concluded with desired status: "success"
        [ check  ]   "build-gleam" concluded with desired status: "success"
        [ check  ]   "lint-rust" concluded with desired status: "success"
        [ check  ]   "lint-gleam" concluded with desired status: "success"
        [ check  ]   "plan" concluded with desired status: "success"
        [ check  ]   "changes" concluded with desired status: "success"
        [ state  ]   "blocked" is undesirable ❌


=============
  dhth/mrj
=============

-> checking PR #72
        build: bump octocrab from 0.47.1 to 0.48.0
        https://github.com/dhth/mrj/pull/72
        Created: Mon, 1 Dec 2025 19:32:24 +0000
        Updated: Tue, 2 Dec 2025 00:23:15 +0000
        [ author ]   "dependabot[bot]" is in the list of trusted authors
        [ check  ]   "custom-publish-crates" concluded with desired status: "success"
        [ check  ]   "announce" concluded with desired status: "success"
        [ check  ]   "publish-homebrew-formula" concluded with desired status: "success"
        [ check  ]   "build-local-artifacts (${{ join(matrix.targets, ', ') }})" concluded with desired status: "success"
        [ check  ]   "host" concluded with desired status: "success"
        [ check  ]   "build-global-artifacts" concluded with desired status: "success"
        [ check  ]   "dry-run" concluded with desired status: "success"
        [ check  ]   "lint-workflows" concluded with desired status: "success"
        [ check  ]   "audit" concluded with undesired status: "failure" ❌


=============
  dhth/tbll
=============

-> checking PR #73
        ci: bump taiki-e/install-action from 2.62.46 to 2.62.60
        https://github.com/dhth/tbll/pull/73
        Created: Mon, 1 Dec 2025 11:10:10 +0000
        Updated: Mon, 1 Dec 2025 11:10:11 +0000
        [ author ]   "dependabot[bot]" is in the list of trusted authors
        [ check  ]   "announce" concluded with desired status: "success"
        [ check  ]   "custom-release-packages" concluded with desired status: "success"
        [ check  ]   "publish-homebrew-formula" concluded with desired status: "success"
        [ check  ]   "host" concluded with desired status: "success"
        [ check  ]   "build-global-artifacts" concluded with desired status: "success"
        [ check  ]   "build-local-artifacts (${{ join(matrix.targets, ', ') }})" concluded with desired status: "success"
        [ check  ]   "test (ubuntu-latest)" concluded with desired status: "success"
        [ check  ]   "build (ubuntu-latest)" concluded with desired status: "success"
        [ check  ]   "build (macos-latest)" concluded with desired status: "success"
        [ check  ]   "audit" concluded with desired status: "success"
        [ check  ]   "lint-yaml" concluded with desired status: "success"
        [ check  ]   "test (macos-latest)" concluded with desired status: "success"
        [ check  ]   "lint-workflows" concluded with desired status: "success"
        [ check  ]   "lint" concluded with desired status: "success"
        [ check  ]   "plan" concluded with desired status: "success"
        [ check  ]   "changes" concluded with desired status: "success"
        [ state  ]   "blocked" is undesirable ❌


=============
  dhth/dfft
=============

-> checking PR #80
        ci: bump actions/checkout from 5 to 6
        https://github.com/dhth/dfft/pull/80
        Created: Mon, 1 Dec 2025 02:43:29 +0000
        Updated: Mon, 1 Dec 2025 02:44:13 +0000
        [ author ]   "dependabot[bot]" is in the list of trusted authors
        [ check  ]   "custom-publish-crates" concluded with desired status: "success"
        [ check  ]   "announce" concluded with desired status: "success"
        [ check  ]   "publish-homebrew-formula" concluded with desired status: "success"
        [ check  ]   "host" concluded with desired status: "success"
        [ check  ]   "build-global-artifacts" concluded with desired status: "success"
        [ check  ]   "build-local-artifacts (${{ join(matrix.targets, ', ') }})" concluded with desired status: "success"
        [ check  ]   "lint-no-sound" concluded with desired status: "success"
        [ check  ]   "publish-check" concluded with desired status: "success"
        [ check  ]   "audit" concluded with desired status: "success"
        [ check  ]   "dstlled-diff" concluded with desired status: "success"
        [ check  ]   "test-macos-latest-default" concluded with desired status: "success"
        [ check  ]   "test-ubuntu-latest-default" concluded with desired status: "success"
        [ check  ]   "lint-workflows" concluded with desired status: "success"
        [ check  ]   "test-macos-latest-no-sound" concluded with desired status: "success"
        [ check  ]   "build-macos-latest-no-sound" concluded with desired status: "success"
        [ check  ]   "build-macos-latest-default" concluded with desired status: "success"
        [ check  ]   "lint-yaml" concluded with desired status: "success"
        [ check  ]   "build-ubuntu-latest-default" concluded with desired status: "success"
        [ check  ]   "test-ubuntu-latest-no-sound" concluded with desired status: "success"
        [ check  ]   "build-ubuntu-latest-no-sound" concluded with desired status: "success"
        [ check  ]   "lint-default" concluded with desired status: "success"
        [ check  ]   "plan" concluded with desired status: "success"
        [ check  ]   "changes" concluded with desired status: "success"
        [ state  ]   "blocked" is undesirable ❌


=============
  dhth/act3
=============

-> checking PR #64
        ci: bump golangci/golangci-lint-action from 8 to 9
        https://github.com/dhth/act3/pull/64
        Created: Mon, 1 Dec 2025 16:55:11 +0000
        Updated: Mon, 1 Dec 2025 16:55:12 +0000
        [ author ]   "dependabot[bot]" is in the list of trusted authors
        [ check  ]   "run" concluded with desired status: "success"
        [ check  ]   "lint-workflows" concluded with desired status: "success"
        [ check  ]   "test (ubuntu-latest)" concluded with desired status: "success"
        [ check  ]   "build (macos-latest)" concluded with desired status: "success"
        [ check  ]   "release-check" concluded with desired status: "success"
        [ check  ]   "lint-yaml" concluded with desired status: "success"
        [ check  ]   "build (ubuntu-latest)" concluded with desired status: "success"
        [ check  ]   "test (macos-latest)" concluded with desired status: "success"
        [ check  ]   "lint" concluded with desired status: "success"
        [ check  ]   "changes" concluded with desired status: "success"
        [ state  ]   "clean" is desirable
        error 😵: couldn't merge PR


=============
  dhth/agent0
=============

-> checking PR #21
        ci: bump actions/checkout from 5 to 6
        https://github.com/dhth/agent0/pull/21
        Created: Mon, 1 Dec 2025 01:35:23 +0000
        Updated: Mon, 1 Dec 2025 01:35:24 +0000
        [ author ]   "dependabot[bot]" is in the list of trusted authors
        [ check  ]   "vulncheck" concluded with desired status: "success"
        [ check  ]   "lint-workflows" concluded with desired status: "success"
        [ check  ]   "lint-yaml" concluded with desired status: "success"
        [ check  ]   "test" concluded with desired status: "success"
        [ check  ]   "build (macos-latest)" concluded with desired status: "success"
        [ check  ]   "build (ubuntu-latest)" concluded with desired status: "success"
        [ check  ]   "lint" concluded with desired status: "success"
        [ check  ]   "changes" concluded with desired status: "success"
        [ state  ]   "clean" is desirable
        error 😵: couldn't merge PR


=============
  dhth/ecsv
=============

-> checking PR #150
        ci: bump golangci/golangci-lint-action from 8 to 9
        https://github.com/dhth/ecsv/pull/150
        Created: Mon, 1 Dec 2025 14:37:38 +0000
        Updated: Mon, 1 Dec 2025 14:37:39 +0000
        [ author ]   "dependabot[bot]" is in the list of trusted authors
        [ check  ]   "vulncheck" concluded with desired status: "success"
        [ check  ]   "lint-workflows" concluded with desired status: "success"
        [ check  ]   "release-check" concluded with desired status: "success"
        [ check  ]   "build (ubuntu-latest)" concluded with desired status: "success"
        [ check  ]   "test (ubuntu-latest)" concluded with desired status: "success"
        [ check  ]   "build (macos-latest)" concluded with desired status: "success"
        [ check  ]   "lint" concluded with desired status: "success"
        [ check  ]   "lint-yaml" concluded with desired status: "success"
        [ check  ]   "test (macos-latest)" concluded with desired status: "success"
        [ check  ]   "changes" concluded with desired status: "success"
        [ state  ]   "clean" is desirable
        error 😵: couldn't merge PR


=============
  dhth/tash
=============

-> checking PR #64
        ci: bump taiki-e/install-action from 2.62.46 to 2.62.60
        https://github.com/dhth/tash/pull/64
        Created: Mon, 1 Dec 2025 19:16:09 +0000
        Updated: Mon, 1 Dec 2025 19:16:10 +0000
        [ author ]   "dependabot[bot]" is in the list of trusted authors
        [ check  ]   "custom-publish-crates" concluded with desired status: "success"
        [ check  ]   "announce" concluded with desired status: "success"
        [ check  ]   "host" concluded with desired status: "success"
        [ check  ]   "publish-homebrew-formula" concluded with desired status: "success"
        [ check  ]   "build-global-artifacts" concluded with desired status: "success"
        [ check  ]   "build-local-artifacts (${{ join(matrix.targets, ', ') }})" concluded with desired status: "success"
        [ check  ]   "test (ubuntu-latest)" concluded with desired status: "success"
        [ check  ]   "test (macos-latest)" concluded with desired status: "success"
        [ check  ]   "build (ubuntu-latest)" concluded with desired status: "success"
        [ check  ]   "lint" concluded with desired status: "success"
        [ check  ]   "audit" concluded with desired status: "success"
        [ check  ]   "build (macos-latest)" concluded with desired status: "success"
        [ check  ]   "publish-check" concluded with desired status: "success"
        [ check  ]   "lint-workflows" concluded with desired status: "success"
        [ check  ]   "lint-yaml" concluded with desired status: "success"
        [ check  ]   "plan" concluded with desired status: "success"
        [ check  ]   "changes" concluded with desired status: "success"
        [ state  ]   "clean" is desirable
        error 😵: couldn't merge PR


=============
  dhth/dstll
=============

-> checking PR #45
        ci: bump actions/checkout from 5 to 6
        https://github.com/dhth/dstll/pull/45
        Created: Mon, 1 Dec 2025 05:43:20 +0000
        Updated: Mon, 1 Dec 2025 05:43:42 +0000
        [ author ]   "dependabot[bot]" is in the list of trusted authors
        [ check  ]   "lint-yaml" concluded with desired status: "success"
        [ check  ]   "lint-workflows" concluded with desired status: "success"
        [ check  ]   "run (ubuntu-latest)" concluded with desired status: "success"
        [ check  ]   "test" concluded with desired status: "success"
        [ check  ]   "run (macos-latest)" concluded with desired status: "success"
        [ check  ]   "dstlled-diff" concluded with desired status: "success"
        [ check  ]   "release-check" concluded with desired status: "success"
        [ check  ]   "vulncheck" concluded with undesired status: "failure" ❌

-> checking PR #46
        ci: bump golangci/golangci-lint-action from 8 to 9
        https://github.com/dhth/dstll/pull/46
        Created: Mon, 1 Dec 2025 05:43:23 +0000
        Updated: Mon, 1 Dec 2025 05:43:52 +0000
        [ author ]   "dependabot[bot]" is in the list of trusted authors
        [ check  ]   "dstlled-diff" concluded with desired status: "success"
        [ check  ]   "lint-workflows" concluded with desired status: "success"
        [ check  ]   "release-check" concluded with desired status: "success"
        [ check  ]   "run (macos-latest)" concluded with desired status: "success"
        [ check  ]   "lint-yaml" concluded with desired status: "success"
        [ check  ]   "run (ubuntu-latest)" concluded with desired status: "success"
        [ check  ]   "test" concluded with desired status: "success"
        [ check  ]   "vulncheck" concluded with undesired status: "failure" ❌


=============
  dhth/graphc
=============

-> checking PR #61
        build: bump pytest from 8.4.2 to 9.0.1
        https://github.com/dhth/graphc/pull/61
        Created: Mon, 1 Dec 2025 03:49:47 +0000
        Updated: Tue, 2 Dec 2025 02:14:10 +0000
        [ author ]   "dependabot[bot]" is in the list of trusted authors
        [ check  ]   "lint-yaml" concluded with desired status: "success"
        [ check  ]   "lint-workflows" concluded with desired status: "success"
        [ check  ]   "dstlled-diff" concluded with desired status: "success"
        [ check  ]   "test (ubuntu-latest)" concluded with desired status: "success"
        [ check  ]   "lint" concluded with desired status: "success"
        [ check  ]   "test (macos-latest)" concluded with desired status: "success"
        [ check  ]   "build (macos-latest)" concluded with desired status: "success"
        [ check  ]   "build (ubuntu-latest)" concluded with desired status: "success"
        [ check  ]   "changes" concluded with desired status: "success"
        [ state  ]   "clean" is desirable
        PR merged! 🎉 ✅


=============
  dhth/tflens
=============

-> checking PR #15
        ci: bump golangci/golangci-lint-action from 8 to 9
        https://github.com/dhth/tflens/pull/15
        Created: Tue, 2 Dec 2025 00:14:52 +0000
        Updated: Tue, 2 Dec 2025 00:14:53 +0000
        [ author ]   "dependabot[bot]" is in the list of trusted authors
        [ check  ]   "build (ubuntu-latest)" concluded with desired status: "success"
        [ check  ]   "build (macos-latest)" concluded with desired status: "success"
        [ check  ]   "vulncheck" concluded with desired status: "success"
        [ check  ]   "test (macos-latest)" concluded with desired status: "success"
        [ check  ]   "test (ubuntu-latest)" concluded with desired status: "success"
        [ check  ]   "lint-yaml" concluded with desired status: "success"
        [ check  ]   "lint-workflows" concluded with desired status: "success"
        [ check  ]   "lint" concluded with desired status: "success"
        [ check  ]   "changes" concluded with desired status: "success"
        [ state  ]   "clean" is desirable
        PR merged! 🎉 ✅


=============
  dhth/cueitup
=============

-> checking PR #100
        ci: bump actions/checkout from 5 to 6
        https://github.com/dhth/cueitup/pull/100
        Created: Tue, 2 Dec 2025 01:07:34 +0000
        Updated: Tue, 2 Dec 2025 01:07:35 +0000
        [ author ]   "dependabot[bot]" is in the list of trusted authors
        [ check  ]   "vulncheck" concluded with desired status: "success"
        [ check  ]   "lint-yaml" concluded with desired status: "success"
        [ check  ]   "build-go (macos-latest)" concluded with desired status: "success"
        [ check  ]   "lint-workflows" concluded with desired status: "success"
        [ check  ]   "build-go (ubuntu-latest)" concluded with desired status: "success"
        [ check  ]   "test-go (macos-latest)" concluded with desired status: "success"
        [ check  ]   "release-check" concluded with desired status: "success"
        [ check  ]   "build-gleam" concluded with desired status: "success"
        [ check  ]   "test-go (ubuntu-latest)" concluded with desired status: "success"
        [ check  ]   "lint-go" concluded with desired status: "success"
        [ check  ]   "lint-gleam" concluded with desired status: "success"
        [ check  ]   "changes" concluded with desired status: "success"
        [ state  ]   "blocked" is undesirable ❌

-> checking PR #101
        build: bump github.com/aws/aws-sdk-go-v2/service/sqs from 1.42.13 to 1.42.17 in the patch-updates group
        https://github.com/dhth/cueitup/pull/101
        Created: Tue, 2 Dec 2025 01:23:41 +0000
        Updated: Tue, 2 Dec 2025 01:23:42 +0000
        [ author ]   "dependabot[bot]" is in the list of trusted authors
        [ check  ]   "release-check" concluded with desired status: "success"
        [ check  ]   "build-gleam" concluded with desired status: "success"
        [ check  ]   "lint-gleam" concluded with desired status: "success"
        [ check  ]   "lint-yaml" concluded with desired status: "success"
        [ check  ]   "lint-workflows" concluded with desired status: "success"
        [ check  ]   "test-go (ubuntu-latest)" concluded with desired status: "success"
        [ check  ]   "test-go (macos-latest)" concluded with desired status: "success"
        [ check  ]   "build-go (macos-latest)" concluded with desired status: "success"
        [ check  ]   "vulncheck" concluded with desired status: "success"
        [ check  ]   "build-go (ubuntu-latest)" concluded with desired status: "success"
        [ check  ]   "lint-go" concluded with desired status: "success"
        [ check  ]   "changes" concluded with desired status: "success"
        [ state  ]   "clean" is desirable
        PR merged! 🎉 ✅

[INFO] This run ended at 2025-12-02 23:07:59.558925912 UTC; took 3 seconds

===========
  SUMMARY
===========

- PRs merged:                    3
- PRs disqualified:              22
- Repos checked:                 41
- Repos with no relevant PRs:    14
- Errors encountered:            4

PRs merged
---

- [dhth/graphc] build: bump pytest from 8.4.2 to 9.0.1
- [dhth/tflens] ci: bump golangci/golangci-lint-action from 8 to 9
- [dhth/cueitup] build: bump github.com/aws/aws-sdk-go-v2/service/sqs from 1.42.13 to 1.42.17 in the patch-updates group

Disqualifications
---

- https://github.com/dhth/ghx/pull/48               check preview: unknown conclusion
- https://github.com/dhth/hours/pull/130            state: unknown
- https://github.com/dhth/commits/pull/34           state: blocked
- https://github.com/dhth/squish/pull/64            state: blocked
- https://github.com/dhth/mult/pull/40              state: blocked
- https://github.com/dhth/schemas/pull/42           state: blocked
- https://github.com/dhth/atls/pull/18              state: blocked
- https://github.com/dhth/kplay/pull/136            state: blocked
- https://github.com/dhth/prs/pull/62               state: blocked
- https://github.com/dhth/chronotes/pull/43         check preview: unknown conclusion
- https://github.com/dhth/punchout/pull/90          state: blocked
- https://github.com/dhth/outtasync/pull/140        state: blocked
- https://github.com/dhth/ting/pull/47              state: blocked
- https://github.com/dhth/omm/pull/107              state: blocked
- https://github.com/dhth/tomo/pull/82              state: blocked
- https://github.com/dhth/ecscope/pull/106          state: blocked
- https://github.com/dhth/mrj/pull/72               check audit: failure
- https://github.com/dhth/tbll/pull/73              state: blocked
- https://github.com/dhth/dfft/pull/80              state: blocked
- https://github.com/dhth/dstll/pull/45             check vulncheck: failure
- https://github.com/dhth/dstll/pull/46             check vulncheck: failure
- https://github.com/dhth/cueitup/pull/100          state: blocked