
                          __
          ___ ___   _ __ /\_\
        /' __` __`\/\`'__\/\ \
        /\ \/\ \/\ \ \ \/ \ \ \
        \ \_\ \_\ \_\ \_\ _\ \ \
         \/_/\/_/\/_/\/_//\ \_\ \
                         \ \____/
                          \/___/


[INFO] The time right now is 2025-12-01 23:36:23.336221876 UTC
[INFO] I'm only looking for PRs where the base branch is "main"
[INFO] I'm sorting PRs based on "creation date" in the "ascending" direction


=============
  dhth/ddiff
=============

-> checking PR #40
        build: bump the minor-updates group with 2 updates
        https://github.com/dhth/ddiff/pull/40
        Created: Mon, 1 Dec 2025 00:37:47 +0000
        Updated: Mon, 1 Dec 2025 23:08:21 +0000
        [ author ]   "dependabot[bot]" is in the list of trusted authors
        [ check  ]   "Vercel Preview Comments" concluded with desired status: "success"
        [ check  ]   "lint" concluded with desired status: "success"
        [ state  ]   "dirty" is undesirable ❌


=============
  dhth/tflens
=============

-> checking PR #14
        build: bump github.com/goccy/go-yaml from 1.18.0 to 1.19.0 in the minor-updates group
        https://github.com/dhth/tflens/pull/14
        Created: Mon, 1 Dec 2025 22:24:29 +0000
        Updated: Mon, 1 Dec 2025 22:39:02 +0000
        [ author ]   "dependabot[bot]" is in the list of trusted authors
        [ check  ]   "lint-workflows" concluded with desired status: "success"
        [ check  ]   "lint-yaml" concluded with desired status: "success"
        [ check  ]   "vulncheck" concluded with desired status: "success"
        [ check  ]   "build (macos-latest)" concluded with desired status: "success"
        [ check  ]   "build (ubuntu-latest)" concluded with desired status: "success"
        [ check  ]   "test (macos-latest)" concluded with desired status: "success"
        [ check  ]   "test (ubuntu-latest)" concluded with desired status: "success"
        [ check  ]   "lint" concluded with desired status: "success"
        [ check  ]   "changes" concluded with desired status: "success"
        [ state  ]   "dirty" is undesirable ❌


=============
  dhth/omm
=============

-> checking PR #107
        ci: bump actions/checkout from 5 to 6
        https://github.com/dhth/omm/pull/107
        Created: Mon, 1 Dec 2025 07:21:51 +0000
        [ author ]   "dependabot[bot]" is in the list of trusted authors
        [ check  ]   "release-check" concluded with desired status: "success"
        [ check  ]   "back-compat (ubuntu-latest)" concluded with desired status: "success"
        [ check  ]   "lint-workflows" concluded with desired status: "success"
        [ check  ]   "lint" concluded with desired status: "success"
        [ check  ]   "back-compat (macos-latest)" concluded with desired status: "success"
        [ check  ]   "lint-yaml" concluded with desired status: "success"
        [ check  ]   "vulncheck" concluded with desired status: "success"
        [ check  ]   "build (ubuntu-latest)" concluded with desired status: "success"
        [ check  ]   "build (macos-latest)" concluded with desired status: "success"
        [ check  ]   "test" concluded with desired status: "success"
        [ check  ]   "changes" concluded with desired status: "success"
        [ state  ]   "unknown" is undesirable ❌


=============
  dhth/punchout
=============

-> checking PR #90
        ci: bump actions/checkout from 5 to 6
        https://github.com/dhth/punchout/pull/90
        Created: Mon, 1 Dec 2025 16:44:50 +0000
        [ author ]   "dependabot[bot]" is in the list of trusted authors
        [ check  ]   "vulncheck" concluded with desired status: "success"
        [ check  ]   "release-check" concluded with desired status: "success"
        [ check  ]   "test (ubuntu-latest)" concluded with desired status: "success"
        [ check  ]   "lint-workflows" concluded with desired status: "success"
        [ check  ]   "lint-yaml" concluded with desired status: "success"
        [ check  ]   "test (macos-latest)" concluded with desired status: "success"
        [ check  ]   "lint" concluded with desired status: "success"
        [ check  ]   "build (macos-latest)" concluded with desired status: "success"
        [ check  ]   "build (ubuntu-latest)" concluded with desired status: "success"
        [ check  ]   "changes" concluded with desired status: "success"
        [ state  ]   "unknown" is undesirable ❌


=============
  dhth/agent0
=============

-> checking PR #21
        ci: bump actions/checkout from 5 to 6
        https://github.com/dhth/agent0/pull/21
        Created: Mon, 1 Dec 2025 01:35:23 +0000
        Updated: Mon, 1 Dec 2025 01:35:24 +0000
        [ author ]   "dependabot[bot]" is in the list of trusted authors
        [ check  ]   "vulncheck" concluded with desired status: "success"
        [ check  ]   "lint-workflows" concluded with desired status: "success"
        [ check  ]   "lint-yaml" concluded with desired status: "success"
        [ check  ]   "test" concluded with desired status: "success"
        [ check  ]   "build (macos-latest)" concluded with desired status: "success"
        [ check  ]   "build (ubuntu-latest)" concluded with desired status: "success"
        [ check  ]   "lint" concluded with desired status: "success"
        [ check  ]   "changes" concluded with desired status: "success"
        [ state  ]   "unknown" is undesirable ❌


=============
  dhth/mrj
=============

-> checking PR #72
        build: bump octocrab from 0.47.1 to 0.48.0
        https://github.com/dhth/mrj/pull/72
        Created: Mon, 1 Dec 2025 19:32:24 +0000
        Updated: Mon, 1 Dec 2025 22:07:41 +0000
        [ author ]   "dependabot[bot]" is in the list of trusted authors
        [ check  ]   "custom-publish-crates" concluded with desired status: "success"
        [ check  ]   "announce" concluded with desired status: "success"
        [ check  ]   "publish-homebrew-formula" concluded with desired status: "success"
        [ check  ]   "host" concluded with desired status: "success"
        [ check  ]   "build-global-artifacts" concluded with desired status: "success"
        [ check  ]   "build-local-artifacts (${{ join(matrix.targets, ', ') }})" concluded with desired status: "success"
        [ check  ]   "dry-run" concluded with desired status: "success"
        [ check  ]   "lint-yaml" concluded with desired status: "success"
        [ check  ]   "lint-workflows" concluded with desired status: "success"
        [ check  ]   "audit" concluded with undesired status: "failure" ❌


=============
  dhth/mult
=============

-> checking PR #40
        ci: bump golangci/golangci-lint-action from 8 to 9
        https://github.com/dhth/mult/pull/40
        Created: Mon, 1 Dec 2025 19:09:01 +0000
        [ author ]   "dependabot[bot]" is in the list of trusted authors
        [ check  ]   "lint-workflows" concluded with desired status: "success"
        [ check  ]   "build (ubuntu-latest)" concluded with desired status: "success"
        [ check  ]   "build (macos-latest)" concluded with desired status: "success"
        [ check  ]   "lint" concluded with desired status: "success"
        [ check  ]   "vulncheck" concluded with desired status: "success"
        [ check  ]   "release-check" concluded with desired status: "success"
        [ check  ]   "lint-yaml" concluded with desired status: "success"
        [ check  ]   "changes" concluded with desired status: "success"
        [ state  ]   "blocked" is undesirable ❌


=============
  dhth/hours
=============

-> checking PR #130
        ci: bump golangci/golangci-lint-action from 8 to 9
        https://github.com/dhth/hours/pull/130
        Created: Mon, 1 Dec 2025 05:44:20 +0000
        Updated: Mon, 1 Dec 2025 05:44:30 +0000
        [ author ]   "dependabot[bot]" is in the list of trusted authors
        [ check  ]   "live-tests (ubuntu-latest)" concluded with desired status: "success"
        [ check  ]   "live-tests (macos-latest)" concluded with desired status: "success"
        [ check  ]   "lint-workflows" concluded with desired status: "success"
        [ check  ]   "lint-yaml" concluded with desired status: "success"
        [ check  ]   "back-compat (ubuntu-latest)" concluded with desired status: "success"
        [ check  ]   "vulncheck" concluded with desired status: "success"
        [ check  ]   "release-check" concluded with desired status: "success"
        [ check  ]   "back-compat (macos-latest)" concluded with desired status: "success"
        [ check  ]   "test (ubuntu-latest)" concluded with desired status: "success"
        [ check  ]   "test (macos-latest)" concluded with desired status: "success"
        [ check  ]   "lint" concluded with desired status: "success"
        [ check  ]   "build (ubuntu-latest)" concluded with desired status: "success"
        [ check  ]   "build (macos-latest)" concluded with desired status: "success"
        [ check  ]   "changes" concluded with desired status: "success"
        [ state  ]   "blocked" is undesirable ❌


=============
  dhth/commits
=============

-> checking PR #34
        ci: bump actions/checkout from 5 to 6
        https://github.com/dhth/commits/pull/34
        Created: Mon, 1 Dec 2025 07:49:48 +0000
        Updated: Mon, 1 Dec 2025 07:49:49 +0000
        [ author ]   "dependabot[bot]" is in the list of trusted authors
        [ check  ]   "vulncheck" concluded with desired status: "success"
        [ check  ]   "release-check" concluded with desired status: "success"
        [ check  ]   "test" concluded with desired status: "success"
        [ check  ]   "lint-workflows" concluded with desired status: "success"
        [ check  ]   "build (ubuntu-latest)" concluded with desired status: "success"
        [ check  ]   "lint-yaml" concluded with desired status: "success"
        [ check  ]   "build (macos-latest)" concluded with desired status: "success"
        [ check  ]   "lint" concluded with desired status: "success"
        [ check  ]   "changes" concluded with desired status: "success"
        [ state  ]   "blocked" is undesirable ❌


=============
  dhth/chronotes
=============

-> checking PR #43
        chore(deps): bump actions/checkout from 5 to 6
        https://github.com/dhth/chronotes/pull/43
        Created: Mon, 1 Dec 2025 03:42:29 +0000
        Updated: Mon, 1 Dec 2025 03:42:30 +0000
        [ author ]   "dependabot[bot]" is in the list of trusted authors
        [ check  ]   Github returned with an empty conclusion for the check preview; skipping as I can't make any assumptions here ❌


=============
  dhth/outtasync
=============

-> checking PR #140
        ci: bump golangci/golangci-lint-action from 8 to 9
        https://github.com/dhth/outtasync/pull/140
        Created: Mon, 1 Dec 2025 02:24:56 +0000
        [ author ]   "dependabot[bot]" is in the list of trusted authors
        [ check  ]   "lint-workflows" concluded with desired status: "success"
        [ check  ]   "release-check" concluded with desired status: "success"
        [ check  ]   "lint-yaml" concluded with desired status: "success"
        [ check  ]   "vulncheck" concluded with desired status: "success"
        [ check  ]   "test" concluded with desired status: "success"
        [ check  ]   "build (ubuntu-latest)" concluded with desired status: "success"
        [ check  ]   "build (macos-latest)" concluded with desired status: "success"
        [ check  ]   "lint" concluded with desired status: "success"
        [ check  ]   "changes" concluded with desired status: "success"
        [ state  ]   "blocked" is undesirable ❌


=============
  dhth/act3
=============

-> checking PR #64
        ci: bump golangci/golangci-lint-action from 8 to 9
        https://github.com/dhth/act3/pull/64
        Created: Mon, 1 Dec 2025 16:55:11 +0000
        Updated: Mon, 1 Dec 2025 16:55:12 +0000
        [ author ]   "dependabot[bot]" is in the list of trusted authors
        [ check  ]   "run" concluded with desired status: "success"
        [ check  ]   "lint-workflows" concluded with desired status: "success"
        [ check  ]   "test (ubuntu-latest)" concluded with desired status: "success"
        [ check  ]   "build (macos-latest)" concluded with desired status: "success"
        [ check  ]   "release-check" concluded with desired status: "success"
        [ check  ]   "lint-yaml" concluded with desired status: "success"
        [ check  ]   "build (ubuntu-latest)" concluded with desired status: "success"
        [ check  ]   "test (macos-latest)" concluded with desired status: "success"
        [ check  ]   "lint" concluded with desired status: "success"
        [ check  ]   "changes" concluded with desired status: "success"
        [ state  ]   "clean" is desirable
        error 😵: couldn't merge PR


=============
  dhth/squish
=============

-> checking PR #62
        build: bump bytes from 1.10.1 to 1.11.0 in the minor-updates group
        https://github.com/dhth/squish/pull/62
        Created: Mon, 1 Dec 2025 17:21:32 +0000
        Updated: Mon, 1 Dec 2025 22:07:42 +0000
        [ author ]   "dependabot[bot]" is in the list of trusted authors
        [ check  ]   "lint-workflows" concluded with desired status: "success"
        [ check  ]   "lint-yaml" concluded with desired status: "success"
        [ check  ]   "audit" concluded with desired status: "success"
        [ check  ]   "test (macos-latest)" concluded with desired status: "success"
        [ check  ]   "build (macos-latest)" concluded with desired status: "success"
        [ check  ]   "build (ubuntu-latest)" concluded with desired status: "success"
        [ check  ]   "test (ubuntu-latest)" concluded with desired status: "success"
        [ check  ]   "lint" concluded with desired status: "success"
        [ check  ]   "changes" concluded with desired status: "success"
        [ state  ]   "unknown" is undesirable ❌

-> checking PR #64
        ci: bump actions/checkout from 5 to 6
        https://github.com/dhth/squish/pull/64
        Created: Mon, 1 Dec 2025 17:22:16 +0000
        Updated: Mon, 1 Dec 2025 17:22:17 +0000
        [ author ]   "dependabot[bot]" is in the list of trusted authors
        [ check  ]   "lint-workflows" concluded with desired status: "success"
        [ check  ]   "audit" concluded with desired status: "success"
        [ check  ]   "test (ubuntu-latest)" concluded with desired status: "success"
        [ check  ]   "lint-yaml" concluded with desired status: "success"
        [ check  ]   "test (macos-latest)" concluded with desired status: "success"
        [ check  ]   "build (macos-latest)" concluded with desired status: "success"
        [ check  ]   "lint" concluded with desired status: "success"
        [ check  ]   "build (ubuntu-latest)" concluded with desired status: "success"
        [ check  ]   "changes" concluded with desired status: "success"
        [ state  ]   "blocked" is undesirable ❌


=============
  dhth/kplay
=============

-> checking PR #134
        build: bump the minor-updates group with 4 updates
        https://github.com/dhth/kplay/pull/134
        Created: Mon, 1 Dec 2025 16:26:21 +0000
        Updated: Mon, 1 Dec 2025 22:07:41 +0000
        [ author ]   "dependabot[bot]" is in the list of trusted authors
        [ check  ]   "lint-yaml" concluded with desired status: "success"
        [ check  ]   "lint-workflows" concluded with desired status: "success"
        [ check  ]   "test-go (ubuntu-latest)" concluded with desired status: "success"
        [ check  ]   "release-check" concluded with desired status: "success"
        [ check  ]   "build-gleam" concluded with desired status: "success"
        [ check  ]   "test-go (macos-latest)" concluded with desired status: "success"
        [ check  ]   "build-go (ubuntu-latest)" concluded with desired status: "success"
        [ check  ]   "build-go (macos-latest)" concluded with desired status: "success"
        [ check  ]   "vulncheck" concluded with desired status: "success"
        [ check  ]   "lint-gleam" concluded with desired status: "success"
        [ check  ]   "lint-go" concluded with desired status: "success"
        [ check  ]   "changes" concluded with desired status: "success"
        [ state  ]   "unknown" is undesirable ❌

-> checking PR #136
        ci: bump golangci/golangci-lint-action from 8 to 9
        https://github.com/dhth/kplay/pull/136
        Created: Mon, 1 Dec 2025 16:43:33 +0000
        Updated: Mon, 1 Dec 2025 16:43:34 +0000
        [ author ]   "dependabot[bot]" is in the list of trusted authors
        [ check  ]   "release-check" concluded with desired status: "success"
        [ check  ]   "vulncheck" concluded with desired status: "success"
        [ check  ]   "test-go (ubuntu-latest)" concluded with desired status: "success"
        [ check  ]   "test-go (macos-latest)" concluded with desired status: "success"
        [ check  ]   "lint-workflows" concluded with desired status: "success"
        [ check  ]   "build-gleam" concluded with desired status: "success"
        [ check  ]   "lint-yaml" concluded with desired status: "success"
        [ check  ]   "build-go (ubuntu-latest)" concluded with desired status: "success"
        [ check  ]   "build-go (macos-latest)" concluded with desired status: "success"
        [ check  ]   "lint-gleam" concluded with desired status: "success"
        [ check  ]   "lint-go" concluded with desired status: "success"
        [ check  ]   "changes" concluded with desired status: "success"
        [ state  ]   "blocked" is undesirable ❌


=============
  dhth/dstll
=============

-> checking PR #45
        ci: bump actions/checkout from 5 to 6
        https://github.com/dhth/dstll/pull/45
        Created: Mon, 1 Dec 2025 05:43:20 +0000
        Updated: Mon, 1 Dec 2025 05:43:42 +0000
        [ author ]   "dependabot[bot]" is in the list of trusted authors
        [ check  ]   "lint-yaml" concluded with desired status: "success"
        [ check  ]   "lint-workflows" concluded with desired status: "success"
        [ check  ]   "run (ubuntu-latest)" concluded with desired status: "success"
        [ check  ]   "test" concluded with desired status: "success"
        [ check  ]   "run (macos-latest)" concluded with desired status: "success"
        [ check  ]   "dstlled-diff" concluded with desired status: "success"
        [ check  ]   "release-check" concluded with desired status: "success"
        [ check  ]   "vulncheck" concluded with undesired status: "failure" ❌

-> checking PR #46
        ci: bump golangci/golangci-lint-action from 8 to 9
        https://github.com/dhth/dstll/pull/46
        Created: Mon, 1 Dec 2025 05:43:23 +0000
        Updated: Mon, 1 Dec 2025 05:43:52 +0000
        [ author ]   "dependabot[bot]" is in the list of trusted authors
        [ check  ]   "dstlled-diff" concluded with desired status: "success"
        [ check  ]   "lint-workflows" concluded with desired status: "success"
        [ check  ]   "release-check" concluded with desired status: "success"
        [ check  ]   "run (macos-latest)" concluded with desired status: "success"
        [ check  ]   "lint-yaml" concluded with desired status: "success"
        [ check  ]   "run (ubuntu-latest)" concluded with desired status: "success"
        [ check  ]   "test" concluded with desired status: "success"
        [ check  ]   "vulncheck" concluded with undesired status: "failure" ❌


=============
  dhth/zero2prod
=============

-> checking PR #43
        ci: bump actions/checkout from 5 to 6
        https://github.com/dhth/zero2prod/pull/43
        Created: Mon, 1 Dec 2025 21:47:28 +0000
        [ author ]   "dependabot[bot]" is in the list of trusted authors
        [ check  ]   "build" concluded with desired status: "success"
        [ check  ]   "test" concluded with desired status: "success"
        [ check  ]   "fmt-and-clippy" concluded with desired status: "success"
        [ state  ]   "clean" is desirable
        PR merged! 🎉 ✅


=============
  dhth/ecsv
=============

-> checking PR #149
        ci: bump actions/checkout from 5 to 6
        https://github.com/dhth/ecsv/pull/149
        Created: Mon, 1 Dec 2025 14:37:33 +0000
        Updated: Mon, 1 Dec 2025 14:37:34 +0000
        [ author ]   "dependabot[bot]" is in the list of trusted authors
        [ check  ]   "test (ubuntu-latest)" concluded with desired status: "success"
        [ check  ]   "test (macos-latest)" concluded with desired status: "success"
        [ check  ]   "vulncheck" concluded with desired status: "success"
        [ check  ]   "lint-yaml" concluded with desired status: "success"
        [ check  ]   "lint-workflows" concluded with desired status: "success"
        [ check  ]   "release-check" concluded with desired status: "success"
        [ check  ]   "build (macos-latest)" concluded with desired status: "success"
        [ check  ]   "build (ubuntu-latest)" concluded with desired status: "success"
        [ check  ]   "lint" concluded with desired status: "success"
        [ check  ]   "changes" concluded with desired status: "success"
        [ state  ]   "clean" is desirable
        PR merged! 🎉 ✅


=============
  dhth/schemas
=============

-> checking PR #41
        ci: bump actions/checkout from 5 to 6
        https://github.com/dhth/schemas/pull/41
        Created: Mon, 1 Dec 2025 23:17:14 +0000
        Updated: Mon, 1 Dec 2025 23:17:15 +0000
        [ author ]   "dependabot[bot]" is in the list of trusted authors
        [ check  ]   "build (ubuntu-latest)" concluded with desired status: "success"
        [ check  ]   "vulncheck" concluded with desired status: "success"
        [ check  ]   "lint-yaml" concluded with desired status: "success"
        [ check  ]   "release-check" concluded with desired status: "success"
        [ check  ]   "test" concluded with desired status: "success"
        [ check  ]   "lint-workflows" concluded with desired status: "success"
        [ check  ]   "build (macos-latest)" concluded with desired status: "success"
        [ check  ]   "lint" concluded with desired status: "success"
        [ check  ]   "changes" concluded with desired status: "success"
        [ state  ]   "clean" is desirable
        PR merged! 🎉 ✅


=============
  dhth/graphc
=============

-> checking PR #58
        build: bump boto3 from 1.40.64 to 1.42.0
        https://github.com/dhth/graphc/pull/58
        Created: Mon, 1 Dec 2025 03:49:20 +0000
        Updated: Mon, 1 Dec 2025 03:49:46 +0000
        [ author ]   "dependabot[bot]" is in the list of trusted authors
        [ check  ]   "lint-yaml" concluded with desired status: "success"
        [ check  ]   "lint-workflows" concluded with desired status: "success"
        [ check  ]   "test (ubuntu-latest)" concluded with desired status: "success"
        [ check  ]   "test (macos-latest)" concluded with desired status: "success"
        [ check  ]   "dstlled-diff" concluded with desired status: "success"
        [ check  ]   "build (ubuntu-latest)" concluded with desired status: "success"
        [ check  ]   "lint" concluded with desired status: "success"
        [ check  ]   "build (macos-latest)" concluded with desired status: "success"
        [ check  ]   "changes" concluded with desired status: "success"
        [ state  ]   "clean" is desirable
        PR merged! 🎉 ✅


=============
  dhth/tash
=============

-> checking PR #64
        ci: bump taiki-e/install-action from 2.62.46 to 2.62.60
        https://github.com/dhth/tash/pull/64
        Created: Mon, 1 Dec 2025 19:16:09 +0000
        Updated: Mon, 1 Dec 2025 19:16:10 +0000
        [ author ]   "dependabot[bot]" is in the list of trusted authors
        [ check  ]   "custom-publish-crates" concluded with desired status: "success"
        [ check  ]   "announce" concluded with desired status: "success"
        [ check  ]   "host" concluded with desired status: "success"
        [ check  ]   "publish-homebrew-formula" concluded with desired status: "success"
        [ check  ]   "build-global-artifacts" concluded with desired status: "success"
        [ check  ]   "build-local-artifacts (${{ join(matrix.targets, ', ') }})" concluded with desired status: "success"
        [ check  ]   "test (ubuntu-latest)" concluded with desired status: "success"
        [ check  ]   "test (macos-latest)" concluded with desired status: "success"
        [ check  ]   "build (ubuntu-latest)" concluded with desired status: "success"
        [ check  ]   "lint" concluded with desired status: "success"
        [ check  ]   "audit" concluded with desired status: "success"
        [ check  ]   "build (macos-latest)" concluded with desired status: "success"
        [ check  ]   "publish-check" concluded with desired status: "success"
        [ check  ]   "lint-workflows" concluded with desired status: "success"
        [ check  ]   "lint-yaml" concluded with desired status: "success"
        [ check  ]   "plan" concluded with desired status: "success"
        [ check  ]   "changes" concluded with desired status: "success"
        [ state  ]   "unknown" is undesirable ❌

-> checking PR #66
        build: bump insta from 1.43.2 to 1.44.3 in the minor-updates group
        https://github.com/dhth/tash/pull/66
        Created: Mon, 1 Dec 2025 19:17:37 +0000
        Updated: Mon, 1 Dec 2025 19:17:38 +0000
        [ author ]   "dependabot[bot]" is in the list of trusted authors
        [ check  ]   "announce" concluded with desired status: "success"
        [ check  ]   "custom-publish-crates" concluded with desired status: "success"
        [ check  ]   "host" concluded with desired status: "success"
        [ check  ]   "publish-homebrew-formula" concluded with desired status: "success"
        [ check  ]   "build-local-artifacts (${{ join(matrix.targets, ', ') }})" concluded with desired status: "success"
        [ check  ]   "build-global-artifacts" concluded with desired status: "success"
        [ check  ]   "lint-workflows" concluded with desired status: "success"
        [ check  ]   "lint-yaml" concluded with desired status: "success"
        [ check  ]   "test (macos-latest)" concluded with desired status: "success"
        [ check  ]   "test (ubuntu-latest)" concluded with desired status: "success"
        [ check  ]   "audit" concluded with desired status: "success"
        [ check  ]   "publish-check" concluded with desired status: "success"
        [ check  ]   "lint" concluded with desired status: "success"
        [ check  ]   "build (ubuntu-latest)" concluded with desired status: "success"
        [ check  ]   "build (macos-latest)" concluded with desired status: "success"
        [ check  ]   "changes" concluded with desired status: "success"
        [ check  ]   "plan" concluded with desired status: "success"
        [ state  ]   "clean" is desirable
        PR merged! 🎉 ✅


=============
  dhth/prs
=============

-> checking PR #61
        ci: bump actions/checkout from 5 to 6
        https://github.com/dhth/prs/pull/61
        Created: Mon, 1 Dec 2025 23:32:29 +0000
        Updated: Mon, 1 Dec 2025 23:32:30 +0000
        [ author ]   "dependabot[bot]" is in the list of trusted authors
        [ check  ]   "test" concluded with desired status: "success"
        [ check  ]   "build (ubuntu-latest)" concluded with desired status: "success"
        [ check  ]   "build (macos-latest)" concluded with desired status: "success"
        [ check  ]   "lint" concluded with desired status: "success"
        [ check  ]   "release-check" concluded with desired status: "success"
        [ check  ]   "vulncheck" concluded with desired status: "success"
        [ check  ]   "lint-yaml" concluded with desired status: "success"
        [ check  ]   "lint-workflows" concluded with desired status: "success"
        [ check  ]   "changes" concluded with desired status: "success"
        [ state  ]   "clean" is desirable
        PR merged! 🎉 ✅


=============
  dhth/atls
=============

-> checking PR #18
        ci: bump actions/checkout from 5 to 6
        https://github.com/dhth/atls/pull/18
        Created: Mon, 1 Dec 2025 01:32:06 +0000
        [ author ]   "dependabot[bot]" is in the list of trusted authors
        [ check  ]   "lint-yaml" concluded with desired status: "success"
        [ check  ]   "lint-workflows" concluded with desired status: "success"
        [ check  ]   "test (ubuntu-latest)" concluded with desired status: "success"
        [ check  ]   "build (ubuntu-latest)" concluded with desired status: "success"
        [ check  ]   "build (macos-latest)" concluded with desired status: "success"
        [ check  ]   "test (macos-latest)" concluded with desired status: "success"
        [ check  ]   "lint" concluded with desired status: "success"
        [ check  ]   "changes" concluded with desired status: "success"
        [ state  ]   "unknown" is undesirable ❌

-> checking PR #20
        build: bump insta from 1.43.2 to 1.44.3 in the minor-updates group
        https://github.com/dhth/atls/pull/20
        Created: Mon, 1 Dec 2025 01:37:05 +0000
        Updated: Mon, 1 Dec 2025 23:08:23 +0000
        [ author ]   "dependabot[bot]" is in the list of trusted authors
        [ check  ]   "lint-yaml" concluded with desired status: "success"
        [ check  ]   "lint-workflows" concluded with desired status: "success"
        [ check  ]   "test (macos-latest)" concluded with desired status: "success"
        [ check  ]   "test (ubuntu-latest)" concluded with desired status: "success"
        [ check  ]   "build (macos-latest)" concluded with desired status: "success"
        [ check  ]   "lint" concluded with desired status: "success"
        [ check  ]   "build (ubuntu-latest)" concluded with desired status: "success"
        [ check  ]   "changes" concluded with desired status: "success"
        [ state  ]   "clean" is desirable
        PR merged! 🎉 ✅


=============
  dhth/ecscope
=============

-> checking PR #106
        ci: bump actions/checkout from 5 to 6
        https://github.com/dhth/ecscope/pull/106
        Created: Mon, 1 Dec 2025 01:37:08 +0000
        Updated: Mon, 1 Dec 2025 01:37:46 +0000
        [ author ]   "dependabot[bot]" is in the list of trusted authors
        [ check  ]   "custom-publish-crates" concluded with desired status: "success"
        [ check  ]   "announce" concluded with desired status: "success"
        [ check  ]   "publish-homebrew-formula" concluded with desired status: "success"
        [ check  ]   "host" concluded with desired status: "success"
        [ check  ]   "build-global-artifacts" concluded with desired status: "success"
        [ check  ]   "build-local-artifacts (${{ join(matrix.targets, ', ') }})" concluded with desired status: "success"
        [ check  ]   "audit" concluded with desired status: "success"
        [ check  ]   "publish-check" concluded with desired status: "success"
        [ check  ]   "build-rust (macos-latest)" concluded with desired status: "success"
        [ check  ]   "build-rust (ubuntu-latest)" concluded with desired status: "success"
        [ check  ]   "back-compat" concluded with desired status: "success"
        [ check  ]   "dstlled-diff" concluded with desired status: "success"
        [ check  ]   "lint-workflows" concluded with desired status: "success"
        [ check  ]   "test-rust (macos-latest)" concluded with desired status: "success"
        [ check  ]   "lint-yaml" concluded with desired status: "success"
        [ check  ]   "test-rust (ubuntu-latest)" concluded with desired status: "success"
        [ check  ]   "test-gleam" concluded with desired status: "success"
        [ check  ]   "build-gleam" concluded with desired status: "success"
        [ check  ]   "lint-rust" concluded with desired status: "success"
        [ check  ]   "lint-gleam" concluded with desired status: "success"
        [ check  ]   "plan" concluded with desired status: "success"
        [ check  ]   "changes" concluded with desired status: "success"
        [ state  ]   "unknown" is undesirable ❌

-> checking PR #108
        build: bump insta from 1.43.2 to 1.44.3 in the minor-updates group
        https://github.com/dhth/ecscope/pull/108
        Created: Mon, 1 Dec 2025 01:38:28 +0000
        Updated: Mon, 1 Dec 2025 23:08:22 +0000
        [ author ]   "dependabot[bot]" is in the list of trusted authors
        [ check  ]   "custom-publish-crates" concluded with desired status: "success"
        [ check  ]   "announce" concluded with desired status: "success"
        [ check  ]   "publish-homebrew-formula" concluded with desired status: "success"
        [ check  ]   "host" concluded with desired status: "success"
        [ check  ]   "build-global-artifacts" concluded with desired status: "success"
        [ check  ]   "build-local-artifacts (${{ join(matrix.targets, ', ') }})" concluded with desired status: "success"
        [ check  ]   "build-gleam" concluded with desired status: "success"
        [ check  ]   "publish-check" concluded with desired status: "success"
        [ check  ]   "test-gleam" concluded with desired status: "success"
        [ check  ]   "audit" concluded with desired status: "success"
        [ check  ]   "dstlled-diff" concluded with desired status: "success"
        [ check  ]   "lint-yaml" concluded with desired status: "success"
        [ check  ]   "back-compat" concluded with desired status: "success"
        [ check  ]   "test-rust (ubuntu-latest)" concluded with desired status: "success"
        [ check  ]   "test-rust (macos-latest)" concluded with desired status: "success"
        [ check  ]   "build-rust (macos-latest)" concluded with desired status: "success"
        [ check  ]   "build-rust (ubuntu-latest)" concluded with desired status: "success"
        [ check  ]   "lint-workflows" concluded with desired status: "success"
        [ check  ]   "lint-gleam" concluded with desired status: "success"
        [ check  ]   "lint-rust" concluded with desired status: "success"
        [ check  ]   "plan" concluded with desired status: "success"
        [ check  ]   "changes" concluded with desired status: "success"
        [ state  ]   "clean" is desirable
        PR merged! 🎉 ✅


=============
  dhth/ghx
=============

-> checking PR #48
        ci: bump actions/checkout from 5 to 6
        https://github.com/dhth/ghx/pull/48
        Created: Mon, 1 Dec 2025 17:28:19 +0000
        [ author ]   "dependabot[bot]" is in the list of trusted authors
        [ check  ]   Github returned with an empty conclusion for the check preview; skipping as I can't make any assumptions here ❌

-> checking PR #51
        build: bump axum from 0.8.6 to 0.8.7
        https://github.com/dhth/ghx/pull/51
        Created: Mon, 1 Dec 2025 17:44:09 +0000
        Updated: Mon, 1 Dec 2025 22:07:44 +0000
        [ author ]   "dependabot[bot]" is in the list of trusted authors
        [ check  ]   "preview" concluded with desired status: "success"
        [ check  ]   "lint-gleam" concluded with desired status: "success"
        [ check  ]   "build-gleam" concluded with desired status: "success"
        [ check  ]   "build-rust (macos-latest)" concluded with desired status: "success"
        [ check  ]   "build-rust (ubuntu-latest)" concluded with desired status: "success"
        [ check  ]   "lint-rust" concluded with desired status: "success"
        [ check  ]   "changes" concluded with desired status: "success"
        [ state  ]   "clean" is desirable
        PR merged! 🎉 ✅


=============
  dhth/ting
=============

-> checking PR #47
        ci: bump taiki-e/install-action from 2.62.46 to 2.62.60
        https://github.com/dhth/ting/pull/47
        Created: Mon, 1 Dec 2025 00:37:44 +0000
        Updated: Mon, 1 Dec 2025 00:38:08 +0000
        [ author ]   "dependabot[bot]" is in the list of trusted authors
        [ check  ]   "announce" concluded with desired status: "success"
        [ check  ]   "custom-publish-crates" concluded with desired status: "success"
        [ check  ]   "publish-homebrew-formula" concluded with desired status: "success"
        [ check  ]   "build-local-artifacts (${{ join(matrix.targets, ', ') }})" concluded with desired status: "success"
        [ check  ]   "host" concluded with desired status: "success"
        [ check  ]   "build-global-artifacts" concluded with desired status: "success"
        [ check  ]   "lint-workflows" concluded with desired status: "success"
        [ check  ]   "dstlled-diff" concluded with desired status: "success"
        [ check  ]   "publish-check" concluded with desired status: "success"
        [ check  ]   "lint-yaml" concluded with desired status: "success"
        [ check  ]   "audit" concluded with desired status: "success"
        [ check  ]   "lint" concluded with desired status: "success"
        [ check  ]   "test (macos-latest)" concluded with desired status: "success"
        [ check  ]   "build (ubuntu-latest)" concluded with desired status: "success"
        [ check  ]   "build (macos-latest)" concluded with desired status: "success"
        [ check  ]   "test (ubuntu-latest)" concluded with desired status: "success"
        [ check  ]   "plan" concluded with desired status: "success"
        [ check  ]   "changes" concluded with desired status: "success"
        [ state  ]   "unknown" is undesirable ❌

-> checking PR #49
        build: bump insta from 1.43.2 to 1.44.3 in the minor-updates group
        https://github.com/dhth/ting/pull/49
        Created: Mon, 1 Dec 2025 00:38:23 +0000
        Updated: Mon, 1 Dec 2025 00:38:44 +0000
        [ author ]   "dependabot[bot]" is in the list of trusted authors
        [ check  ]   "announce" concluded with desired status: "success"
        [ check  ]   "custom-publish-crates" concluded with desired status: "success"
        [ check  ]   "publish-homebrew-formula" concluded with desired status: "success"
        [ check  ]   "host" concluded with desired status: "success"
        [ check  ]   "build-local-artifacts (${{ join(matrix.targets, ', ') }})" concluded with desired status: "success"
        [ check  ]   "build-global-artifacts" concluded with desired status: "success"
        [ check  ]   "lint-yaml" concluded with desired status: "success"
        [ check  ]   "lint-workflows" concluded with desired status: "success"
        [ check  ]   "audit" concluded with desired status: "success"
        [ check  ]   "test (macos-latest)" concluded with desired status: "success"
        [ check  ]   "test (ubuntu-latest)" concluded with desired status: "success"
        [ check  ]   "publish-check" concluded with desired status: "success"
        [ check  ]   "dstlled-diff" concluded with desired status: "success"
        [ check  ]   "build (macos-latest)" concluded with desired status: "success"
        [ check  ]   "lint" concluded with desired status: "success"
        [ check  ]   "build (ubuntu-latest)" concluded with desired status: "success"
        [ check  ]   "plan" concluded with desired status: "success"
        [ check  ]   "changes" concluded with desired status: "success"
        [ state  ]   "clean" is desirable
        PR merged! 🎉 ✅


=============
  dhth/dfft
=============

-> checking PR #80
        ci: bump actions/checkout from 5 to 6
        https://github.com/dhth/dfft/pull/80
        Created: Mon, 1 Dec 2025 02:43:29 +0000
        Updated: Mon, 1 Dec 2025 02:44:13 +0000
        [ author ]   "dependabot[bot]" is in the list of trusted authors
        [ check  ]   "custom-publish-crates" concluded with desired status: "success"
        [ check  ]   "announce" concluded with desired status: "success"
        [ check  ]   "publish-homebrew-formula" concluded with desired status: "success"
        [ check  ]   "host" concluded with desired status: "success"
        [ check  ]   "build-global-artifacts" concluded with desired status: "success"
        [ check  ]   "build-local-artifacts (${{ join(matrix.targets, ', ') }})" concluded with desired status: "success"
        [ check  ]   "lint-no-sound" concluded with desired status: "success"
        [ check  ]   "publish-check" concluded with desired status: "success"
        [ check  ]   "audit" concluded with desired status: "success"
        [ check  ]   "dstlled-diff" concluded with desired status: "success"
        [ check  ]   "test-macos-latest-default" concluded with desired status: "success"
        [ check  ]   "test-ubuntu-latest-default" concluded with desired status: "success"
        [ check  ]   "lint-workflows" concluded with desired status: "success"
        [ check  ]   "test-macos-latest-no-sound" concluded with desired status: "success"
        [ check  ]   "build-macos-latest-no-sound" concluded with desired status: "success"
        [ check  ]   "build-macos-latest-default" concluded with desired status: "success"
        [ check  ]   "lint-yaml" concluded with desired status: "success"
        [ check  ]   "build-ubuntu-latest-default" concluded with desired status: "success"
        [ check  ]   "test-ubuntu-latest-no-sound" concluded with desired status: "success"
        [ check  ]   "build-ubuntu-latest-no-sound" concluded with desired status: "success"
        [ check  ]   "lint-default" concluded with desired status: "success"
        [ check  ]   "plan" concluded with desired status: "success"
        [ check  ]   "changes" concluded with desired status: "success"
        [ state  ]   "unknown" is undesirable ❌

-> checking PR #82
        build: bump insta from 1.43.2 to 1.44.3 in the minor-updates group
        https://github.com/dhth/dfft/pull/82
        Created: Mon, 1 Dec 2025 02:47:20 +0000
        Updated: Mon, 1 Dec 2025 23:08:22 +0000
        [ author ]   "dependabot[bot]" is in the list of trusted authors
        [ check  ]   "custom-publish-crates" concluded with desired status: "success"
        [ check  ]   "announce" concluded with desired status: "success"
        [ check  ]   "publish-homebrew-formula" concluded with desired status: "success"
        [ check  ]   "host" concluded with desired status: "success"
        [ check  ]   "build-global-artifacts" concluded with desired status: "success"
        [ check  ]   "build-local-artifacts (${{ join(matrix.targets, ', ') }})" concluded with desired status: "success"
        [ check  ]   "lint-workflows" concluded with desired status: "success"
        [ check  ]   "test-ubuntu-latest-default" concluded with desired status: "success"
        [ check  ]   "test-macos-latest-no-sound" concluded with desired status: "success"
        [ check  ]   "test-macos-latest-default" concluded with desired status: "success"
        [ check  ]   "test-ubuntu-latest-no-sound" concluded with desired status: "success"
        [ check  ]   "dstlled-diff" concluded with desired status: "success"
        [ check  ]   "publish-check" concluded with desired status: "success"
        [ check  ]   "audit" concluded with desired status: "success"
        [ check  ]   "build-macos-latest-default" concluded with desired status: "success"
        [ check  ]   "build-macos-latest-no-sound" concluded with desired status: "success"
        [ check  ]   "lint-yaml" concluded with desired status: "success"
        [ check  ]   "build-ubuntu-latest-no-sound" concluded with desired status: "success"
        [ check  ]   "build-ubuntu-latest-default" concluded with desired status: "success"
        [ check  ]   "lint-default" concluded with desired status: "success"
        [ check  ]   "lint-no-sound" concluded with desired status: "success"
        [ check  ]   "plan" concluded with desired status: "success"
        [ check  ]   "changes" concluded with desired status: "success"
        [ state  ]   "clean" is desirable
        PR merged! 🎉 ✅


=============
  dhth/tbll
=============

-> checking PR #73
        ci: bump taiki-e/install-action from 2.62.46 to 2.62.60
        https://github.com/dhth/tbll/pull/73
        Created: Mon, 1 Dec 2025 11:10:10 +0000
        Updated: Mon, 1 Dec 2025 11:10:11 +0000
        [ author ]   "dependabot[bot]" is in the list of trusted authors
        [ check  ]   "announce" concluded with desired status: "success"
        [ check  ]   "custom-release-packages" concluded with desired status: "success"
        [ check  ]   "publish-homebrew-formula" concluded with desired status: "success"
        [ check  ]   "host" concluded with desired status: "success"
        [ check  ]   "build-global-artifacts" concluded with desired status: "success"
        [ check  ]   "build-local-artifacts (${{ join(matrix.targets, ', ') }})" concluded with desired status: "success"
        [ check  ]   "test (ubuntu-latest)" concluded with desired status: "success"
        [ check  ]   "build (ubuntu-latest)" concluded with desired status: "success"
        [ check  ]   "build (macos-latest)" concluded with desired status: "success"
        [ check  ]   "audit" concluded with desired status: "success"
        [ check  ]   "lint-yaml" concluded with desired status: "success"
        [ check  ]   "test (macos-latest)" concluded with desired status: "success"
        [ check  ]   "lint-workflows" concluded with desired status: "success"
        [ check  ]   "lint" concluded with desired status: "success"
        [ check  ]   "plan" concluded with desired status: "success"
        [ check  ]   "changes" concluded with desired status: "success"
        [ state  ]   "unknown" is undesirable ❌

-> checking PR #75
        build: bump insta from 1.43.2 to 1.44.3 in the minor-updates group
        https://github.com/dhth/tbll/pull/75
        Created: Mon, 1 Dec 2025 11:27:00 +0000
        Updated: Mon, 1 Dec 2025 11:27:01 +0000
        [ author ]   "dependabot[bot]" is in the list of trusted authors
        [ check  ]   "announce" concluded with desired status: "success"
        [ check  ]   "custom-release-packages" concluded with desired status: "success"
        [ check  ]   "publish-homebrew-formula" concluded with desired status: "success"
        [ check  ]   "host" concluded with desired status: "success"
        [ check  ]   "build-local-artifacts (${{ join(matrix.targets, ', ') }})" concluded with desired status: "success"
        [ check  ]   "build-global-artifacts" concluded with desired status: "success"
        [ check  ]   "lint-workflows" concluded with desired status: "success"
        [ check  ]   "lint-yaml" concluded with desired status: "success"
        [ check  ]   "test (macos-latest)" concluded with desired status: "success"
        [ check  ]   "audit" concluded with desired status: "success"
        [ check  ]   "test (ubuntu-latest)" concluded with desired status: "success"
        [ check  ]   "build (ubuntu-latest)" concluded with desired status: "success"
        [ check  ]   "build (macos-latest)" concluded with desired status: "success"
        [ check  ]   "lint" concluded with desired status: "success"
        [ check  ]   "plan" concluded with desired status: "success"
        [ check  ]   "changes" concluded with desired status: "success"
        [ state  ]   "clean" is desirable
        PR merged! 🎉 ✅


=============
  dhth/tomo
=============

-> checking PR #82
        ci: bump actions/checkout from 5 to 6
        https://github.com/dhth/tomo/pull/82
        Created: Mon, 1 Dec 2025 20:33:09 +0000
        [ author ]   "dependabot[bot]" is in the list of trusted authors
        [ check  ]   "custom-release-packages" concluded with desired status: "success"
        [ check  ]   "publish-homebrew-formula" concluded with desired status: "success"
        [ check  ]   "announce" concluded with desired status: "success"
        [ check  ]   "host" concluded with desired status: "success"
        [ check  ]   "build-global-artifacts" concluded with desired status: "success"
        [ check  ]   "build-local-artifacts (${{ join(matrix.targets, ', ') }})" concluded with desired status: "success"
        [ check  ]   "dstlled-diff" concluded with desired status: "success"
        [ check  ]   "audit" concluded with desired status: "success"
        [ check  ]   "lint-yaml" concluded with desired status: "success"
        [ check  ]   "release-check" concluded with desired status: "success"
        [ check  ]   "lint" concluded with desired status: "success"
        [ check  ]   "lint-workflows" concluded with desired status: "success"
        [ check  ]   "test (ubuntu-latest)" concluded with desired status: "success"
        [ check  ]   "test (macos-latest)" concluded with desired status: "success"
        [ check  ]   "build (macos-latest)" concluded with desired status: "success"
        [ check  ]   "build (ubuntu-latest)" concluded with desired status: "success"
        [ check  ]   "plan" concluded with desired status: "success"
        [ check  ]   "changes" concluded with desired status: "success"
        [ state  ]   "unknown" is undesirable ❌

-> checking PR #84
        build: bump insta from 1.43.2 to 1.44.3 in the minor-updates group
        https://github.com/dhth/tomo/pull/84
        Created: Mon, 1 Dec 2025 21:16:55 +0000
        Updated: Mon, 1 Dec 2025 21:16:56 +0000
        [ author ]   "dependabot[bot]" is in the list of trusted authors
        [ check  ]   "announce" concluded with desired status: "success"
        [ check  ]   "custom-release-packages" concluded with desired status: "success"
        [ check  ]   "publish-homebrew-formula" concluded with desired status: "success"
        [ check  ]   "build-global-artifacts" concluded with desired status: "success"
        [ check  ]   "host" concluded with desired status: "success"
        [ check  ]   "build-local-artifacts (${{ join(matrix.targets, ', ') }})" concluded with desired status: "success"
        [ check  ]   "dstlled-diff" concluded with desired status: "success"
        [ check  ]   "lint-yaml" concluded with desired status: "success"
        [ check  ]   "lint-workflows" concluded with desired status: "success"
        [ check  ]   "release-check" concluded with desired status: "success"
        [ check  ]   "build (ubuntu-latest)" concluded with desired status: "success"
        [ check  ]   "build (macos-latest)" concluded with desired status: "success"
        [ check  ]   "audit" concluded with desired status: "success"
        [ check  ]   "lint" concluded with desired status: "success"
        [ check  ]   "test (macos-latest)" concluded with desired status: "success"
        [ check  ]   "test (ubuntu-latest)" concluded with desired status: "success"
        [ check  ]   "plan" concluded with desired status: "success"
        [ check  ]   "changes" concluded with desired status: "success"
        [ state  ]   "clean" is desirable
        PR merged! 🎉 ✅

[INFO] This run ended at 2025-12-01 23:36:27.964388903 UTC; took 4 seconds

===========
  SUMMARY
===========

- PRs merged:                    13
- PRs disqualified:              25
- Repos checked:                 40
- Repos with no relevant PRs:    12
- Errors encountered:            1

PRs merged
---

- [dhth/zero2prod] ci: bump actions/checkout from 5 to 6
- [dhth/ecsv] ci: bump actions/checkout from 5 to 6
- [dhth/schemas] ci: bump actions/checkout from 5 to 6
- [dhth/graphc] build: bump boto3 from 1.40.64 to 1.42.0
- [dhth/tash] build: bump insta from 1.43.2 to 1.44.3 in the minor-updates group
- [dhth/prs] ci: bump actions/checkout from 5 to 6
- [dhth/atls] build: bump insta from 1.43.2 to 1.44.3 in the minor-updates group
- [dhth/ecscope] build: bump insta from 1.43.2 to 1.44.3 in the minor-updates group
- [dhth/ghx] build: bump axum from 0.8.6 to 0.8.7
- [dhth/ting] build: bump insta from 1.43.2 to 1.44.3 in the minor-updates group
- [dhth/dfft] build: bump insta from 1.43.2 to 1.44.3 in the minor-updates group
- [dhth/tbll] build: bump insta from 1.43.2 to 1.44.3 in the minor-updates group
- [dhth/tomo] build: bump insta from 1.43.2 to 1.44.3 in the minor-updates group

Disqualifications
---

- https://github.com/dhth/ddiff/pull/40             state: dirty
- https://github.com/dhth/tflens/pull/14            state: dirty
- https://github.com/dhth/omm/pull/107              state: unknown
- https://github.com/dhth/punchout/pull/90          state: unknown
- https://github.com/dhth/agent0/pull/21            state: unknown
- https://github.com/dhth/mrj/pull/72               check audit: failure
- https://github.com/dhth/mult/pull/40              state: blocked
- https://github.com/dhth/hours/pull/130            state: blocked
- https://github.com/dhth/commits/pull/34           state: blocked
- https://github.com/dhth/chronotes/pull/43         check preview: unknown conclusion
- https://github.com/dhth/outtasync/pull/140        state: blocked
- https://github.com/dhth/squish/pull/62            state: unknown
- https://github.com/dhth/squish/pull/64            state: blocked
- https://github.com/dhth/kplay/pull/134            state: unknown
- https://github.com/dhth/kplay/pull/136            state: blocked
- https://github.com/dhth/dstll/pull/45             check vulncheck: failure
- https://github.com/dhth/dstll/pull/46             check vulncheck: failure
- https://github.com/dhth/tash/pull/64              state: unknown
- https://github.com/dhth/atls/pull/18              state: unknown
- https://github.com/dhth/ecscope/pull/106          state: unknown
- https://github.com/dhth/ghx/pull/48               check preview: unknown conclusion
- https://github.com/dhth/ting/pull/47              state: unknown
- https://github.com/dhth/dfft/pull/80              state: unknown
- https://github.com/dhth/tbll/pull/73              state: unknown
- https://github.com/dhth/tomo/pull/82              state: unknown