
                          __
          ___ ___   _ __ /\_\
        /' __` __`\/\`'__\/\ \
        /\ \/\ \/\ \ \ \/ \ \ \
        \ \_\ \_\ \_\ \_\ _\ \ \
         \/_/\/_/\/_/\/_//\ \_\ \
                         \ \____/
                          \/___/


[INFO] The time right now is 2025-08-11 22:40:56.150377507 UTC
[INFO] I'm only looking for PRs where the base branch is "main"
[INFO] I'm sorting PRs based on "creation date" in the "ascending" direction


=============
  dhth/urll
=============

-> checking PR #22
        ci: bump actions/checkout from 4 to 5
        https://github.com/dhth/urll/pull/22
        Created: Mon, 11 Aug 2025 21:47:47 +0000
        Updated: Mon, 11 Aug 2025 21:48:16 +0000
        [ author ]   "dependabot[bot]" is in the list of trusted authors
        [ check  ]   "audit" concluded with desired status: "success"
        [ check  ]   "dstlled-diff" concluded with desired status: "success"
        [ check  ]   "test (macos-latest)" concluded with desired status: "success"
        [ check  ]   "lint-workflows" concluded with desired status: "success"
        [ check  ]   "test (ubuntu-latest)" concluded with desired status: "success"
        [ check  ]   "lint-yaml" concluded with desired status: "success"
        [ check  ]   "build (macos-latest)" concluded with desired status: "success"
        [ check  ]   "build (ubuntu-latest)" concluded with desired status: "success"
        [ check  ]   "lint" concluded with desired status: "success"
        [ check  ]   "changes" concluded with desired status: "success"
        [ state  ]   "unknown" is undesirable ❌


=============
  dhth/ecsv
=============

-> checking PR #113
        ci: bump actions/checkout from 4 to 5
        https://github.com/dhth/ecsv/pull/113
        Created: Mon, 11 Aug 2025 18:47:47 +0000
        Updated: Mon, 11 Aug 2025 18:47:48 +0000
        [ author ]   "dependabot[bot]" is in the list of trusted authors
        [ check  ]   "lint-workflows" concluded with desired status: "success"
        [ check  ]   "release-check" concluded with desired status: "success"
        [ check  ]   "test (ubuntu-latest)" concluded with desired status: "success"
        [ check  ]   "vulncheck" concluded with desired status: "success"
        [ check  ]   "test (macos-latest)" concluded with desired status: "success"
        [ check  ]   "build (ubuntu-latest)" concluded with desired status: "success"
        [ check  ]   "lint-yaml" concluded with desired status: "success"
        [ check  ]   "build (macos-latest)" concluded with desired status: "success"
        [ check  ]   "lint" concluded with desired status: "success"
        [ check  ]   "changes" concluded with desired status: "success"
        [ state  ]   "unknown" is undesirable ❌


=============
  dhth/tbll
=============

-> checking PR #48
        ci: bump actions/download-artifact from 4 to 5
        https://github.com/dhth/tbll/pull/48
        Created: Mon, 11 Aug 2025 14:50:49 +0000
        [ author ]   "dependabot[bot]" is in the list of trusted authors
        [ check  ]   "custom-release-packages" concluded with desired status: "success"
        [ check  ]   "announce" concluded with desired status: "success"
        [ check  ]   "host" concluded with desired status: "success"
        [ check  ]   "publish-homebrew-formula" concluded with desired status: "success"
        [ check  ]   "build-global-artifacts" concluded with desired status: "success"
        [ check  ]   "build-local-artifacts (${{ join(matrix.targets, ', ') }})" concluded with desired status: "success"
        [ check  ]   "lint" concluded with desired status: "success"
        [ check  ]   "audit" concluded with desired status: "success"
        [ check  ]   "build" concluded with desired status: "success"
        [ check  ]   "test" concluded with desired status: "success"
        [ check  ]   "lint-workflows" concluded with desired status: "success"
        [ check  ]   "lint-yaml" concluded with desired status: "success"
        [ check  ]   "changes" concluded with desired status: "success"
        [ check  ]   "plan" concluded with undesired status: "failure" ❌

-> checking PR #49
        ci: bump taiki-e/install-action from 2.57.6 to 2.58.8
        https://github.com/dhth/tbll/pull/49
        Created: Mon, 11 Aug 2025 14:51:20 +0000
        [ author ]   "dependabot[bot]" is in the list of trusted authors
        [ check  ]   "announce" concluded with desired status: "success"
        [ check  ]   "custom-release-packages" concluded with desired status: "success"
        [ check  ]   "publish-homebrew-formula" concluded with desired status: "success"
        [ check  ]   "host" concluded with desired status: "success"
        [ check  ]   "build-global-artifacts" concluded with desired status: "success"
        [ check  ]   "build-local-artifacts (${{ join(matrix.targets, ', ') }})" concluded with desired status: "success"
        [ check  ]   "lint-yaml" concluded with desired status: "success"
        [ check  ]   "lint-workflows" concluded with desired status: "success"
        [ check  ]   "audit" concluded with desired status: "success"
        [ check  ]   "build (macos-latest)" concluded with desired status: "success"
        [ check  ]   "build (ubuntu-latest)" concluded with desired status: "success"
        [ check  ]   "lint" concluded with desired status: "success"
        [ check  ]   "test (ubuntu-latest)" concluded with desired status: "success"
        [ check  ]   "test (macos-latest)" concluded with desired status: "success"
        [ check  ]   "plan" concluded with desired status: "success"
        [ check  ]   "changes" concluded with desired status: "success"
        [ state  ]   "unknown" is undesirable ❌


=============
  dhth/act3
=============

-> checking PR #46
        build: bump github.com/cli/go-gh/v2 from 2.12.1 to 2.12.2
        https://github.com/dhth/act3/pull/46
        Created: Mon, 11 Aug 2025 22:21:10 +0000
        [ author ]   "dependabot[bot]" is in the list of trusted authors
        [ check  ]   "release-check" concluded with desired status: "success"
        [ check  ]   "lint-yaml" concluded with desired status: "success"
        [ check  ]   "run" concluded with desired status: "success"
        [ check  ]   "lint-workflows" concluded with desired status: "success"
        [ check  ]   "test (ubuntu-latest)" concluded with desired status: "success"
        [ check  ]   "test (macos-latest)" concluded with desired status: "success"
        [ check  ]   "lint" concluded with desired status: "success"
        [ check  ]   "build (macos-latest)" concluded with desired status: "success"
        [ check  ]   "build (ubuntu-latest)" concluded with desired status: "success"
        [ check  ]   "changes" concluded with desired status: "success"
        [ state  ]   "clean" is desirable
        PR merged! 🎉 ✅


=============
  dhth/dfft
=============

-> checking PR #45
        build: bump notify-debouncer-full from 0.5.0 to 0.6.0
        https://github.com/dhth/dfft/pull/45
        Created: Mon, 11 Aug 2025 03:47:57 +0000
        Updated: Mon, 11 Aug 2025 03:48:20 +0000
        [ author ]   "dependabot[bot]" is in the list of trusted authors
        [ check  ]   "custom-publish-crates" concluded with desired status: "success"
        [ check  ]   "announce" concluded with desired status: "success"
        [ check  ]   "publish-homebrew-formula" concluded with desired status: "success"
        [ check  ]   "host" concluded with desired status: "success"
        [ check  ]   "build-global-artifacts" concluded with desired status: "success"
        [ check  ]   "build-local-artifacts (${{ join(matrix.targets, ', ') }})" concluded with desired status: "success"
        [ check  ]   "lint-yaml" concluded with desired status: "success"
        [ check  ]   "publish-check" concluded with desired status: "success"
        [ check  ]   "test-macos-latest-default" concluded with desired status: "success"
        [ check  ]   "test-ubuntu-latest-no-sound" concluded with desired status: "success"
        [ check  ]   "test-macos-latest-no-sound" concluded with desired status: "success"
        [ check  ]   "lint-workflows" concluded with desired status: "success"
        [ check  ]   "test-ubuntu-latest-default" concluded with desired status: "success"
        [ check  ]   "audit" concluded with desired status: "success"
        [ check  ]   "dstlled-diff" concluded with desired status: "success"
        [ check  ]   "build-macos-latest-default" concluded with desired status: "success"
        [ check  ]   "build-ubuntu-latest-no-sound" concluded with desired status: "success"
        [ check  ]   "build-ubuntu-latest-default" concluded with desired status: "success"
        [ check  ]   "build-macos-latest-no-sound" concluded with desired status: "success"
        [ check  ]   "lint-no-sound" concluded with desired status: "success"
        [ check  ]   "lint-default" concluded with desired status: "success"
        [ check  ]   "plan" concluded with desired status: "success"
        [ check  ]   "changes" concluded with desired status: "success"
        [ state  ]   "clean" is desirable
        PR merged! 🎉 ✅


=============
  dhth/ting
=============

-> checking PR #14
        build: bump toml from 0.9.4 to 0.9.5
        https://github.com/dhth/ting/pull/14
        Created: Mon, 11 Aug 2025 00:49:15 +0000
        Updated: Mon, 11 Aug 2025 00:49:42 +0000
        [ author ]   "dependabot[bot]" is in the list of trusted authors
        [ check  ]   "host" concluded with desired status: "success"
        [ check  ]   "custom-publish-crates" concluded with desired status: "success"
        [ check  ]   "publish-homebrew-formula" concluded with desired status: "success"
        [ check  ]   "announce" concluded with desired status: "success"
        [ check  ]   "build-local-artifacts (${{ join(matrix.targets, ', ') }})" concluded with desired status: "success"
        [ check  ]   "build-global-artifacts" concluded with desired status: "success"
        [ check  ]   "lint-yaml" concluded with desired status: "success"
        [ check  ]   "lint-workflows" concluded with desired status: "success"
        [ check  ]   "audit" concluded with desired status: "success"
        [ check  ]   "test (macos-latest)" concluded with desired status: "success"
        [ check  ]   "publish-check" concluded with desired status: "success"
        [ check  ]   "test (ubuntu-latest)" concluded with desired status: "success"
        [ check  ]   "dstlled-diff" concluded with desired status: "success"
        [ check  ]   "build (macos-latest)" concluded with desired status: "success"
        [ check  ]   "build (ubuntu-latest)" concluded with desired status: "success"
        [ check  ]   "lint" concluded with desired status: "success"
        [ check  ]   "plan" concluded with desired status: "success"
        [ check  ]   "changes" concluded with desired status: "success"
        [ state  ]   "clean" is desirable
        PR merged! 🎉 ✅


=============
  dhth/ecscope
=============

-> checking PR #54
        build: bump clap from 4.5.42 to 4.5.43
        https://github.com/dhth/ecscope/pull/54
        Created: Mon, 11 Aug 2025 01:33:26 +0000
        Updated: Mon, 11 Aug 2025 01:33:49 +0000
        [ author ]   "dependabot[bot]" is in the list of trusted authors
        [ check  ]   "custom-publish-crates" concluded with desired status: "success"
        [ check  ]   "announce" concluded with desired status: "success"
        [ check  ]   "publish-homebrew-formula" concluded with desired status: "success"
        [ check  ]   "host" concluded with desired status: "success"
        [ check  ]   "build-local-artifacts (${{ join(matrix.targets, ', ') }})" concluded with desired status: "success"
        [ check  ]   "build-global-artifacts" concluded with desired status: "success"
        [ check  ]   "lint-yaml" concluded with desired status: "success"
        [ check  ]   "lint-gleam" concluded with desired status: "success"
        [ check  ]   "lint-workflows" concluded with desired status: "success"
        [ check  ]   "test-gleam" concluded with desired status: "success"
        [ check  ]   "publish-check" concluded with desired status: "success"
        [ check  ]   "audit" concluded with desired status: "success"
        [ check  ]   "test-rust (macos-latest)" concluded with desired status: "success"
        [ check  ]   "dstlled-diff" concluded with desired status: "success"
        [ check  ]   "build-gleam" concluded with desired status: "success"
        [ check  ]   "test-rust (ubuntu-latest)" concluded with desired status: "success"
        [ check  ]   "back-compat" concluded with desired status: "success"
        [ check  ]   "build-rust (macos-latest)" concluded with desired status: "success"
        [ check  ]   "build-rust (ubuntu-latest)" concluded with desired status: "success"
        [ check  ]   "lint-rust" concluded with desired status: "success"
        [ check  ]   "changes" concluded with desired status: "success"
        [ check  ]   "plan" concluded with desired status: "success"
        [ state  ]   "clean" is desirable
        PR merged! 🎉 ✅


=============
  dhth/graphc
=============

-> checking PR #23
        build: bump ty from 0.0.1a16 to 0.0.1a17
        https://github.com/dhth/graphc/pull/23
        Created: Mon, 11 Aug 2025 05:43:50 +0000
        Updated: Mon, 11 Aug 2025 05:44:16 +0000
        [ author ]   "dependabot[bot]" is in the list of trusted authors
        [ check  ]   "lint-yaml" concluded with desired status: "success"
        [ check  ]   "lint-workflows" concluded with desired status: "success"
        [ check  ]   "dstlled-diff" concluded with desired status: "success"
        [ check  ]   "test (ubuntu-latest)" concluded with desired status: "success"
        [ check  ]   "test (macos-latest)" concluded with desired status: "success"
        [ check  ]   "build (ubuntu-latest)" concluded with desired status: "success"
        [ check  ]   "build (macos-latest)" concluded with desired status: "success"
        [ check  ]   "lint" concluded with desired status: "success"
        [ check  ]   "changes" concluded with desired status: "success"
        [ state  ]   "clean" is desirable
        PR merged! 🎉 ✅


=============
  dhth/kplay
=============

-> checking PR #75
        ci: bump actions/checkout from 4 to 5
        https://github.com/dhth/kplay/pull/75
        Created: Mon, 11 Aug 2025 20:35:52 +0000
        Updated: Mon, 11 Aug 2025 20:35:53 +0000
        [ author ]   "dependabot[bot]" is in the list of trusted authors
        [ check  ]   "release-check" concluded with desired status: "success"
        [ check  ]   "vulncheck" concluded with desired status: "success"
        [ check  ]   "lint-workflows" concluded with desired status: "success"
        [ check  ]   "test-go (macos-latest)" concluded with desired status: "success"
        [ check  ]   "test-go (ubuntu-latest)" concluded with desired status: "success"
        [ check  ]   "lint-yaml" concluded with desired status: "success"
        [ check  ]   "build-gleam" concluded with desired status: "success"
        [ check  ]   "build-go (ubuntu-latest)" concluded with desired status: "success"
        [ check  ]   "build-go (macos-latest)" concluded with desired status: "success"
        [ check  ]   "lint-go" concluded with desired status: "success"
        [ check  ]   "lint-gleam" concluded with desired status: "success"
        [ check  ]   "changes" concluded with desired status: "success"
        [ state  ]   "unknown" is undesirable ❌

-> checking PR #76
        build: bump google.golang.org/protobuf from 1.36.6 to 1.36.7
        https://github.com/dhth/kplay/pull/76
        Created: Mon, 11 Aug 2025 21:25:25 +0000
        [ author ]   "dependabot[bot]" is in the list of trusted authors
        [ check  ]   "lint-gleam" concluded with desired status: "success"
        [ check  ]   "release-check" concluded with desired status: "success"
        [ check  ]   "lint-workflows" concluded with desired status: "success"
        [ check  ]   "build-gleam" concluded with desired status: "success"
        [ check  ]   "lint-yaml" concluded with desired status: "success"
        [ check  ]   "build-go (ubuntu-latest)" concluded with desired status: "success"
        [ check  ]   "build-go (macos-latest)" concluded with desired status: "success"
        [ check  ]   "vulncheck" concluded with desired status: "success"
        [ check  ]   "test-go (macos-latest)" concluded with desired status: "success"
        [ check  ]   "test-go (ubuntu-latest)" concluded with desired status: "success"
        [ check  ]   "lint-go" concluded with desired status: "success"
        [ check  ]   "changes" concluded with desired status: "success"
        [ state  ]   "clean" is desirable
        PR merged! 🎉 ✅


=============
  dhth/squish
=============

-> checking PR #39
        ci: bump taiki-e/install-action from 2.57.6 to 2.58.9
        https://github.com/dhth/squish/pull/39
        Created: Mon, 11 Aug 2025 22:10:27 +0000
        Updated: Mon, 11 Aug 2025 22:10:28 +0000
        [ author ]   "dependabot[bot]" is in the list of trusted authors
        [ check  ]   "audit" concluded with desired status: "success"
        [ check  ]   "lint-yaml" concluded with desired status: "success"
        [ check  ]   "lint-workflows" concluded with desired status: "success"
        [ check  ]   "test (macos-latest)" concluded with desired status: "success"
        [ check  ]   "test (ubuntu-latest)" concluded with desired status: "success"
        [ check  ]   "build (macos-latest)" concluded with desired status: "success"
        [ check  ]   "build (ubuntu-latest)" concluded with desired status: "success"
        [ check  ]   "lint" concluded with desired status: "success"
        [ check  ]   "changes" concluded with desired status: "success"
        [ state  ]   "unknown" is undesirable ❌

-> checking PR #40
        ci: bump actions/checkout from 4 to 5
        https://github.com/dhth/squish/pull/40
        Created: Mon, 11 Aug 2025 22:36:35 +0000
        Updated: Mon, 11 Aug 2025 22:36:36 +0000
        [ author ]   "dependabot[bot]" is in the list of trusted authors
        [ check  ]   "test (ubuntu-latest)" concluded with desired status: "success"
        [ check  ]   "build (macos-latest)" concluded with desired status: "success"
        [ check  ]   "lint-yaml" concluded with desired status: "success"
        [ check  ]   "test (macos-latest)" concluded with desired status: "success"
        [ check  ]   "build (ubuntu-latest)" concluded with desired status: "success"
        [ check  ]   "lint" concluded with desired status: "success"
        [ check  ]   "audit" concluded with desired status: "success"
        [ check  ]   "lint-workflows" concluded with desired status: "success"
        [ check  ]   "changes" concluded with desired status: "success"
        [ state  ]   "clean" is desirable
        PR merged! 🎉 ✅

[INFO] This run ended at 2025-08-11 22:40:59.169519257 UTC; took 3 seconds

===========
  SUMMARY
===========

- PRs merged:                    7
- PRs disqualified:              6
- Repos checked:                 31
- Repos with no relevant PRs:    21
- Errors encountered:            0

PRs merged
---

- [dhth/act3] build: bump github.com/cli/go-gh/v2 from 2.12.1 to 2.12.2
- [dhth/dfft] build: bump notify-debouncer-full from 0.5.0 to 0.6.0
- [dhth/ting] build: bump toml from 0.9.4 to 0.9.5
- [dhth/ecscope] build: bump clap from 4.5.42 to 4.5.43
- [dhth/graphc] build: bump ty from 0.0.1a16 to 0.0.1a17
- [dhth/kplay] build: bump google.golang.org/protobuf from 1.36.6 to 1.36.7
- [dhth/squish] ci: bump actions/checkout from 4 to 5

Disqualifications
---

- https://github.com/dhth/urll/pull/22          state: unknown
- https://github.com/dhth/ecsv/pull/113         state: unknown
- https://github.com/dhth/tbll/pull/48          check plan: failure
- https://github.com/dhth/tbll/pull/49          state: unknown
- https://github.com/dhth/kplay/pull/75         state: unknown
- https://github.com/dhth/squish/pull/39        state: unknown