
                          __
          ___ ___   _ __ /\_\
        /' __` __`\/\`'__\/\ \
        /\ \/\ \/\ \ \ \/ \ \ \
        \ \_\ \_\ \_\ \_\ _\ \ \
         \/_/\/_/\/_/\/_//\ \_\ \
                         \ \____/
                          \/___/


[INFO] The time right now is 2025-08-01 23:12:43.034822345 UTC
[INFO] I'm only looking for PRs where the base branch is "main"
[INFO] I'm sorting PRs based on "creation date" in the "ascending" direction


=============
  dhth/mrj
=============

-> checking PR #40
        build: bump toml from 0.8.23 to 0.9.4
        https://github.com/dhth/mrj/pull/40
        Created: Fri, 1 Aug 2025 17:51:50 +0000
        Updated: Fri, 1 Aug 2025 22:14:22 +0000
        [ author ]   "dependabot[bot]" is in the list of trusted authors
        [ check  ]   "custom-publish-crates" concluded with desired status: "success"
        [ check  ]   "announce" concluded with desired status: "success"
        [ check  ]   "publish-homebrew-formula" concluded with desired status: "success"
        [ check  ]   "host" concluded with desired status: "success"
        [ check  ]   "build-global-artifacts" concluded with desired status: "success"
        [ check  ]   "build-local-artifacts (${{ join(matrix.targets, ', ') }})" concluded with desired status: "success"
        [ check  ]   "lint-workflows" concluded with desired status: "success"
        [ check  ]   "dry-run" concluded with desired status: "success"
        [ check  ]   "lint-yaml" concluded with desired status: "success"
        [ check  ]   "audit" concluded with desired status: "success"
        [ check  ]   "lint" concluded with desired status: "success"
        [ check  ]   "build (ubuntu-latest)" concluded with desired status: "success"
        [ check  ]   "build (macos-latest)" concluded with desired status: "success"
        [ check  ]   "test (ubuntu-latest)" concluded with undesired status: "failure" ❌


=============
  dhth/ddiff
=============

-> checking PR #14
        chore(deps): bump react and @types/react
        https://github.com/dhth/ddiff/pull/14
        Created: Fri, 1 Aug 2025 00:48:57 +0000
        Updated: Fri, 1 Aug 2025 22:45:20 +0000
        [ author ]   "dependabot[bot]" is in the list of trusted authors
        [ check  ]   "Vercel Preview Comments" concluded with desired status: "success"
        [ check  ]   "lint" concluded with desired status: "success"
        [ state  ]   "clean" is desirable
        PR merged! 🎉 ✅


=============
  dhth/ghx
=============

-> checking PR #30
        build: bump reqwest from 0.12.21 to 0.12.22
        https://github.com/dhth/ghx/pull/30
        Created: Fri, 1 Aug 2025 16:07:30 +0000
        Updated: Fri, 1 Aug 2025 22:45:14 +0000
        [ author ]   "dependabot[bot]" is in the list of trusted authors
        [ check  ]   "build-gleam" concluded with desired status: "success"
        [ check  ]   "preview" concluded with desired status: "success"
        [ check  ]   "lint-gleam" concluded with desired status: "success"
        [ check  ]   "build-rust (ubuntu-latest)" concluded with desired status: "success"
        [ check  ]   "build-rust (macos-latest)" concluded with desired status: "success"
        [ check  ]   "lint-rust" concluded with desired status: "success"
        [ check  ]   "changes" concluded with desired status: "success"
        [ state  ]   "clean" is desirable
        PR merged! 🎉 ✅


=============
  dhth/zero2prod
=============

-> checking PR #15
        chore(deps): bump rand from 0.8.5 to 0.9.1
        https://github.com/dhth/zero2prod/pull/15
        Created: Fri, 1 Aug 2025 18:54:13 +0000
        Updated: Fri, 1 Aug 2025 22:45:50 +0000
        [ author ]   "dependabot[bot]" is in the list of trusted authors
        [ check  ]   "test" concluded with undesired status: "failure" ❌

-> checking PR #18
        chore(deps): bump serde_json from 1.0.128 to 1.0.142
        https://github.com/dhth/zero2prod/pull/18
        Created: Fri, 1 Aug 2025 18:54:54 +0000
        Updated: Fri, 1 Aug 2025 22:14:45 +0000
        [ author ]   "dependabot[bot]" is in the list of trusted authors
        [ check  ]   "test" concluded with desired status: "success"
        [ check  ]   "fmt-and-clippy" concluded with desired status: "success"
        [ check  ]   "build" concluded with desired status: "success"
        [ state  ]   "clean" is desirable
        PR merged! 🎉 ✅

[INFO] This run ended at 2025-08-01 23:12:45.281195479 UTC; took 2 seconds

===========
  SUMMARY
===========

- PRs merged:                    3
- PRs disqualified:              2
- Repos checked:                 29
- Repos with no relevant PRs:    25
- Errors encountered:            0

PRs merged
---

- [dhth/ddiff] chore(deps): bump react and @types/react
- [dhth/ghx] build: bump reqwest from 0.12.21 to 0.12.22
- [dhth/zero2prod] chore(deps): bump serde_json from 1.0.128 to 1.0.142

Disqualifications
---

- https://github.com/dhth/mrj/pull/40              check test (ubuntu-latest): failure
- https://github.com/dhth/zero2prod/pull/15        check test: failure