
                          __
          ___ ___   _ __ /\_\
        /' __` __`\/\`'__\/\ \
        /\ \/\ \/\ \ \ \/ \ \ \
        \ \_\ \_\ \_\ \_\ _\ \ \
         \/_/\/_/\/_/\/_//\ \_\ \
                         \ \____/
                          \/___/


[INFO] The time right now is 2025-08-12 22:11:24.334956864 UTC
[INFO] I'm only looking for PRs where the base branch is "main"
[INFO] I'm sorting PRs based on "creation date" in the "ascending" direction


=============
  dhth/mult
=============

-> checking PR #28
        ci: bump actions/checkout from 4 to 5
        https://github.com/dhth/mult/pull/28
        Created: Tue, 12 Aug 2025 02:35:53 +0000
        Updated: Tue, 12 Aug 2025 02:35:54 +0000
        [ author ]   "dependabot[bot]" is in the list of trusted authors
        [ check  ]   "build (ubuntu-latest)" concluded with desired status: "success"
        [ check  ]   "build (macos-latest)" concluded with desired status: "success"
        [ check  ]   "lint" concluded with desired status: "success"
        [ check  ]   "release-check" concluded with desired status: "success"
        [ check  ]   "vulncheck" concluded with desired status: "success"
        [ check  ]   "lint-yaml" concluded with desired status: "success"
        [ check  ]   "lint-workflows" concluded with desired status: "success"
        [ check  ]   "changes" concluded with desired status: "success"
        [ state  ]   "unknown" is undesirable ❌


=============
  dhth/mrj-runner
=============

-> checking PR #7
        ci: bump actions/checkout from 4 to 5
        https://github.com/dhth/mrj-runner/pull/7
        Created: Tue, 12 Aug 2025 04:28:42 +0000
        Updated: Tue, 12 Aug 2025 04:28:43 +0000
        [ author ]   "dependabot[bot]" is in the list of trusted authors
        [ check  ]   "lint-sh" concluded with desired status: "success"
        [ check  ]   "lint-workflows" concluded with desired status: "success"
        [ check  ]   "validate" concluded with desired status: "success"
        [ check  ]   "lint-yaml" concluded with desired status: "success"
        [ check  ]   "changes" concluded with desired status: "success"
        [ state  ]   "blocked" is undesirable ❌


=============
  dhth/tbll
=============

-> checking PR #48
        ci: bump actions/download-artifact from 4 to 5
        https://github.com/dhth/tbll/pull/48
        Created: Mon, 11 Aug 2025 14:50:49 +0000
        [ author ]   "dependabot[bot]" is in the list of trusted authors
        [ check  ]   "custom-release-packages" concluded with desired status: "success"
        [ check  ]   "announce" concluded with desired status: "success"
        [ check  ]   "host" concluded with desired status: "success"
        [ check  ]   "publish-homebrew-formula" concluded with desired status: "success"
        [ check  ]   "build-global-artifacts" concluded with desired status: "success"
        [ check  ]   "build-local-artifacts (${{ join(matrix.targets, ', ') }})" concluded with desired status: "success"
        [ check  ]   "lint" concluded with desired status: "success"
        [ check  ]   "audit" concluded with desired status: "success"
        [ check  ]   "build" concluded with desired status: "success"
        [ check  ]   "test" concluded with desired status: "success"
        [ check  ]   "lint-workflows" concluded with desired status: "success"
        [ check  ]   "lint-yaml" concluded with desired status: "success"
        [ check  ]   "changes" concluded with desired status: "success"
        [ check  ]   "plan" concluded with undesired status: "failure" ❌


=============
  dhth/dfft
=============

-> checking PR #46
        ci: bump actions/download-artifact from 4 to 5
        https://github.com/dhth/dfft/pull/46
        Created: Mon, 11 Aug 2025 03:56:21 +0000
        [ author ]   "dependabot[bot]" is in the list of trusted authors
        [ check  ]   "custom-publish-crates" concluded with desired status: "success"
        [ check  ]   "announce" concluded with desired status: "success"
        [ check  ]   "build-global-artifacts" concluded with desired status: "success"
        [ check  ]   "host" concluded with desired status: "success"
        [ check  ]   "publish-homebrew-formula" concluded with desired status: "success"
        [ check  ]   "build-local-artifacts (${{ join(matrix.targets, ', ') }})" concluded with desired status: "success"
        [ check  ]   "test-${{ matrix.os }}-${{ matrix.features.name }}" concluded with desired status: "success"
        [ check  ]   "dstlled-diff" concluded with desired status: "success"
        [ check  ]   "audit" concluded with desired status: "success"
        [ check  ]   "lint-${{ matrix.features.name }}" concluded with desired status: "success"
        [ check  ]   "build-${{ matrix.os }}-${{ matrix.features.name }}" concluded with desired status: "success"
        [ check  ]   "publish-check" concluded with desired status: "success"
        [ check  ]   "lint-workflows" concluded with desired status: "success"
        [ check  ]   "lint-yaml" concluded with desired status: "success"
        [ check  ]   "changes" concluded with desired status: "success"
        [ check  ]   "plan" concluded with undesired status: "failure" ❌


=============
  dhth/ting
=============

-> checking PR #16
        ci: bump actions/download-artifact from 4 to 5
        https://github.com/dhth/ting/pull/16
        Created: Mon, 11 Aug 2025 01:13:48 +0000
        [ author ]   "dependabot[bot]" is in the list of trusted authors
        [ check  ]   "custom-publish-crates" concluded with desired status: "success"
        [ check  ]   "publish-homebrew-formula" concluded with desired status: "success"
        [ check  ]   "announce" concluded with desired status: "success"
        [ check  ]   "host" concluded with desired status: "success"
        [ check  ]   "build-global-artifacts" concluded with desired status: "success"
        [ check  ]   "build-local-artifacts (${{ join(matrix.targets, ', ') }})" concluded with desired status: "success"
        [ check  ]   "build" concluded with desired status: "success"
        [ check  ]   "dstlled-diff" concluded with desired status: "success"
        [ check  ]   "publish-check" concluded with desired status: "success"
        [ check  ]   "test" concluded with desired status: "success"
        [ check  ]   "audit" concluded with desired status: "success"
        [ check  ]   "lint" concluded with desired status: "success"
        [ check  ]   "lint-workflows" concluded with desired status: "success"
        [ check  ]   "lint-yaml" concluded with desired status: "success"
        [ check  ]   "plan" concluded with undesired status: "failure" ❌


=============
  dhth/squish
=============

-> checking PR #39
        ci: bump taiki-e/install-action from 2.57.6 to 2.58.9
        https://github.com/dhth/squish/pull/39
        Created: Mon, 11 Aug 2025 22:10:27 +0000
        Updated: Mon, 11 Aug 2025 22:10:28 +0000
        [ author ]   "dependabot[bot]" is in the list of trusted authors
        [ check  ]   "audit" concluded with desired status: "success"
        [ check  ]   "lint-yaml" concluded with desired status: "success"
        [ check  ]   "lint-workflows" concluded with desired status: "success"
        [ check  ]   "test (macos-latest)" concluded with desired status: "success"
        [ check  ]   "test (ubuntu-latest)" concluded with desired status: "success"
        [ check  ]   "build (macos-latest)" concluded with desired status: "success"
        [ check  ]   "build (ubuntu-latest)" concluded with desired status: "success"
        [ check  ]   "lint" concluded with desired status: "success"
        [ check  ]   "changes" concluded with desired status: "success"
        [ state  ]   "blocked" is undesirable ❌


=============
  dhth/ecscope
=============

-> checking PR #56
        ci: bump actions/download-artifact from 4 to 5
        https://github.com/dhth/ecscope/pull/56
        Created: Mon, 11 Aug 2025 02:37:57 +0000
        Updated: Mon, 11 Aug 2025 02:37:58 +0000
        [ author ]   "dependabot[bot]" is in the list of trusted authors
        [ check  ]   "custom-publish-crates" concluded with desired status: "success"
        [ check  ]   "publish-homebrew-formula" concluded with desired status: "success"
        [ check  ]   "announce" concluded with desired status: "success"
        [ check  ]   "build-local-artifacts (${{ join(matrix.targets, ', ') }})" concluded with desired status: "success"
        [ check  ]   "host" concluded with desired status: "success"
        [ check  ]   "build-global-artifacts" concluded with desired status: "success"
        [ check  ]   "back-compat" concluded with desired status: "success"
        [ check  ]   "dstlled-diff" concluded with desired status: "success"
        [ check  ]   "build-gleam" concluded with desired status: "success"
        [ check  ]   "build-rust" concluded with desired status: "success"
        [ check  ]   "publish-check" concluded with desired status: "success"
        [ check  ]   "test-gleam" concluded with desired status: "success"
        [ check  ]   "test-rust" concluded with desired status: "success"
        [ check  ]   "audit" concluded with desired status: "success"
        [ check  ]   "lint-yaml" concluded with desired status: "success"
        [ check  ]   "lint-workflows" concluded with desired status: "success"
        [ check  ]   "lint-rust" concluded with desired status: "success"
        [ check  ]   "lint-gleam" concluded with desired status: "success"
        [ check  ]   "changes" concluded with desired status: "success"
        [ check  ]   "plan" concluded with undesired status: "failure" ❌


=============
  dhth/prs
=============

-> checking PR #42
        ci: bump actions/checkout from 4 to 5
        https://github.com/dhth/prs/pull/42
        Created: Tue, 12 Aug 2025 03:16:11 +0000
        Updated: Tue, 12 Aug 2025 03:16:12 +0000
        [ author ]   "dependabot[bot]" is in the list of trusted authors
        [ check  ]   "lint-workflows" concluded with desired status: "success"
        [ check  ]   "lint-yaml" concluded with desired status: "success"
        [ check  ]   "release-check" concluded with desired status: "success"
        [ check  ]   "vulncheck" concluded with undesired status: "failure" ❌

-> checking PR #43
        build: bump github.com/cli/go-gh/v2 from 2.12.1 to 2.12.2
        https://github.com/dhth/prs/pull/43
        Created: Tue, 12 Aug 2025 03:46:53 +0000
        Updated: Tue, 12 Aug 2025 03:46:54 +0000
        [ author ]   "dependabot[bot]" is in the list of trusted authors
        [ check  ]   "lint-workflows" concluded with desired status: "success"
        [ check  ]   "release-check" concluded with desired status: "success"
        [ check  ]   "lint-yaml" concluded with desired status: "success"
        [ check  ]   "test" concluded with desired status: "success"
        [ check  ]   "vulncheck" concluded with undesired status: "failure" ❌


=============
  dhth/schemas
=============

-> checking PR #30
        ci: bump actions/checkout from 4 to 5
        https://github.com/dhth/schemas/pull/30
        Created: Tue, 12 Aug 2025 04:04:52 +0000
        Updated: Tue, 12 Aug 2025 04:04:53 +0000
        [ author ]   "dependabot[bot]" is in the list of trusted authors
        [ check  ]   "lint-yaml" concluded with desired status: "success"
        [ check  ]   "lint-workflows" concluded with desired status: "success"
        [ check  ]   "vulncheck" concluded with desired status: "success"
        [ check  ]   "test" concluded with desired status: "success"
        [ check  ]   "release-check" concluded with desired status: "success"
        [ check  ]   "build (macos-latest)" concluded with desired status: "success"
        [ check  ]   "build (ubuntu-latest)" concluded with desired status: "success"
        [ check  ]   "lint" concluded with desired status: "success"
        [ check  ]   "changes" concluded with desired status: "success"
        [ state  ]   "clean" is desirable
        PR merged! 🎉 ✅


=============
  dhth/agent1
=============

-> checking PR #3
        build: bump serde_json from 1.0.141 to 1.0.142
        https://github.com/dhth/agent1/pull/3
        Created: Fri, 1 Aug 2025 14:33:30 +0000
        Updated: Fri, 1 Aug 2025 14:33:31 +0000
        [ author ]   "dependabot[bot]" is in the list of trusted authors
        [ check  ]   "lint-workflows" concluded with desired status: "success"
        [ check  ]   "lint-yaml" concluded with desired status: "success"
        [ check  ]   "audit" concluded with desired status: "success"
        [ check  ]   "test (macos-latest)" concluded with desired status: "success"
        [ check  ]   "build (ubuntu-latest)" concluded with desired status: "success"
        [ check  ]   "test (ubuntu-latest)" concluded with desired status: "success"
        [ check  ]   "build (macos-latest)" concluded with desired status: "success"
        [ check  ]   "lint" concluded with desired status: "success"
        [ check  ]   "changes" concluded with desired status: "success"
        [ state  ]   "clean" is desirable
        PR merged! 🎉 ✅


=============
  dhth/tash
=============

-> checking PR #27
        ci: bump actions/checkout from 4 to 5
        https://github.com/dhth/tash/pull/27
        Created: Tue, 12 Aug 2025 01:57:27 +0000
        [ author ]   "dependabot[bot]" is in the list of trusted authors
        [ check  ]   "audit" concluded with desired status: "success"
        [ check  ]   "lint-workflows" concluded with desired status: "success"
        [ check  ]   "test (macos-latest)" concluded with desired status: "success"
        [ check  ]   "build (ubuntu-latest)" concluded with desired status: "success"
        [ check  ]   "lint-yaml" concluded with desired status: "success"
        [ check  ]   "test (ubuntu-latest)" concluded with desired status: "success"
        [ check  ]   "build (macos-latest)" concluded with desired status: "success"
        [ check  ]   "lint" concluded with desired status: "success"
        [ check  ]   "changes" concluded with desired status: "success"
        [ state  ]   "clean" is desirable
        PR merged! 🎉 ✅


=============
  dhth/cueitup
=============

-> checking PR #67
        ci: bump actions/checkout from 4 to 5
        https://github.com/dhth/cueitup/pull/67
        Created: Tue, 12 Aug 2025 07:15:11 +0000
        Updated: Tue, 12 Aug 2025 07:15:12 +0000
        [ author ]   "dependabot[bot]" is in the list of trusted authors
        [ check  ]   "lint-workflows" concluded with desired status: "success"
        [ check  ]   "vulncheck" concluded with desired status: "success"
        [ check  ]   "release-check" concluded with desired status: "success"
        [ check  ]   "test-go (ubuntu-latest)" concluded with desired status: "success"
        [ check  ]   "test-go (macos-latest)" concluded with desired status: "success"
        [ check  ]   "lint-yaml" concluded with desired status: "success"
        [ check  ]   "build-go (macos-latest)" concluded with desired status: "success"
        [ check  ]   "build-gleam" concluded with desired status: "success"
        [ check  ]   "build-go (ubuntu-latest)" concluded with desired status: "success"
        [ check  ]   "lint-go" concluded with desired status: "success"
        [ check  ]   "lint-gleam" concluded with desired status: "success"
        [ check  ]   "changes" concluded with desired status: "success"
        [ state  ]   "clean" is desirable
        PR merged! 🎉 ✅


=============
  dhth/tomo
=============

-> checking PR #49
        build: bump clap from 4.5.41 to 4.5.43
        https://github.com/dhth/tomo/pull/49
        Created: Tue, 12 Aug 2025 00:32:45 +0000
        Updated: Tue, 12 Aug 2025 00:32:46 +0000
        [ author ]   "dependabot[bot]" is in the list of trusted authors
        [ check  ]   "custom-release-packages" concluded with desired status: "success"
        [ check  ]   "announce" concluded with desired status: "success"
        [ check  ]   "publish-homebrew-formula" concluded with desired status: "success"
        [ check  ]   "host" concluded with desired status: "success"
        [ check  ]   "build-global-artifacts" concluded with desired status: "success"
        [ check  ]   "build-local-artifacts (${{ join(matrix.targets, ', ') }})" concluded with desired status: "success"
        [ check  ]   "dstlled-diff" concluded with desired status: "success"
        [ check  ]   "release-check" concluded with desired status: "success"
        [ check  ]   "lint-workflows" concluded with desired status: "success"
        [ check  ]   "lint-yaml" concluded with desired status: "success"
        [ check  ]   "audit" concluded with desired status: "success"
        [ check  ]   "test (ubuntu-latest)" concluded with desired status: "success"
        [ check  ]   "test (macos-latest)" concluded with desired status: "success"
        [ check  ]   "build (macos-latest)" concluded with desired status: "success"
        [ check  ]   "lint" concluded with desired status: "success"
        [ check  ]   "build (ubuntu-latest)" concluded with desired status: "success"
        [ check  ]   "changes" concluded with desired status: "success"
        [ check  ]   "plan" concluded with desired status: "success"
        [ state  ]   "clean" is desirable
        PR merged! 🎉 ✅

[INFO] This run ended at 2025-08-12 22:11:27.537404154 UTC; took 3 seconds

===========
  SUMMARY
===========

- PRs merged:                    5
- PRs disqualified:              9
- Repos checked:                 34
- Repos with no relevant PRs:    21
- Errors encountered:            0

PRs merged
---

- [dhth/schemas] ci: bump actions/checkout from 4 to 5
- [dhth/agent1] build: bump serde_json from 1.0.141 to 1.0.142
- [dhth/tash] ci: bump actions/checkout from 4 to 5
- [dhth/cueitup] ci: bump actions/checkout from 4 to 5
- [dhth/tomo] build: bump clap from 4.5.41 to 4.5.43

Disqualifications
---

- https://github.com/dhth/mult/pull/28             state: unknown
- https://github.com/dhth/mrj-runner/pull/7        state: blocked
- https://github.com/dhth/tbll/pull/48             check plan: failure
- https://github.com/dhth/dfft/pull/46             check plan: failure
- https://github.com/dhth/ting/pull/16             check plan: failure
- https://github.com/dhth/squish/pull/39           state: blocked
- https://github.com/dhth/ecscope/pull/56          check plan: failure
- https://github.com/dhth/prs/pull/42              check vulncheck: failure
- https://github.com/dhth/prs/pull/43              check vulncheck: failure